[{"persistent_id":"iTjAlveq9SQ","name":"[(R) Configuration Properties Backup Services] Push Configurations to Git","creator":"admin","soft_deleted":false,"shared":false,"scoped_name":"Push Configurations to Git","creation_time":"","last_modified":"2022-11-09 01:23:32.558822","last_modified_by":"admin","last_run":"","version":"","description":"","priority":11,"number_of_retries":0,"time_between_retries":10,"max_number_of_retries":100,"credential_type":"any","disable_result_creation":false,"restrict_to_owners":[],"vendor":"","operating_system":"","dry_run":false,"waiting_time":0,"device_query":"","device_query_property":"name","update_target_pools":false,"update_pools_after_running":false,"report":"","report_format":"text","report_jinja2_template":false,"disabled":false,"disabled_info":"","display_report":false,"email_report":false,"send_notification":false,"send_notification_method":"mail","notification_header":"","display_only_failed_nodes":false,"include_device_results":false,"include_link_in_summary":false,"mail_recipient":"","mail_subject":"","mail_sender":"","mail_bcc":"","reply_to":"","initial_payload":{},"mandatory_parametrization":false,"parameterized_form":"name = StringField('Name', [InputRequired()])\ninitial_payload = DictField()\ntarget_devices = MultipleInstanceField('Devices', model='device')\ntarget_pools = MultipleInstanceField('Pools', model='pool')\ndevice_query = StringField('Device Query', python=True, widget=TextArea(), render_kw={'rows': 2})\ndevice_query_property = SelectField('Query Property Type', choices=(('name', 'Name'), ('ip_address', 'IP address')))\nmultiprocessing = BooleanField('Multiprocessing', default=False)\nmax_processes = IntegerField('Maximum number of processes', default=15)","parameterized_form_template":"","skip":{"Regression Workflow: Operational Data Backup (admin)":true},"skip_query":"","skip_value":"success","iteration_values":"","iteration_variable_name":"iteration_value","iteration_devices":"","iteration_devices_property":"name","preprocessing":"","postprocessing":"","postprocessing_mode":"always","builder_link":"INN-WJSlXIg","log_level":1,"show_user_logs":true,"maximum_runs":1,"multiprocessing":false,"max_processes":15,"validation_condition":"none","conversion_method":"none","validation_method":"text","validation_section":"results['result']","content_match":"","content_match_regex":false,"dict_match":{},"negative_logic":false,"delete_spaces_before_matching":false,"run_method":"once","serialized":"dict_values(['', 'name', False, '', False, '', False, None, 1, '', '2022-11-09 01:23:32.558822', None, '', {}, False, \"name = StringField('Name', [InputRequired()])\\ninitial_payload = DictField()\\ntarget_devices = MultipleInstanceField('Devices', model='device')\\ntarget_pools = MultipleInstanceField('Pools', model='pool')\\ndevice_query = StringField('Device Query', python=True, widget=TextArea(), render_kw={'rows': 2})\\ndevice_query_property = SelectField('Query Property Type', choices=(('name', 'Name'), ('ip_address', 'IP address')))\\nmultiprocessing = BooleanField('Multiprocessing', default=False)\\nmax_processes = IntegerField('Maximum number of processes', default=15)\", 'text', '', False, '', 'iteration_value', False, '', '', 'none', '[(R) Configuration Properties Backup Services] Push Configurations to Git', False, {}, 'Push Configurations to Git', {'Regression Workflow: Operational Data Backup (admin)': True}, 1, 'git_service', 0, '', [], '', True, 'always', True, False, False, None, 'any', 'text', 'Automatic commit (configurations)', 'none', '', False, 'mail', 100, '', '', 'iTjAlveq9SQ', 'name', 'admin', 'success', '', '', False, False, 'once', 'Default Value', 10, False, 1, '', '', 'INN-WJSlXIg', \"results['result']\", False, False, 11, '', 0, '51245a79-e075-4747-8026-0d33c1eb826e', ['add_commit', 'pull', 'push'], '', 'Definition', False, 'network_data', False, False, False, '', False, None, True, 'admin', '', '', 15])","definition":"Definition","reserved":false,"impacting":true,"completion_time":1,"default_uuid":"51245a79-e075-4747-8026-0d33c1eb826e","mandatory_parameter":"Default Value","admin_only":false,"actions":["add_commit","pull","push"],"local_repository":"network_data","relative_path":true,"remote_repository":"","commit_message":"Automatic commit (configurations)"},{"persistent_id":"au9nXekoPYY","name":"[Dry Run: File Transfer, Ansible, Git and REST Services] Git","creator":"admin","soft_deleted":false,"shared":false,"scoped_name":"Git","creation_time":"","last_modified":"2024-05-07 11:39:55.254752","last_modified_by":"admin","last_run":"","version":"","description":"","priority":10,"number_of_retries":0,"time_between_retries":10,"max_number_of_retries":100,"credential_type":"any","disable_result_creation":false,"restrict_to_owners":[],"vendor":"","operating_system":"","dry_run":true,"waiting_time":0,"device_query":"","device_query_property":"name","update_target_pools":false,"update_pools_after_running":false,"report":"","report_format":"text","report_jinja2_template":false,"disabled":false,"disabled_info":"","display_report":false,"email_report":false,"send_notification":false,"send_notification_method":"mail","notification_header":"","display_only_failed_nodes":false,"include_device_results":false,"include_link_in_summary":false,"mail_recipient":"","mail_subject":"","mail_sender":"","mail_bcc":"","reply_to":"","initial_payload":{},"mandatory_parametrization":false,"parameterized_form":"name = StringField('Name', [InputRequired()])\ninitial_payload = DictField()\ntarget_devices = MultipleInstanceField('Devices', model='device')\ntarget_pools = MultipleInstanceField('Pools', model='pool')\ndevice_query = StringField('Device Query', python=True, widget=TextArea(), render_kw={'rows': 2})\ndevice_query_property = SelectField('Query Property Type', choices=(('name', 'Name'), ('ip_address', 'IP address')))\nmultiprocessing = BooleanField('Multiprocessing', default=False)\nmax_processes = IntegerField('Maximum number of processes', default=15)","parameterized_form_template":"","skip":{},"skip_query":"","skip_value":"success","iteration_values":"","iteration_variable_name":"iteration_value","iteration_devices":"","iteration_devices_property":"name","preprocessing":"","postprocessing":"","postprocessing_mode":"success","builder_link":"FVyiQ1TO4Wc","log_level":1,"show_user_logs":true,"maximum_runs":1,"multiprocessing":false,"max_processes":15,"validation_condition":"none","conversion_method":"none","validation_method":"text","validation_section":"results['result']","content_match":"","content_match_regex":false,"dict_match":{},"negative_logic":false,"delete_spaces_before_matching":false,"run_method":"per_device","serialized":"dict_values(['', 'name', False, '', False, '', False, None, 1, '', '2024-05-07 11:39:55.254752', None, '', {}, False, \"name = StringField('Name', [InputRequired()])\\ninitial_payload = DictField()\\ntarget_devices = MultipleInstanceField('Devices', model='device')\\ntarget_pools = MultipleInstanceField('Pools', model='pool')\\ndevice_query = StringField('Device Query', python=True, widget=TextArea(), render_kw={'rows': 2})\\ndevice_query_property = SelectField('Query Property Type', choices=(('name', 'Name'), ('ip_address', 'IP address')))\\nmultiprocessing = BooleanField('Multiprocessing', default=False)\\nmax_processes = IntegerField('Maximum number of processes', default=15)\", 'text', '', False, '', 'iteration_value', False, '/path/to/destination/{{ integer_variable }}/{{ variable2 }}', '', 'none', '[Dry Run: File Transfer, Ansible, Git and REST Services] Git', False, {}, 'Git', {}, 1, 'git_service', 0, '', [], '', False, 'success', True, False, False, None, 'any', 'text', '', 'none', '', False, 'mail', 100, '', '', 'au9nXekoPYY', 'name', 'admin', 'success', '', '', False, False, 'per_device', 'Default Value', 10, False, 1, '', '', 'FVyiQ1TO4Wc', \"results['result']\", True, False, 10, '', 0, '0edd0c83-5413-495c-98b2-672676a0ae3c', ['pull'], '', 'Definition', False, '/path/to/source/{{ variable1 }}', False, False, False, '', False, None, True, 'admin', '', '', 15])","definition":"Definition","reserved":false,"impacting":true,"completion_time":1,"default_uuid":"0edd0c83-5413-495c-98b2-672676a0ae3c","mandatory_parameter":"Default Value","admin_only":false,"actions":["pull"],"local_repository":"/path/to/source/{{ variable1 }}","relative_path":false,"remote_repository":"/path/to/destination/{{ integer_variable }}/{{ variable2 }}","commit_message":""}]