[{"persistent_id":"sdH1ApKBdv4","name":"[(R) NCClient Netconf Service] Get Full Config","creator":"admin","soft_deleted":false,"shared":false,"scoped_name":"Get Full Config","creation_time":"","last_modified":"2022-11-09 01:23:32.861742","last_modified_by":"admin","last_run":"","version":"","description":"","priority":11,"number_of_retries":0,"time_between_retries":10,"max_number_of_retries":100,"credential_type":"any","disable_result_creation":false,"restrict_to_owners":[],"vendor":"","operating_system":"","dry_run":false,"waiting_time":0,"device_query":"","device_query_property":"name","update_target_pools":false,"update_pools_after_running":false,"report":"","report_format":"text","report_jinja2_template":false,"disabled":false,"disabled_info":"","display_report":false,"email_report":false,"send_notification":false,"send_notification_method":"mail","notification_header":"","display_only_failed_nodes":false,"include_device_results":false,"include_link_in_summary":false,"mail_recipient":"","mail_subject":"","mail_sender":"","mail_bcc":"","reply_to":"","initial_payload":{},"mandatory_parametrization":false,"parameterized_form":"name = StringField('Name', [InputRequired()])\ninitial_payload = DictField()\ntarget_devices = MultipleInstanceField('Devices', model='device')\ntarget_pools = MultipleInstanceField('Pools', model='pool')\ndevice_query = StringField('Device Query', python=True, widget=TextArea(), render_kw={'rows': 2})\ndevice_query_property = SelectField('Query Property Type', choices=(('name', 'Name'), ('ip_address', 'IP address')))\nmultiprocessing = BooleanField('Multiprocessing', default=False)\nmax_processes = IntegerField('Maximum number of processes', default=15)","parameterized_form_template":"","skip":{},"skip_query":"","skip_value":"success","iteration_values":"","iteration_variable_name":"iteration_value","iteration_devices":"","iteration_devices_property":"name","preprocessing":"","postprocessing":"","postprocessing_mode":"success","builder_link":"cPTrGatA0rE","log_level":1,"show_user_logs":true,"maximum_runs":1,"multiprocessing":false,"max_processes":15,"validation_condition":"success","conversion_method":"text","validation_method":"text","validation_section":"results['result']","content_match":"ZZZZ","content_match_regex":false,"dict_match":{},"negative_logic":true,"delete_spaces_before_matching":false,"run_method":"per_device","serialized":"dict_values(['', 'name', 'running', False, False, '', False, '', False, None, 1, '', '2022-11-09 01:23:32.861742', False, None, '', {}, False, \"name = StringField('Name', [InputRequired()])\\ninitial_payload = DictField()\\ntarget_devices = MultipleInstanceField('Devices', model='device')\\ntarget_pools = MultipleInstanceField('Pools', model='pool')\\ndevice_query = StringField('Device Query', python=True, widget=TextArea(), render_kw={'rows': 2})\\ndevice_query_property = SelectField('Query Property Type', choices=(('name', 'Name'), ('ip_address', 'IP address')))\\nmultiprocessing = BooleanField('Multiprocessing', default=False)\\nmax_processes = IntegerField('Maximum number of processes', default=15)\", 'text', 'default', '', False, False, '', 'iteration_value', False, '', 'text', '', '[(R) NCClient Netconf Service] Get Full Config', False, {}, 'Get Full Config', '', True, {}, 1, 'netconf_service', None, 0, '', 'get_config', [], '', 'running', 'success', True, False, False, False, None, 'any', 'text', 'success', '', '', False, 'mail', 'running', 100, '', '', 'sdH1ApKBdv4', 'name', 'admin', 'success', '', 'ZZZZ', False, False, 'per_device', 'Default Value', 10, False, 1, '', '', 'cPTrGatA0rE', '', \"results['result']\", False, True, 11, '', 0, 'test-then-set', '390d5cdb-b7dc-4e89-996f-1cc853be90ce', '', 'Definition', False, False, False, 'merge', 'stop-on-error', False, False, '', False, None, False, 'admin', '', '', 'device', 15])","definition":"Definition","reserved":false,"impacting":false,"completion_time":1,"default_uuid":"390d5cdb-b7dc-4e89-996f-1cc853be90ce","mandatory_parameter":"Default Value","admin_only":false,"credentials":"device","custom_username":"","custom_password":"","start_new_connection":false,"connection_name":"default","close_connection":false,"nc_type":"get_config","target":"running","default_operation":"merge","test_option":"test-then-set","error_option":"stop-on-error","xml_filter":"","lock":false,"unlock":false,"commit_conf":false,"copy_source":"running","source_url":"","copy_destination":"running","destination_url":"","xml_conversion":true},{"persistent_id":"ugo8qP1wr1s","name":"[(R) NCClient Netconf Service] Set Description of Lo3 to ZZZZ","creator":"admin","soft_deleted":false,"shared":false,"scoped_name":"Set Description of Lo3 to ZZZZ","creation_time":"","last_modified":"2024-05-15 05:02:34.583317","last_modified_by":"admin","last_run":"","version":"","description":"","priority":11,"number_of_retries":0,"time_between_retries":10,"max_number_of_retries":100,"credential_type":"any","disable_result_creation":false,"restrict_to_owners":[],"vendor":"","operating_system":"","dry_run":false,"waiting_time":0,"device_query":"","device_query_property":"name","update_target_pools":false,"update_pools_after_running":false,"report":"","report_format":"text","report_jinja2_template":false,"disabled":false,"disabled_info":"","display_report":false,"email_report":false,"send_notification":false,"send_notification_method":"mail","notification_header":"","display_only_failed_nodes":false,"include_device_results":false,"include_link_in_summary":false,"mail_recipient":"","mail_subject":"","mail_sender":"","mail_bcc":"","reply_to":"","initial_payload":{},"mandatory_parametrization":false,"parameterized_form":"name = StringField('Name', [InputRequired()])\ninitial_payload = DictField()\ntarget_devices = MultipleInstanceField('Devices', model='device')\ntarget_pools = MultipleInstanceField('Pools', model='pool')\ndevice_query = StringField('Device Query', python=True, widget=TextArea(), render_kw={'rows': 2})\ndevice_query_property = SelectField('Query Property Type', choices=(('name', 'Name'), ('ip_address', 'IP address')))\nmultiprocessing = BooleanField('Multiprocessing', default=False)\nmax_processes = IntegerField('Maximum number of processes', default=15)","parameterized_form_template":"","skip":{},"skip_query":"","skip_value":"success","iteration_values":"","iteration_variable_name":"iteration_value","iteration_devices":"","iteration_devices_property":"name","preprocessing":"","postprocessing":"","postprocessing_mode":"success","builder_link":"cPTrGatA0rE","log_level":1,"show_user_logs":true,"maximum_runs":1,"multiprocessing":false,"max_processes":15,"validation_condition":"none","conversion_method":"none","validation_method":"text","validation_section":"results['result']","content_match":"","content_match_regex":false,"dict_match":{},"negative_logic":false,"delete_spaces_before_matching":false,"run_method":"per_device","serialized":"dict_values(['', 'name', 'running', False, False, '', False, '', False, None, 1, '', '2024-05-15 05:02:34.583317', False, None, '', {}, False, \"name = StringField('Name', [InputRequired()])\\ninitial_payload = DictField()\\ntarget_devices = MultipleInstanceField('Devices', model='device')\\ntarget_pools = MultipleInstanceField('Pools', model='pool')\\ndevice_query = StringField('Device Query', python=True, widget=TextArea(), render_kw={'rows': 2})\\ndevice_query_property = SelectField('Query Property Type', choices=(('name', 'Name'), ('ip_address', 'IP address')))\\nmultiprocessing = BooleanField('Multiprocessing', default=False)\\nmax_processes = IntegerField('Maximum number of processes', default=15)\", 'text', 'default', '', False, False, '', 'iteration_value', False, '', 'none', '', '[(R) NCClient Netconf Service] Set Description of Lo3 to ZZZZ', False, {}, 'Set Description of Lo3 to ZZZZ', '<nc:config xmlns:nc=\"urn:ietf:params:xml:ns:netconf:base:1.0\">\\n    <if:interfaces xmlns:if=\"urn:ietf:params:xml:ns:yang:ietf-interfaces\" xmlns:mmif=\"urn:metamako:params:xml:ns:yang:metamako-if\">\\n      <if:interface>\\n        <if:name>Loopback3</if:name>\\n        <if:config>\\n        <if:description>ZZZZ</if:description>\\n        </if:config>\\n      </if:interface>\\n    </if:interfaces>\\n    </nc:config>', True, {}, 1, 'netconf_service', None, 0, '', 'push_config', [], '', 'running', 'success', True, False, False, False, None, 'any', 'text', 'none', '', '', False, 'mail', 'running', 100, '', '', 'ugo8qP1wr1s', 'name', 'admin', 'success', '', '', False, False, 'per_device', 'Default Value', 10, False, 1, '', '', 'cPTrGatA0rE', '', \"results['result']\", False, False, 11, '', 0, 'None', '95a227bd-6ec1-456f-9fea-7913fcdbcb96', '', 'Definition', False, False, False, 'merge', 'stop-on-error', False, False, '', False, None, False, 'admin', '', '', 'device', 15])","definition":"Definition","reserved":false,"impacting":false,"completion_time":1,"default_uuid":"95a227bd-6ec1-456f-9fea-7913fcdbcb96","mandatory_parameter":"Default Value","admin_only":false,"credentials":"device","custom_username":"","custom_password":"","start_new_connection":false,"connection_name":"default","close_connection":false,"nc_type":"push_config","target":"running","default_operation":"merge","test_option":"None","error_option":"stop-on-error","xml_filter":"<nc:config xmlns:nc=\"urn:ietf:params:xml:ns:netconf:base:1.0\">\n    <if:interfaces xmlns:if=\"urn:ietf:params:xml:ns:yang:ietf-interfaces\" xmlns:mmif=\"urn:metamako:params:xml:ns:yang:metamako-if\">\n      <if:interface>\n        <if:name>Loopback3</if:name>\n        <if:config>\n        <if:description>ZZZZ</if:description>\n        </if:config>\n      </if:interface>\n    </if:interfaces>\n    </nc:config>","lock":false,"unlock":false,"commit_conf":false,"copy_source":"running","source_url":"","copy_destination":"running","destination_url":"","xml_conversion":true},{"persistent_id":"acNrCGCYfsw","name":"[(R) NCClient Netconf Service] Check for ZZZZ in Config","creator":"admin","soft_deleted":false,"shared":false,"scoped_name":"Check for ZZZZ in Config","creation_time":"","last_modified":"2022-11-09 01:23:32.870254","last_modified_by":"admin","last_run":"","version":"","description":"","priority":11,"number_of_retries":0,"time_between_retries":10,"max_number_of_retries":100,"credential_type":"any","disable_result_creation":false,"restrict_to_owners":[],"vendor":"","operating_system":"","dry_run":false,"waiting_time":0,"device_query":"","device_query_property":"name","update_target_pools":false,"update_pools_after_running":false,"report":"","report_format":"text","report_jinja2_template":false,"disabled":false,"disabled_info":"","display_report":false,"email_report":false,"send_notification":false,"send_notification_method":"mail","notification_header":"","display_only_failed_nodes":false,"include_device_results":false,"include_link_in_summary":false,"mail_recipient":"","mail_subject":"","mail_sender":"","mail_bcc":"","reply_to":"","initial_payload":{},"mandatory_parametrization":false,"parameterized_form":"name = StringField('Name', [InputRequired()])\ninitial_payload = DictField()\ntarget_devices = MultipleInstanceField('Devices', model='device')\ntarget_pools = MultipleInstanceField('Pools', model='pool')\ndevice_query = StringField('Device Query', python=True, widget=TextArea(), render_kw={'rows': 2})\ndevice_query_property = SelectField('Query Property Type', choices=(('name', 'Name'), ('ip_address', 'IP address')))\nmultiprocessing = BooleanField('Multiprocessing', default=False)\nmax_processes = IntegerField('Maximum number of processes', default=15)","parameterized_form_template":"","skip":{},"skip_query":"","skip_value":"success","iteration_values":"","iteration_variable_name":"iteration_value","iteration_devices":"","iteration_devices_property":"name","preprocessing":"","postprocessing":"","postprocessing_mode":"success","builder_link":"cPTrGatA0rE","log_level":1,"show_user_logs":true,"maximum_runs":1,"multiprocessing":false,"max_processes":15,"validation_condition":"success","conversion_method":"text","validation_method":"text","validation_section":"results['result']","content_match":"ZZZZ","content_match_regex":false,"dict_match":{},"negative_logic":false,"delete_spaces_before_matching":false,"run_method":"per_device","serialized":"dict_values(['', 'name', 'running', False, False, '', False, '', False, None, 1, '', '2022-11-09 01:23:32.870254', False, None, '', {}, False, \"name = StringField('Name', [InputRequired()])\\ninitial_payload = DictField()\\ntarget_devices = MultipleInstanceField('Devices', model='device')\\ntarget_pools = MultipleInstanceField('Pools', model='pool')\\ndevice_query = StringField('Device Query', python=True, widget=TextArea(), render_kw={'rows': 2})\\ndevice_query_property = SelectField('Query Property Type', choices=(('name', 'Name'), ('ip_address', 'IP address')))\\nmultiprocessing = BooleanField('Multiprocessing', default=False)\\nmax_processes = IntegerField('Maximum number of processes', default=15)\", 'text', 'default', '', False, False, '', 'iteration_value', False, '', 'text', '', '[(R) NCClient Netconf Service] Check for ZZZZ in Config', False, {}, 'Check for ZZZZ in Config', '', True, {}, 1, 'netconf_service', None, 0, '', 'get_config', [], '', 'running', 'success', True, False, False, False, None, 'any', 'text', 'success', '', '', False, 'mail', 'running', 100, '', '', 'acNrCGCYfsw', 'name', 'admin', 'success', '', 'ZZZZ', False, False, 'per_device', 'Default Value', 10, False, 1, '', '', 'cPTrGatA0rE', '', \"results['result']\", False, False, 11, '', 0, 'test-then-set', '94fe140d-b0e8-447b-bda7-a1ccb4a7f31c', '', 'Definition', False, False, False, 'merge', 'stop-on-error', False, False, '', False, None, False, 'admin', '', '', 'device', 15])","definition":"Definition","reserved":false,"impacting":false,"completion_time":1,"default_uuid":"94fe140d-b0e8-447b-bda7-a1ccb4a7f31c","mandatory_parameter":"Default Value","admin_only":false,"credentials":"device","custom_username":"","custom_password":"","start_new_connection":false,"connection_name":"default","close_connection":false,"nc_type":"get_config","target":"running","default_operation":"merge","test_option":"test-then-set","error_option":"stop-on-error","xml_filter":"","lock":false,"unlock":false,"commit_conf":false,"copy_source":"running","source_url":"","copy_destination":"running","destination_url":"","xml_conversion":true},{"persistent_id":"V9h8sWlZX8Q","name":"[(R) NCClient Netconf Service] Erase Lo3 Description","creator":"admin","soft_deleted":false,"shared":false,"scoped_name":"Erase Lo3 Description","creation_time":"","last_modified":"2024-05-15 05:02:44.752841","last_modified_by":"admin","last_run":"","version":"","description":"","priority":11,"number_of_retries":0,"time_between_retries":10,"max_number_of_retries":100,"credential_type":"any","disable_result_creation":false,"restrict_to_owners":[],"vendor":"","operating_system":"","dry_run":false,"waiting_time":0,"device_query":"","device_query_property":"name","update_target_pools":false,"update_pools_after_running":false,"report":"","report_format":"text","report_jinja2_template":false,"disabled":false,"disabled_info":"","display_report":false,"email_report":false,"send_notification":false,"send_notification_method":"mail","notification_header":"","display_only_failed_nodes":false,"include_device_results":false,"include_link_in_summary":false,"mail_recipient":"","mail_subject":"","mail_sender":"","mail_bcc":"","reply_to":"","initial_payload":{},"mandatory_parametrization":false,"parameterized_form":"name = StringField('Name', [InputRequired()])\ninitial_payload = DictField()\ntarget_devices = MultipleInstanceField('Devices', model='device')\ntarget_pools = MultipleInstanceField('Pools', model='pool')\ndevice_query = StringField('Device Query', python=True, widget=TextArea(), render_kw={'rows': 2})\ndevice_query_property = SelectField('Query Property Type', choices=(('name', 'Name'), ('ip_address', 'IP address')))\nmultiprocessing = BooleanField('Multiprocessing', default=False)\nmax_processes = IntegerField('Maximum number of processes', default=15)","parameterized_form_template":"","skip":{},"skip_query":"","skip_value":"success","iteration_values":"","iteration_variable_name":"iteration_value","iteration_devices":"","iteration_devices_property":"name","preprocessing":"","postprocessing":"","postprocessing_mode":"success","builder_link":"cPTrGatA0rE","log_level":1,"show_user_logs":true,"maximum_runs":1,"multiprocessing":false,"max_processes":15,"validation_condition":"none","conversion_method":"none","validation_method":"text","validation_section":"results['result']","content_match":"","content_match_regex":false,"dict_match":{},"negative_logic":false,"delete_spaces_before_matching":false,"run_method":"per_device","serialized":"dict_values(['', 'name', 'running', False, False, '', False, '', False, None, 1, '', '2024-05-15 05:02:44.752841', False, None, '', {}, False, \"name = StringField('Name', [InputRequired()])\\ninitial_payload = DictField()\\ntarget_devices = MultipleInstanceField('Devices', model='device')\\ntarget_pools = MultipleInstanceField('Pools', model='pool')\\ndevice_query = StringField('Device Query', python=True, widget=TextArea(), render_kw={'rows': 2})\\ndevice_query_property = SelectField('Query Property Type', choices=(('name', 'Name'), ('ip_address', 'IP address')))\\nmultiprocessing = BooleanField('Multiprocessing', default=False)\\nmax_processes = IntegerField('Maximum number of processes', default=15)\", 'text', 'default', '', False, False, '', 'iteration_value', False, '', 'none', '', '[(R) NCClient Netconf Service] Erase Lo3 Description', False, {}, 'Erase Lo3 Description', '<nc:config xmlns:nc=\"urn:ietf:params:xml:ns:netconf:base:1.0\">\\n    <if:interfaces xmlns:if=\"urn:ietf:params:xml:ns:yang:ietf-interfaces\" xmlns:mmif=\"urn:metamako:params:xml:ns:yang:metamako-if\">\\n      <if:interface>\\n        <if:name>Loopback3</if:name>\\n        <if:config>\\n        <if:description>None</if:description>\\n        </if:config>\\n      </if:interface>\\n    </if:interfaces>\\n    </nc:config>', True, {}, 1, 'netconf_service', None, 0, '', 'push_config', [], '', 'running', 'success', True, False, False, False, None, 'any', 'text', 'none', '', '', False, 'mail', 'running', 100, '', '', 'V9h8sWlZX8Q', 'name', 'admin', 'success', '', '', False, False, 'per_device', 'Default Value', 10, False, 1, '', '', 'cPTrGatA0rE', '', \"results['result']\", False, False, 11, '', 0, 'None', '3282cc8e-0555-42c1-8e91-ff74c76c3d01', '', 'Definition', False, False, False, 'merge', 'stop-on-error', False, False, '', False, None, False, 'admin', '', '', 'device', 15])","definition":"Definition","reserved":false,"impacting":false,"completion_time":1,"default_uuid":"3282cc8e-0555-42c1-8e91-ff74c76c3d01","mandatory_parameter":"Default Value","admin_only":false,"credentials":"device","custom_username":"","custom_password":"","start_new_connection":false,"connection_name":"default","close_connection":false,"nc_type":"push_config","target":"running","default_operation":"merge","test_option":"None","error_option":"stop-on-error","xml_filter":"<nc:config xmlns:nc=\"urn:ietf:params:xml:ns:netconf:base:1.0\">\n    <if:interfaces xmlns:if=\"urn:ietf:params:xml:ns:yang:ietf-interfaces\" xmlns:mmif=\"urn:metamako:params:xml:ns:yang:metamako-if\">\n      <if:interface>\n        <if:name>Loopback3</if:name>\n        <if:config>\n        <if:description>None</if:description>\n        </if:config>\n      </if:interface>\n    </if:interfaces>\n    </nc:config>","lock":false,"unlock":false,"commit_conf":false,"copy_source":"running","source_url":"","copy_destination":"running","destination_url":"","xml_conversion":true},{"persistent_id":"D7J0f43z4UY","name":"[(R) NCClient Netconf Service] Check ZZZZ is not in Config","creator":"admin","soft_deleted":false,"shared":false,"scoped_name":"Check ZZZZ is not in Config","creation_time":"","last_modified":"2022-11-09 01:23:32.874856","last_modified_by":"admin","last_run":"","version":"","description":"","priority":11,"number_of_retries":0,"time_between_retries":10,"max_number_of_retries":100,"credential_type":"any","disable_result_creation":false,"restrict_to_owners":[],"vendor":"","operating_system":"","dry_run":false,"waiting_time":0,"device_query":"","device_query_property":"name","update_target_pools":false,"update_pools_after_running":false,"report":"","report_format":"text","report_jinja2_template":false,"disabled":false,"disabled_info":"","display_report":false,"email_report":false,"send_notification":false,"send_notification_method":"mail","notification_header":"","display_only_failed_nodes":false,"include_device_results":false,"include_link_in_summary":false,"mail_recipient":"","mail_subject":"","mail_sender":"","mail_bcc":"","reply_to":"","initial_payload":{},"mandatory_parametrization":false,"parameterized_form":"name = StringField('Name', [InputRequired()])\ninitial_payload = DictField()\ntarget_devices = MultipleInstanceField('Devices', model='device')\ntarget_pools = MultipleInstanceField('Pools', model='pool')\ndevice_query = StringField('Device Query', python=True, widget=TextArea(), render_kw={'rows': 2})\ndevice_query_property = SelectField('Query Property Type', choices=(('name', 'Name'), ('ip_address', 'IP address')))\nmultiprocessing = BooleanField('Multiprocessing', default=False)\nmax_processes = IntegerField('Maximum number of processes', default=15)","parameterized_form_template":"","skip":{},"skip_query":"","skip_value":"success","iteration_values":"","iteration_variable_name":"iteration_value","iteration_devices":"","iteration_devices_property":"name","preprocessing":"","postprocessing":"","postprocessing_mode":"success","builder_link":"cPTrGatA0rE","log_level":1,"show_user_logs":true,"maximum_runs":1,"multiprocessing":false,"max_processes":15,"validation_condition":"success","conversion_method":"text","validation_method":"text","validation_section":"results['result']","content_match":"ZZZZ","content_match_regex":false,"dict_match":{},"negative_logic":true,"delete_spaces_before_matching":false,"run_method":"per_device","serialized":"dict_values(['', 'name', 'running', False, False, '', False, '', False, None, 1, '', '2022-11-09 01:23:32.874856', False, None, '', {}, False, \"name = StringField('Name', [InputRequired()])\\ninitial_payload = DictField()\\ntarget_devices = MultipleInstanceField('Devices', model='device')\\ntarget_pools = MultipleInstanceField('Pools', model='pool')\\ndevice_query = StringField('Device Query', python=True, widget=TextArea(), render_kw={'rows': 2})\\ndevice_query_property = SelectField('Query Property Type', choices=(('name', 'Name'), ('ip_address', 'IP address')))\\nmultiprocessing = BooleanField('Multiprocessing', default=False)\\nmax_processes = IntegerField('Maximum number of processes', default=15)\", 'text', 'default', '', False, False, '', 'iteration_value', False, '', 'text', '', '[(R) NCClient Netconf Service] Check ZZZZ is not in Config', False, {}, 'Check ZZZZ is not in Config', '', True, {}, 1, 'netconf_service', None, 0, '', 'get_config', [], '', 'running', 'success', True, False, False, False, None, 'any', 'text', 'success', '', '', False, 'mail', 'running', 100, '', '', 'D7J0f43z4UY', 'name', 'admin', 'success', '', 'ZZZZ', False, False, 'per_device', 'Default Value', 10, False, 1, '', '', 'cPTrGatA0rE', '', \"results['result']\", False, True, 11, '', 0, 'test-then-set', '9ff6c8ae-ea0c-4d2d-8bfa-c4b463596db3', '', 'Definition', False, False, False, 'merge', 'stop-on-error', False, False, '', False, None, False, 'admin', '', '', 'device', 15])","definition":"Definition","reserved":false,"impacting":false,"completion_time":1,"default_uuid":"9ff6c8ae-ea0c-4d2d-8bfa-c4b463596db3","mandatory_parameter":"Default Value","admin_only":false,"credentials":"device","custom_username":"","custom_password":"","start_new_connection":false,"connection_name":"default","close_connection":false,"nc_type":"get_config","target":"running","default_operation":"merge","test_option":"test-then-set","error_option":"stop-on-error","xml_filter":"","lock":false,"unlock":false,"commit_conf":false,"copy_source":"running","source_url":"","copy_destination":"running","destination_url":"","xml_conversion":true},{"persistent_id":"FtVT7n-fMLM","name":"[Dry Run: Topology Import, Netconf, and Ping Services] Netconf","creator":"admin","soft_deleted":false,"shared":false,"scoped_name":"Netconf","creation_time":"","last_modified":"2024-02-28 16:45:56.660477","last_modified_by":"admin","last_run":"","version":"","description":"","priority":10,"number_of_retries":0,"time_between_retries":10,"max_number_of_retries":100,"credential_type":"any","disable_result_creation":false,"restrict_to_owners":[],"vendor":"","operating_system":"","dry_run":true,"waiting_time":0,"device_query":"","device_query_property":"name","update_target_pools":false,"update_pools_after_running":false,"report":"","report_format":"text","report_jinja2_template":false,"disabled":false,"disabled_info":"","display_report":false,"email_report":false,"send_notification":false,"send_notification_method":"mail","notification_header":"","display_only_failed_nodes":false,"include_device_results":false,"include_link_in_summary":false,"mail_recipient":"","mail_subject":"","mail_sender":"","mail_bcc":"","reply_to":"","initial_payload":{},"mandatory_parametrization":false,"parameterized_form":"name = StringField('Name', [InputRequired()])\ninitial_payload = DictField()\ntarget_devices = MultipleInstanceField('Devices', model='device')\ntarget_pools = MultipleInstanceField('Pools', model='pool')\ndevice_query = StringField('Device Query', python=True, widget=TextArea(), render_kw={'rows': 2})\ndevice_query_property = SelectField('Query Property Type', choices=(('name', 'Name'), ('ip_address', 'IP address')))\nmultiprocessing = BooleanField('Multiprocessing', default=False)\nmax_processes = IntegerField('Maximum number of processes', default=15)","parameterized_form_template":"","skip":{},"skip_query":"","skip_value":"success","iteration_values":"","iteration_variable_name":"iteration_value","iteration_devices":"","iteration_devices_property":"name","preprocessing":"","postprocessing":"","postprocessing_mode":"success","builder_link":"_BOdvjA3Y-I","log_level":1,"show_user_logs":true,"maximum_runs":1,"multiprocessing":false,"max_processes":15,"validation_condition":"none","conversion_method":"none","validation_method":"text","validation_section":"results['result']","content_match":"","content_match_regex":false,"dict_match":{},"negative_logic":false,"delete_spaces_before_matching":false,"run_method":"per_device","serialized":"dict_values(['', 'name', 'running', False, False, '', False, '', False, None, 1, '', '2024-02-28 16:45:56.660477', False, None, '', {}, False, \"name = StringField('Name', [InputRequired()])\\ninitial_payload = DictField()\\ntarget_devices = MultipleInstanceField('Devices', model='device')\\ntarget_pools = MultipleInstanceField('Pools', model='pool')\\ndevice_query = StringField('Device Query', python=True, widget=TextArea(), render_kw={'rows': 2})\\ndevice_query_property = SelectField('Query Property Type', choices=(('name', 'Name'), ('ip_address', 'IP address')))\\nmultiprocessing = BooleanField('Multiprocessing', default=False)\\nmax_processes = IntegerField('Maximum number of processes', default=15)\", 'text', 'default', '', False, False, '', 'iteration_value', False, '', 'none', '', '[Dry Run: Topology Import, Netconf, and Ping Services] Netconf', False, {}, 'Netconf', 'test var1 {{ variable1 }}\\ntest var2 {{ variable2 }}', True, {}, 1, 'netconf_service', None, 0, '', 'get_filtered_config', [], '', 'running', 'success', True, False, False, False, None, 'any', 'text', 'none', '', '', False, 'mail', 'running', 100, '', '', 'FtVT7n-fMLM', 'name', 'admin', 'success', '', '', False, False, 'per_device', 'Default Value', 10, False, 1, '', '', '_BOdvjA3Y-I', '', \"results['result']\", True, False, 10, '', 0, 'test-then-set', '4562296c-8628-4dce-897f-98b6146a3ba6', '', 'Definition', False, False, False, 'merge', 'stop-on-error', False, False, '', False, None, True, 'admin', '', '', 'device', 15])","definition":"Definition","reserved":false,"impacting":true,"completion_time":1,"default_uuid":"4562296c-8628-4dce-897f-98b6146a3ba6","mandatory_parameter":"Default Value","admin_only":false,"credentials":"device","custom_username":"","custom_password":"","start_new_connection":false,"connection_name":"default","close_connection":false,"nc_type":"get_filtered_config","target":"running","default_operation":"merge","test_option":"test-then-set","error_option":"stop-on-error","xml_filter":"test var1 {{ variable1 }}\ntest var2 {{ variable2 }}","lock":false,"unlock":false,"commit_conf":false,"copy_source":"running","source_url":"","copy_destination":"running","destination_url":"","xml_conversion":true}]