[
  {
    "admin_only": false,
    "auth_timeout": 0.0,
    "banner_timeout": 15.0,
    "builder_link": "",
    "close_connection": false,
    "cmd_verify": false,
    "command": "show vrf a",
    "completion_time": 1,
    "config_mode": false,
    "confirmation1": "Protocols",
    "confirmation2": "Interfaces",
    "confirmation3": "bipbipbop",
    "conn_timeout": 10.0,
    "connection_name": "default",
    "content_match": "",
    "content_match_regex": false,
    "conversion_method": "text",
    "creation_time": "",
    "creator": "admin",
    "credential_type": "any",
    "credentials": "device",
    "custom_password": "",
    "custom_username": "",
    "default_uuid": "e9c246f3-6be1-4ce5-abff-f3c121b984c0",
    "definition": "Definition",
    "delete_spaces_before_matching": false,
    "description": "",
    "device_query": "",
    "device_query_property": "ip_address",
    "dict_match": {},
    "disable_result_creation": false,
    "disabled": false,
    "disabled_info": "",
    "display_only_failed_nodes": false,
    "display_report": false,
    "driver": "device",
    "dry_run": false,
    "email_report": false,
    "enable_mode": true,
    "exit_command": "",
    "expect_password_prompt": "",
    "expect_prompt": "",
    "expect_string": "",
    "expect_username_prompt": "",
    "global_delay_factor": 0.1,
    "high_performance": false,
    "impacting": true,
    "include_device_results": true,
    "include_link_in_summary": false,
    "initial_payload": {},
    "iteration_devices": "",
    "iteration_devices_property": "name",
    "iteration_values": "",
    "iteration_variable_name": "iteration_value",
    "jump_command": "",
    "jump_on_connect": false,
    "jump_password": "",
    "jump_username": "",
    "last_modified": "2022-11-09 01:23:32.281059",
    "last_modified_by": "admin",
    "last_run": "",
    "log_level": 1,
    "mail_bcc": "",
    "mail_recipient": "",
    "mail_sender": "",
    "mail_subject": "",
    "mandatory_parameter": "Default Value",
    "mandatory_parametrization": false,
    "max_number_of_retries": 100,
    "max_processes": 15,
    "maximum_runs": 2,
    "multiprocessing": false,
    "name": "[(R) Netmiko Prompts Service] Test Netmiko Prompt Service",
    "negative_logic": false,
    "notification_header": "",
    "number_of_retries": 0,
    "operating_system": "",
    "parameterized_form": "name = StringField('Name', [InputRequired()])\ninitial_payload = DictField()\ntarget_devices = MultipleInstanceField('Devices', model='device')\ntarget_pools = MultipleInstanceField('Pools', model='pool')\ndevice_query = StringField('Device Query', python=True, widget=TextArea(), render_kw={'rows': 2})\ndevice_query_property = SelectField('Query Property Type', choices=(('name', 'Name'), ('ip_address', 'IP address')))\nmultiprocessing = BooleanField('Multiprocessing', default=False)\nmax_processes = IntegerField('Maximum number of processes', default=15)",
    "parameterized_form_template": "",
    "persistent_id": "xPApkOtSlGU",
    "postprocessing": "",
    "postprocessing_mode": "always",
    "preprocessing": "",
    "priority": 11,
    "read_timeout": 10.0,
    "reply_to": "",
    "report": "",
    "report_format": "text",
    "report_jinja2_template": false,
    "reserved": false,
    "response1": "show vrf b",
    "response2": "show vrf c",
    "response3": "",
    "restrict_to_owners": [],
    "run_method": "per_device",
    "scoped_name": "Test Netmiko Prompt Service",
    "send_notification": false,
    "send_notification_method": "mail",
    "serialized": "dict_values(['', 0.0, 'name', '', False, '', False, '', False, None, 1, '', '2022-11-09 01:23:32.281059', False, None, '', {}, False, \"name = StringField('Name', [InputRequired()])\\ninitial_payload = DictField()\\ntarget_devices = MultipleInstanceField('Devices', model='device')\\ntarget_pools = MultipleInstanceField('Pools', model='pool')\\ndevice_query = StringField('Device Query', python=True, widget=TextArea(), render_kw={'rows': 2})\\ndevice_query_property = SelectField('Query Property Type', choices=(('name', 'Name'), ('ip_address', 'IP address')))\\nmultiprocessing = BooleanField('Multiprocessing', default=False)\\nmax_processes = IntegerField('Maximum number of processes', default=15)\", 'text', 'default', 'show vrf c', '', '', False, False, '', 'iteration_value', False, '', '', 'text', '', True, '[(R) Netmiko Prompts Service] Test Netmiko Prompt Service', '', False, {}, 'Test Netmiko Prompt Service', False, {}, 2, 'netmiko_prompts_service', 'show vrf b', None, 0, '', [], '', 'bipbipbop', 'always', True, 10.0, False, False, None, 'any', 'text', False, 'none', '', False, 'mail', 10.0, 100, '', '', 'xPApkOtSlGU', 'ip_address', 'admin', 'success', '', '', True, False, 'per_device', 'Default Value', 10, 'Protocols', False, 1, '', 15.0, '', '', '', False, \"results['result']\", False, False, 11, '', 0, 'Interfaces', 'e9c246f3-6be1-4ce5-abff-f3c121b984c0', '', 'Definition', False, False, 'show vrf a', 0.1, False, False, '', '', '', False, None, True, 'admin', '', '', 'device', '', 'device', 15])",
    "shared": false,
    "show_user_logs": true,
    "skip": {},
    "skip_query": "",
    "skip_value": "success",
    "soft_deleted": false,
    "start_new_connection": false,
    "time_between_retries": 10,
    "update_target_pools": false,
    "validation_condition": "none",
    "validation_method": "text",
    "validation_section": "results['result']",
    "vendor": "",
    "version": "",
    "waiting_time": 0
  },
  {
    "admin_only": false,
    "auth_timeout": 0.0,
    "banner_timeout": 15.0,
    "builder_link": "",
    "close_connection": false,
    "cmd_verify": false,
    "command": "show vrf",
    "completion_time": 1,
    "config_mode": false,
    "confirmation1": "Protocols",
    "confirmation2": "Interfaces",
    "confirmation3": "",
    "conn_timeout": 10.0,
    "connection_name": "default",
    "content_match": "",
    "content_match_regex": false,
    "conversion_method": "text",
    "creation_time": "",
    "creator": "admin",
    "credential_type": "any",
    "credentials": "device",
    "custom_password": "",
    "custom_username": "",
    "default_uuid": "8c92c8ea-6a16-416c-9a76-b761a1bfbc5e",
    "definition": "Definition",
    "delete_spaces_before_matching": false,
    "description": "",
    "device_query": "",
    "device_query_property": "ip_address",
    "dict_match": {},
    "disable_result_creation": false,
    "disabled": false,
    "disabled_info": "",
    "display_only_failed_nodes": false,
    "display_report": false,
    "driver": "device",
    "dry_run": false,
    "email_report": false,
    "enable_mode": true,
    "exit_command": "",
    "expect_password_prompt": "",
    "expect_prompt": "",
    "expect_string": "",
    "expect_username_prompt": "",
    "global_delay_factor": 0.1,
    "high_performance": false,
    "impacting": true,
    "include_device_results": true,
    "include_link_in_summary": false,
    "initial_payload": {},
    "iteration_devices": "",
    "iteration_devices_property": "name",
    "iteration_values": "",
    "iteration_variable_name": "iteration_value",
    "jump_command": "",
    "jump_on_connect": false,
    "jump_password": "",
    "jump_username": "",
    "last_modified": "2022-11-09 01:23:32.287602",
    "last_modified_by": "admin",
    "last_run": "",
    "log_level": 1,
    "mail_bcc": "",
    "mail_recipient": "",
    "mail_sender": "",
    "mail_subject": "",
    "mandatory_parameter": "Default Value",
    "mandatory_parametrization": false,
    "max_number_of_retries": 100,
    "max_processes": 15,
    "maximum_runs": 1,
    "multiprocessing": false,
    "name": "[(R) Netmiko Prompts Service] Test netmiko prompts pass",
    "negative_logic": false,
    "notification_header": "",
    "number_of_retries": 0,
    "operating_system": "",
    "parameterized_form": "name = StringField('Name', [InputRequired()])\ninitial_payload = DictField()\ntarget_devices = MultipleInstanceField('Devices', model='device')\ntarget_pools = MultipleInstanceField('Pools', model='pool')\ndevice_query = StringField('Device Query', python=True, widget=TextArea(), render_kw={'rows': 2})\ndevice_query_property = SelectField('Query Property Type', choices=(('name', 'Name'), ('ip_address', 'IP address')))\nmultiprocessing = BooleanField('Multiprocessing', default=False)\nmax_processes = IntegerField('Maximum number of processes', default=15)",
    "parameterized_form_template": "",
    "persistent_id": "RqAU6sQYl1M",
    "postprocessing": "",
    "postprocessing_mode": "always",
    "preprocessing": "",
    "priority": 11,
    "read_timeout": 10.0,
    "reply_to": "",
    "report": "",
    "report_format": "text",
    "report_jinja2_template": false,
    "reserved": false,
    "response1": "show vrf",
    "response2": "",
    "response3": "",
    "restrict_to_owners": [],
    "run_method": "per_device",
    "scoped_name": "Test netmiko prompts pass",
    "send_notification": false,
    "send_notification_method": "mail",
    "serialized": "dict_values(['', 0.0, 'name', '', False, '', False, '', False, None, 1, '', '2022-11-09 01:23:32.287602', False, None, '', {}, False, \"name = StringField('Name', [InputRequired()])\\ninitial_payload = DictField()\\ntarget_devices = MultipleInstanceField('Devices', model='device')\\ntarget_pools = MultipleInstanceField('Pools', model='pool')\\ndevice_query = StringField('Device Query', python=True, widget=TextArea(), render_kw={'rows': 2})\\ndevice_query_property = SelectField('Query Property Type', choices=(('name', 'Name'), ('ip_address', 'IP address')))\\nmultiprocessing = BooleanField('Multiprocessing', default=False)\\nmax_processes = IntegerField('Maximum number of processes', default=15)\", 'text', 'default', '', '', '', False, False, '', 'iteration_value', False, '', '', 'text', '', True, '[(R) Netmiko Prompts Service] Test netmiko prompts pass', '', False, {}, 'Test netmiko prompts pass', False, {}, 1, 'netmiko_prompts_service', 'show vrf', None, 0, '', [], '', '', 'always', True, 10.0, False, False, None, 'any', 'text', False, 'none', '', False, 'mail', 10.0, 100, '', '', 'RqAU6sQYl1M', 'ip_address', 'admin', 'success', '', '', True, False, 'per_device', 'Default Value', 10, 'Protocols', False, 1, '', 15.0, '', '', '', False, \"results['result']\", False, False, 11, '', 0, 'Interfaces', '8c92c8ea-6a16-416c-9a76-b761a1bfbc5e', '', 'Definition', False, False, 'show vrf', 0.1, False, False, '', '', '', False, None, True, 'admin', '', '', 'device', '', 'device', 15])",
    "shared": false,
    "show_user_logs": true,
    "skip": {},
    "skip_query": "",
    "skip_value": "success",
    "soft_deleted": false,
    "start_new_connection": false,
    "time_between_retries": 10,
    "update_target_pools": false,
    "validation_condition": "none",
    "validation_method": "text",
    "validation_section": "results['result']",
    "vendor": "",
    "version": "",
    "waiting_time": 0
  },
  {
    "admin_only": false,
    "auth_timeout": 0.0,
    "banner_timeout": 15.0,
    "builder_link": "PblTtswsUWQ",
    "close_connection": false,
    "cmd_verify": false,
    "command": "test command1 {{ variable1 }}",
    "completion_time": 1,
    "config_mode": false,
    "confirmation1": "",
    "confirmation2": "",
    "confirmation3": "",
    "conn_timeout": 10.0,
    "connection_name": "default",
    "content_match": "",
    "content_match_regex": false,
    "conversion_method": "none",
    "creation_time": "",
    "creator": "admin",
    "credential_type": "any",
    "credentials": "device",
    "custom_password": "",
    "custom_username": "",
    "default_uuid": "ba8ae44b-e8f5-4493-9466-5630205d1d23",
    "definition": "Definition",
    "delete_spaces_before_matching": false,
    "description": "",
    "device_query": "",
    "device_query_property": "name",
    "dict_match": {},
    "disable_result_creation": false,
    "disabled": false,
    "disabled_info": "",
    "display_only_failed_nodes": false,
    "display_report": false,
    "driver": "device",
    "dry_run": true,
    "email_report": false,
    "enable_mode": true,
    "exit_command": "exit",
    "expect_password_prompt": "password",
    "expect_prompt": "admin.*$",
    "expect_string": "",
    "expect_username_prompt": "username:",
    "global_delay_factor": 0.1,
    "high_performance": false,
    "impacting": true,
    "include_device_results": false,
    "include_link_in_summary": false,
    "initial_payload": {},
    "iteration_devices": "",
    "iteration_devices_property": "name",
    "iteration_values": "",
    "iteration_variable_name": "iteration_value",
    "jump_command": "ssh jump_server_IP",
    "jump_on_connect": false,
    "jump_password": "",
    "jump_username": "",
    "last_modified": "2024-02-07 04:38:51.871007",
    "last_modified_by": "admin",
    "last_run": "",
    "log_level": 1,
    "mail_bcc": "",
    "mail_recipient": "",
    "mail_sender": "",
    "mail_subject": "",
    "mandatory_parameter": "Default Value",
    "mandatory_parametrization": false,
    "max_number_of_retries": 100,
    "max_processes": 15,
    "maximum_runs": 1,
    "multiprocessing": false,
    "name": "[Dry Run: Netmiko Services] Prompts",
    "negative_logic": false,
    "notification_header": "",
    "number_of_retries": 0,
    "operating_system": "",
    "parameterized_form": "name = StringField('Name', [InputRequired()])\ninitial_payload = DictField()\ntarget_devices = MultipleInstanceField('Devices', model='device')\ntarget_pools = MultipleInstanceField('Pools', model='pool')\ndevice_query = StringField('Device Query', python=True, widget=TextArea(), render_kw={'rows': 2})\ndevice_query_property = SelectField('Query Property Type', choices=(('name', 'Name'), ('ip_address', 'IP address')))\nmultiprocessing = BooleanField('Multiprocessing', default=False)\nmax_processes = IntegerField('Maximum number of processes', default=15)",
    "parameterized_form_template": "",
    "persistent_id": "vRt8MD07BYU",
    "postprocessing": "",
    "postprocessing_mode": "success",
    "preprocessing": "",
    "priority": 10,
    "read_timeout": 10.0,
    "reply_to": "",
    "report": "",
    "report_format": "text",
    "report_jinja2_template": false,
    "reserved": false,
    "response1": "test command2 response {{ variable2 }}",
    "response2": "",
    "response3": "",
    "restrict_to_owners": [],
    "run_method": "per_device",
    "scoped_name": "Prompts",
    "send_notification": false,
    "send_notification_method": "mail",
    "serialized": "dict_values(['', 0.0, 'name', 'admin.*$', False, '', False, '', False, None, 1, '', '2024-02-07 04:38:51.871007', False, None, '', {}, False, \"name = StringField('Name', [InputRequired()])\\ninitial_payload = DictField()\\ntarget_devices = MultipleInstanceField('Devices', model='device')\\ntarget_pools = MultipleInstanceField('Pools', model='pool')\\ndevice_query = StringField('Device Query', python=True, widget=TextArea(), render_kw={'rows': 2})\\ndevice_query_property = SelectField('Query Property Type', choices=(('name', 'Name'), ('ip_address', 'IP address')))\\nmultiprocessing = BooleanField('Multiprocessing', default=False)\\nmax_processes = IntegerField('Maximum number of processes', default=15)\", 'text', 'default', '', 'password', '', False, False, '', 'iteration_value', False, 'exit', '', 'none', '', True, '[Dry Run: Netmiko Services] Prompts', 'username:', False, {}, 'Prompts', False, {}, 1, 'netmiko_prompts_service', 'test command2 response {{ variable2 }}', None, 0, '', [], '', '', 'success', True, 10.0, False, False, None, 'any', 'text', False, 'none', '', False, 'mail', 10.0, 100, '', '', 'vRt8MD07BYU', 'name', 'admin', 'success', '', '', False, False, 'per_device', 'Default Value', 10, '', False, 1, '', 15.0, '', '', 'PblTtswsUWQ', False, \"results['result']\", True, False, 10, '', 0, '', 'ba8ae44b-e8f5-4493-9466-5630205d1d23', '', 'Definition', False, False, 'test command1 {{ variable1 }}', 0.1, False, False, '', '', '', False, None, True, 'admin', '', 'ssh jump_server_IP', 'device', '', 'device', 15])",
    "shared": false,
    "show_user_logs": true,
    "skip": {},
    "skip_query": "",
    "skip_value": "success",
    "soft_deleted": false,
    "start_new_connection": false,
    "time_between_retries": 10,
    "update_target_pools": false,
    "validation_condition": "none",
    "validation_method": "text",
    "validation_section": "results['result']",
    "vendor": "",
    "version": "",
    "waiting_time": 0
  }
]