[{"persistent_id":"PCSfsOkHlX4","name":"[(R) Netmiko Configuration and Validation Services] netmiko_check_vrf_test","creator":"admin","soft_deleted":false,"shared":false,"scoped_name":"netmiko_check_vrf_test","creation_time":"","last_modified":"2022-11-09 01:23:32.248725","last_modified_by":"admin","last_run":"","version":"","description":"Check that the vrf \"test\" is configured","priority":11,"number_of_retries":0,"time_between_retries":10,"max_number_of_retries":100,"credential_type":"any","disable_result_creation":false,"restrict_to_owners":[],"vendor":"Arista","operating_system":"EOS","dry_run":false,"waiting_time":0,"device_query":"","device_query_property":"ip_address","update_target_pools":false,"update_pools_after_running":false,"report":"","report_format":"text","report_jinja2_template":false,"disabled":false,"disabled_info":"","display_report":false,"email_report":false,"send_notification":false,"send_notification_method":"mail","notification_header":"","display_only_failed_nodes":true,"include_device_results":true,"include_link_in_summary":true,"mail_recipient":"","mail_subject":"","mail_sender":"","mail_bcc":"","reply_to":"","initial_payload":{},"mandatory_parametrization":false,"parameterized_form":"name = StringField('Name', [InputRequired()])\ninitial_payload = DictField()\ntarget_devices = MultipleInstanceField('Devices', model='device')\ntarget_pools = MultipleInstanceField('Pools', model='pool')\ndevice_query = StringField('Device Query', python=True, widget=TextArea(), render_kw={'rows': 2})\ndevice_query_property = SelectField('Query Property Type', choices=(('name', 'Name'), ('ip_address', 'IP address')))\nmultiprocessing = BooleanField('Multiprocessing', default=False)\nmax_processes = IntegerField('Maximum number of processes', default=15)","parameterized_form_template":"","skip":{},"skip_query":"","skip_value":"success","iteration_values":"","iteration_variable_name":"iteration_value","iteration_devices":"","iteration_devices_property":"ip_address","preprocessing":"","postprocessing":"","postprocessing_mode":"always","builder_link":"","log_level":1,"show_user_logs":true,"maximum_runs":1,"multiprocessing":false,"max_processes":5,"validation_condition":"success","conversion_method":"text","validation_method":"text","validation_section":"results['result']","content_match":"test","content_match_regex":false,"dict_match":{},"negative_logic":false,"delete_spaces_before_matching":false,"run_method":"per_device","serialized":"dict_values(['', True, 0.0, 'ip_address', True, '', False, '', False, '', True, None, 1, '', '2022-11-09 01:23:32.248725', True, None, 'Check that the vrf \"test\" is configured', {}, True, \"name = StringField('Name', [InputRequired()])\\ninitial_payload = DictField()\\ntarget_devices = MultipleInstanceField('Devices', model='device')\\ntarget_pools = MultipleInstanceField('Pools', model='pool')\\ndevice_query = StringField('Device Query', python=True, widget=TextArea(), render_kw={'rows': 2})\\ndevice_query_property = SelectField('Query Property Type', choices=(('name', 'Name'), ('ip_address', 'IP address')))\\nmultiprocessing = BooleanField('Multiprocessing', default=False)\\nmax_processes = IntegerField('Maximum number of processes', default=15)\", 'text', 'default', True, '', '', False, False, '', 'iteration_value', False, '', '', 'text', '', True, '[(R) Netmiko Configuration and Validation Services] netmiko_check_vrf_test', '', False, {}, 'netmiko_check_vrf_test', False, {}, 1, 'netmiko_commands_service', None, 0, 'show vrf', '', [], '', 'always', '', True, 10.0, False, False, None, 'any', 'text', False, False, 'success', False, '', False, 'mail', 10.0, 100, 'Arista', '', 'PCSfsOkHlX4', 'ip_address', 'admin', 'success', '', 'test', True, False, 'per_device', 'Default Value', 10, False, False, 1, '', 15.0, '', '', '', \"results['result']\", False, False, 11, 'EOS', 0, '80ad614c-8f49-4328-af54-b920697aabbb', '', 'Definition', False, False, False, 0.1, False, False, '', '', False, None, True, 'admin', '', '', 'device', '', 'device', 5])","definition":"Definition","reserved":false,"impacting":true,"completion_time":1,"default_uuid":"80ad614c-8f49-4328-af54-b920697aabbb","mandatory_parameter":"Default Value","admin_only":false,"credentials":"device","custom_username":"","custom_password":"","start_new_connection":false,"connection_name":"default","close_connection":true,"enable_mode":true,"config_mode":false,"commands":"show vrf","jinja2_template":false,"results_as_list":false,"driver":"device","use_textfsm":false,"use_genie":false,"read_timeout":10.0,"conn_timeout":10.0,"auth_timeout":0.0,"banner_timeout":15.0,"global_delay_factor":0.1,"expect_string":"","config_mode_command":"","auto_find_prompt":true,"strip_prompt":true,"strip_command":true,"jump_on_connect":false,"jump_command":"","jump_username":"","jump_password":"","exit_command":"","expect_username_prompt":"","expect_password_prompt":"","expect_prompt":""},{"persistent_id":"hAuRC3iPvp0","name":"[Shared] Netmiko: Check VRF (Telecom1) does not exist","creator":"admin","soft_deleted":false,"shared":true,"scoped_name":"Netmiko: Check VRF (Telecom1) does not exist","creation_time":"","last_modified":"2022-11-09 01:23:32.258744","last_modified_by":"admin","last_run":"","version":"","description":"Check that the vrf \"test\" is NOT configured","priority":11,"number_of_retries":2,"time_between_retries":1,"max_number_of_retries":100,"credential_type":"any","disable_result_creation":false,"restrict_to_owners":[],"vendor":"Arista","operating_system":"EOS","dry_run":false,"waiting_time":0,"device_query":"","device_query_property":"ip_address","update_target_pools":false,"update_pools_after_running":false,"report":"","report_format":"text","report_jinja2_template":false,"disabled":false,"disabled_info":"","display_report":false,"email_report":false,"send_notification":false,"send_notification_method":"mail","notification_header":"","display_only_failed_nodes":true,"include_device_results":true,"include_link_in_summary":true,"mail_recipient":"","mail_subject":"","mail_sender":"","mail_bcc":"","reply_to":"","initial_payload":{},"mandatory_parametrization":false,"parameterized_form":"name = StringField('Name', [InputRequired()])\ninitial_payload = DictField()\ntarget_devices = MultipleInstanceField('Devices', model='device')\ntarget_pools = MultipleInstanceField('Pools', model='pool')\ndevice_query = StringField('Device Query', python=True, widget=TextArea(), render_kw={'rows': 2})\ndevice_query_property = SelectField('Query Property Type', choices=(('name', 'Name'), ('ip_address', 'IP address')))\nmultiprocessing = BooleanField('Multiprocessing', default=False)\nmax_processes = IntegerField('Maximum number of processes', default=15)","parameterized_form_template":"","skip":{},"skip_query":"","skip_value":"success","iteration_values":"","iteration_variable_name":"iteration_value","iteration_devices":"","iteration_devices_property":"ip_address","preprocessing":"","postprocessing":"","postprocessing_mode":"always","builder_link":"","log_level":1,"show_user_logs":true,"maximum_runs":1,"multiprocessing":false,"max_processes":5,"validation_condition":"success","conversion_method":"text","validation_method":"text","validation_section":"results['result']","content_match":"Telecom1","content_match_regex":true,"dict_match":{},"negative_logic":true,"delete_spaces_before_matching":false,"run_method":"per_device","serialized":"dict_values(['', True, 0.0, 'ip_address', True, '', False, '', False, '', True, None, 1, '', '2022-11-09 01:23:32.258744', False, None, 'Check that the vrf \"test\" is NOT configured', {}, True, \"name = StringField('Name', [InputRequired()])\\ninitial_payload = DictField()\\ntarget_devices = MultipleInstanceField('Devices', model='device')\\ntarget_pools = MultipleInstanceField('Pools', model='pool')\\ndevice_query = StringField('Device Query', python=True, widget=TextArea(), render_kw={'rows': 2})\\ndevice_query_property = SelectField('Query Property Type', choices=(('name', 'Name'), ('ip_address', 'IP address')))\\nmultiprocessing = BooleanField('Multiprocessing', default=False)\\nmax_processes = IntegerField('Maximum number of processes', default=15)\", 'text', 'default', True, '', '', True, False, '', 'iteration_value', False, '', '', 'text', '', True, '[Shared] Netmiko: Check VRF (Telecom1) does not exist', '', True, {}, 'Netmiko: Check VRF (Telecom1) does not exist', False, {}, 1, 'netmiko_commands_service', None, 2, 'show vrf', '', [], '', 'always', '', True, 10.0, False, True, None, 'any', 'text', False, False, 'success', False, '', False, 'mail', 10.0, 100, 'Arista', '', 'hAuRC3iPvp0', 'ip_address', 'admin', 'success', '', 'Telecom1', True, False, 'per_device', 'Default Value', 1, False, False, 1, '', 15.0, '', '', '', \"results['result']\", False, True, 11, 'EOS', 0, 'd4461d18-e869-438b-9e59-f7da32ba7a33', '', 'Definition', False, False, False, 0.1, False, False, '', '', False, None, True, 'admin', '', '', 'device', '', 'device', 5])","definition":"Definition","reserved":false,"impacting":true,"completion_time":1,"default_uuid":"d4461d18-e869-438b-9e59-f7da32ba7a33","mandatory_parameter":"Default Value","admin_only":false,"credentials":"device","custom_username":"","custom_password":"","start_new_connection":true,"connection_name":"default","close_connection":false,"enable_mode":true,"config_mode":false,"commands":"show vrf","jinja2_template":false,"results_as_list":false,"driver":"device","use_textfsm":false,"use_genie":false,"read_timeout":10.0,"conn_timeout":10.0,"auth_timeout":0.0,"banner_timeout":15.0,"global_delay_factor":0.1,"expect_string":"","config_mode_command":"","auto_find_prompt":true,"strip_prompt":true,"strip_command":true,"jump_on_connect":false,"jump_command":"","jump_username":"","jump_password":"","exit_command":"","expect_username_prompt":"","expect_password_prompt":"","expect_prompt":""},{"persistent_id":"K6oFVXG9Sns","name":"[(R) Functions: get_var, set_var, and get_result] Show vrf with payload helper","creator":"admin","soft_deleted":false,"shared":false,"scoped_name":"Show vrf with payload helper","creation_time":"","last_modified":"2022-11-09 01:23:32.296905","last_modified_by":"admin","last_run":"","version":"","description":"","priority":11,"number_of_retries":0,"time_between_retries":10,"max_number_of_retries":100,"credential_type":"any","disable_result_creation":false,"restrict_to_owners":[],"vendor":"","operating_system":"","dry_run":false,"waiting_time":0,"device_query":"","device_query_property":"ip_address","update_target_pools":false,"update_pools_after_running":false,"report":"","report_format":"text","report_jinja2_template":false,"disabled":false,"disabled_info":"","display_report":false,"email_report":false,"send_notification":false,"send_notification_method":"mail","notification_header":"","display_only_failed_nodes":false,"include_device_results":true,"include_link_in_summary":false,"mail_recipient":"","mail_subject":"","mail_sender":"","mail_bcc":"","reply_to":"","initial_payload":{},"mandatory_parametrization":false,"parameterized_form":"name = StringField('Name', [InputRequired()])\ninitial_payload = DictField()\ntarget_devices = MultipleInstanceField('Devices', model='device')\ntarget_pools = MultipleInstanceField('Pools', model='pool')\ndevice_query = StringField('Device Query', python=True, widget=TextArea(), render_kw={'rows': 2})\ndevice_query_property = SelectField('Query Property Type', choices=(('name', 'Name'), ('ip_address', 'IP address')))\nmultiprocessing = BooleanField('Multiprocessing', default=False)\nmax_processes = IntegerField('Maximum number of processes', default=15)","parameterized_form_template":"","skip":{},"skip_query":"","skip_value":"success","iteration_values":"","iteration_variable_name":"iteration_value","iteration_devices":"get_var(\"iteration_device\", device=parent_device.name)","iteration_devices_property":"name","preprocessing":"","postprocessing":"","postprocessing_mode":"always","builder_link":"","log_level":1,"show_user_logs":true,"maximum_runs":1,"multiprocessing":false,"max_processes":15,"validation_condition":"none","conversion_method":"text","validation_method":"text","validation_section":"results['result']","content_match":"","content_match_regex":false,"dict_match":{},"negative_logic":false,"delete_spaces_before_matching":false,"run_method":"per_device","serialized":"dict_values(['', True, 0.0, 'name', True, '', False, '', False, '', False, None, 1, '', '2022-11-09 01:23:32.296905', False, None, '', {}, False, \"name = StringField('Name', [InputRequired()])\\ninitial_payload = DictField()\\ntarget_devices = MultipleInstanceField('Devices', model='device')\\ntarget_pools = MultipleInstanceField('Pools', model='pool')\\ndevice_query = StringField('Device Query', python=True, widget=TextArea(), render_kw={'rows': 2})\\ndevice_query_property = SelectField('Query Property Type', choices=(('name', 'Name'), ('ip_address', 'IP address')))\\nmultiprocessing = BooleanField('Multiprocessing', default=False)\\nmax_processes = IntegerField('Maximum number of processes', default=15)\", 'text', 'default', True, '', '', False, False, '', 'iteration_value', False, '', '', 'text', '', True, '[(R) Functions: get_var, set_var, and get_result] Show vrf with payload helper', '', False, {}, 'Show vrf with payload helper', False, {}, 1, 'netmiko_commands_service', None, 0, 'show vrf {{iteration_simple}}', '', [], 'get_var(\"iteration_device\", device=parent_device.name)', 'always', '', True, 10.0, False, False, None, 'any', 'text', False, False, 'none', False, '', False, 'mail', 10.0, 100, '', '', 'K6oFVXG9Sns', 'ip_address', 'admin', 'success', '', '', True, False, 'per_device', 'Default Value', 10, False, False, 1, '', 15.0, '', '', '', \"results['result']\", False, False, 11, '', 0, '101f2f66-3a8e-43fb-a911-236a07654e6d', '', 'Definition', False, False, False, 0.1, False, False, '', '', False, None, True, 'admin', '', '', 'device', '', 'device', 15])","definition":"Definition","reserved":false,"impacting":true,"completion_time":1,"default_uuid":"101f2f66-3a8e-43fb-a911-236a07654e6d","mandatory_parameter":"Default Value","admin_only":false,"credentials":"device","custom_username":"","custom_password":"","start_new_connection":false,"connection_name":"default","close_connection":false,"enable_mode":true,"config_mode":false,"commands":"show vrf {{iteration_simple}}","jinja2_template":false,"results_as_list":false,"driver":"device","use_textfsm":false,"use_genie":false,"read_timeout":10.0,"conn_timeout":10.0,"auth_timeout":0.0,"banner_timeout":15.0,"global_delay_factor":0.1,"expect_string":"","config_mode_command":"","auto_find_prompt":true,"strip_prompt":true,"strip_command":true,"jump_on_connect":false,"jump_command":"","jump_username":"","jump_password":"","exit_command":"","expect_username_prompt":"","expect_password_prompt":"","expect_prompt":""},{"persistent_id":"TE8nvegNOPg","name":"[(R) Functions: get_var, set_var, and get_result] Show vrf with python query","creator":"admin","soft_deleted":false,"shared":false,"scoped_name":"Show vrf with python query","creation_time":"","last_modified":"2022-11-09 01:23:32.302026","last_modified_by":"admin","last_run":"","version":"","description":"","priority":11,"number_of_retries":0,"time_between_retries":10,"max_number_of_retries":100,"credential_type":"any","disable_result_creation":false,"restrict_to_owners":[],"vendor":"","operating_system":"","dry_run":false,"waiting_time":0,"device_query":"","device_query_property":"ip_address","update_target_pools":false,"update_pools_after_running":false,"report":"","report_format":"text","report_jinja2_template":false,"disabled":false,"disabled_info":"","display_report":false,"email_report":false,"send_notification":false,"send_notification_method":"mail","notification_header":"","display_only_failed_nodes":false,"include_device_results":true,"include_link_in_summary":false,"mail_recipient":"","mail_subject":"","mail_sender":"","mail_bcc":"","reply_to":"","initial_payload":{},"mandatory_parametrization":false,"parameterized_form":"name = StringField('Name', [InputRequired()])\ninitial_payload = DictField()\ntarget_devices = MultipleInstanceField('Devices', model='device')\ntarget_pools = MultipleInstanceField('Pools', model='pool')\ndevice_query = StringField('Device Query', python=True, widget=TextArea(), render_kw={'rows': 2})\ndevice_query_property = SelectField('Query Property Type', choices=(('name', 'Name'), ('ip_address', 'IP address')))\nmultiprocessing = BooleanField('Multiprocessing', default=False)\nmax_processes = IntegerField('Maximum number of processes', default=15)","parameterized_form_template":"","skip":{},"skip_query":"","skip_value":"success","iteration_values":"","iteration_variable_name":"iteration_value","iteration_devices":"[get_var(\"iteration_simple\")]","iteration_devices_property":"ip_address","preprocessing":"","postprocessing":"","postprocessing_mode":"always","builder_link":"","log_level":1,"show_user_logs":true,"maximum_runs":1,"multiprocessing":false,"max_processes":15,"validation_condition":"none","conversion_method":"text","validation_method":"text","validation_section":"results['result']","content_match":"","content_match_regex":false,"dict_match":{},"negative_logic":false,"delete_spaces_before_matching":false,"run_method":"per_device","serialized":"dict_values(['', True, 0.0, 'ip_address', True, '', False, '', False, '', False, None, 1, '', '2022-11-09 01:23:32.302026', False, None, '', {}, False, \"name = StringField('Name', [InputRequired()])\\ninitial_payload = DictField()\\ntarget_devices = MultipleInstanceField('Devices', model='device')\\ntarget_pools = MultipleInstanceField('Pools', model='pool')\\ndevice_query = StringField('Device Query', python=True, widget=TextArea(), render_kw={'rows': 2})\\ndevice_query_property = SelectField('Query Property Type', choices=(('name', 'Name'), ('ip_address', 'IP address')))\\nmultiprocessing = BooleanField('Multiprocessing', default=False)\\nmax_processes = IntegerField('Maximum number of processes', default=15)\", 'text', 'default', True, '', '', False, False, '', 'iteration_value', False, '', '', 'text', '', True, '[(R) Functions: get_var, set_var, and get_result] Show vrf with python query', '', False, {}, 'Show vrf with python query', False, {}, 1, 'netmiko_commands_service', None, 0, 'show vrf test', '', [], '[get_var(\"iteration_simple\")]', 'always', '', True, 10.0, False, False, None, 'any', 'text', False, False, 'none', False, '', False, 'mail', 10.0, 100, '', '', 'TE8nvegNOPg', 'ip_address', 'admin', 'success', '', '', True, False, 'per_device', 'Default Value', 10, False, False, 1, '', 15.0, '', '', '', \"results['result']\", False, False, 11, '', 0, '369c7240-61c1-489d-83c6-6b5a0715cfac', '', 'Definition', False, False, False, 0.1, False, False, '', '', False, None, True, 'admin', '', '', 'device', '', 'device', 15])","definition":"Definition","reserved":false,"impacting":true,"completion_time":1,"default_uuid":"369c7240-61c1-489d-83c6-6b5a0715cfac","mandatory_parameter":"Default Value","admin_only":false,"credentials":"device","custom_username":"","custom_password":"","start_new_connection":false,"connection_name":"default","close_connection":false,"enable_mode":true,"config_mode":false,"commands":"show vrf test","jinja2_template":false,"results_as_list":false,"driver":"device","use_textfsm":false,"use_genie":false,"read_timeout":10.0,"conn_timeout":10.0,"auth_timeout":0.0,"banner_timeout":15.0,"global_delay_factor":0.1,"expect_string":"","config_mode_command":"","auto_find_prompt":true,"strip_prompt":true,"strip_command":true,"jump_on_connect":false,"jump_command":"","jump_username":"","jump_password":"","exit_command":"","expect_username_prompt":"","expect_password_prompt":"","expect_prompt":""},{"persistent_id":"iNJIAOYEfkc","name":"[(R) Functions: get_var, set_var, and get_result] show runtime with get_result helper","creator":"admin","soft_deleted":false,"shared":false,"scoped_name":"show runtime with get_result helper","creation_time":"","last_modified":"2022-11-09 01:23:32.305729","last_modified_by":"admin","last_run":"","version":"","description":"","priority":11,"number_of_retries":0,"time_between_retries":10,"max_number_of_retries":100,"credential_type":"any","disable_result_creation":false,"restrict_to_owners":[],"vendor":"","operating_system":"","dry_run":false,"waiting_time":0,"device_query":"","device_query_property":"ip_address","update_target_pools":false,"update_pools_after_running":false,"report":"","report_format":"text","report_jinja2_template":false,"disabled":false,"disabled_info":"","display_report":false,"email_report":false,"send_notification":false,"send_notification_method":"mail","notification_header":"","display_only_failed_nodes":false,"include_device_results":true,"include_link_in_summary":false,"mail_recipient":"","mail_subject":"","mail_sender":"","mail_bcc":"","reply_to":"","initial_payload":{},"mandatory_parametrization":false,"parameterized_form":"name = StringField('Name', [InputRequired()])\ninitial_payload = DictField()\ntarget_devices = MultipleInstanceField('Devices', model='device')\ntarget_pools = MultipleInstanceField('Pools', model='pool')\ndevice_query = StringField('Device Query', python=True, widget=TextArea(), render_kw={'rows': 2})\ndevice_query_property = SelectField('Query Property Type', choices=(('name', 'Name'), ('ip_address', 'IP address')))\nmultiprocessing = BooleanField('Multiprocessing', default=False)\nmax_processes = IntegerField('Maximum number of processes', default=15)","parameterized_form_template":"","skip":{},"skip_query":"","skip_value":"success","iteration_values":"","iteration_variable_name":"iteration_value","iteration_devices":"","iteration_devices_property":"name","preprocessing":"","postprocessing":"","postprocessing_mode":"always","builder_link":"","log_level":1,"show_user_logs":true,"maximum_runs":1,"multiprocessing":false,"max_processes":15,"validation_condition":"none","conversion_method":"text","validation_method":"text","validation_section":"results['result']","content_match":"","content_match_regex":false,"dict_match":{},"negative_logic":false,"delete_spaces_before_matching":false,"run_method":"per_device","serialized":"dict_values(['', True, 0.0, 'name', True, '', False, '', False, '', False, None, 1, '', '2022-11-09 01:23:32.305729', False, None, '', {}, False, \"name = StringField('Name', [InputRequired()])\\ninitial_payload = DictField()\\ntarget_devices = MultipleInstanceField('Devices', model='device')\\ntarget_pools = MultipleInstanceField('Pools', model='pool')\\ndevice_query = StringField('Device Query', python=True, widget=TextArea(), render_kw={'rows': 2})\\ndevice_query_property = SelectField('Query Property Type', choices=(('name', 'Name'), ('ip_address', 'IP address')))\\nmultiprocessing = BooleanField('Multiprocessing', default=False)\\nmax_processes = IntegerField('Maximum number of processes', default=15)\", 'text', 'default', True, '', '', False, False, '', 'iteration_value', False, '', '', 'text', '', True, '[(R) Functions: get_var, set_var, and get_result] show runtime with get_result helper', '', False, {}, 'show runtime with get_result helper', False, {}, 1, 'netmiko_commands_service', None, 0, 'show vrf {{get_result(\"Modify payload (per device)\", device=device.name)[\"duration\"]}}', '', [], '', 'always', '', True, 10.0, False, False, None, 'any', 'text', False, False, 'none', False, '', False, 'mail', 10.0, 100, '', '', 'iNJIAOYEfkc', 'ip_address', 'admin', 'success', '', '', True, False, 'per_device', 'Default Value', 10, False, False, 1, '', 15.0, '', '', '', \"results['result']\", False, False, 11, '', 0, 'b1ad55ee-05df-408f-803c-69b99542c9a4', '', 'Definition', False, False, False, 0.1, False, False, '', '', False, None, True, 'admin', '', '', 'device', '', 'device', 15])","definition":"Definition","reserved":false,"impacting":true,"completion_time":1,"default_uuid":"b1ad55ee-05df-408f-803c-69b99542c9a4","mandatory_parameter":"Default Value","admin_only":false,"credentials":"device","custom_username":"","custom_password":"","start_new_connection":false,"connection_name":"default","close_connection":false,"enable_mode":true,"config_mode":false,"commands":"show vrf {{get_result(\"Modify payload (per device)\", device=device.name)[\"duration\"]}}","jinja2_template":false,"results_as_list":false,"driver":"device","use_textfsm":false,"use_genie":false,"read_timeout":10.0,"conn_timeout":10.0,"auth_timeout":0.0,"banner_timeout":15.0,"global_delay_factor":0.1,"expect_string":"","config_mode_command":"","auto_find_prompt":true,"strip_prompt":true,"strip_command":true,"jump_on_connect":false,"jump_command":"","jump_username":"","jump_password":"","exit_command":"","expect_username_prompt":"","expect_password_prompt":"","expect_prompt":""},{"persistent_id":"fJmhua3tiJ4","name":"[(R) Combined Device & Target Iteration] Iteration Targets Workflow - Test 1","creator":"admin","soft_deleted":false,"shared":false,"scoped_name":"Iteration Targets Workflow - Test 1","creation_time":"","last_modified":"2022-11-09 01:23:32.324135","last_modified_by":"admin","last_run":"","version":"","description":"Check the iteration mechanism (interfaces)","priority":11,"number_of_retries":0,"time_between_retries":10,"max_number_of_retries":100,"credential_type":"any","disable_result_creation":false,"restrict_to_owners":[],"vendor":"Arista","operating_system":"EOS","dry_run":false,"waiting_time":0,"device_query":"","device_query_property":"ip_address","update_target_pools":false,"update_pools_after_running":false,"report":"","report_format":"text","report_jinja2_template":false,"disabled":false,"disabled_info":"","display_report":false,"email_report":false,"send_notification":false,"send_notification_method":"mail","notification_header":"","display_only_failed_nodes":true,"include_device_results":true,"include_link_in_summary":true,"mail_recipient":"","mail_subject":"","mail_sender":"","mail_bcc":"","reply_to":"","initial_payload":{},"mandatory_parametrization":false,"parameterized_form":"name = StringField('Name', [InputRequired()])\ninitial_payload = DictField()\ntarget_devices = MultipleInstanceField('Devices', model='device')\ntarget_pools = MultipleInstanceField('Pools', model='pool')\ndevice_query = StringField('Device Query', python=True, widget=TextArea(), render_kw={'rows': 2})\ndevice_query_property = SelectField('Query Property Type', choices=(('name', 'Name'), ('ip_address', 'IP address')))\nmultiprocessing = BooleanField('Multiprocessing', default=False)\nmax_processes = IntegerField('Maximum number of processes', default=15)","parameterized_form_template":"","skip":{},"skip_query":"","skip_value":"success","iteration_values":"[\"Loopback11\",\"Loopback15\"]","iteration_variable_name":"non_default_iteration_value_name","iteration_devices":"get_var(\"Derived Devices\", device=device.name)","iteration_devices_property":"name","preprocessing":"","postprocessing":"","postprocessing_mode":"always","builder_link":"","log_level":1,"show_user_logs":true,"maximum_runs":1,"multiprocessing":false,"max_processes":5,"validation_condition":"success","conversion_method":"text","validation_method":"text","validation_section":"results['result']","content_match":"does not exist","content_match_regex":false,"dict_match":{},"negative_logic":false,"delete_spaces_before_matching":false,"run_method":"per_device","serialized":"dict_values(['', True, 0.0, 'name', True, '', False, '', False, '', True, None, 1, '', '2022-11-09 01:23:32.324135', False, None, 'Check the iteration mechanism (interfaces)', {}, True, \"name = StringField('Name', [InputRequired()])\\ninitial_payload = DictField()\\ntarget_devices = MultipleInstanceField('Devices', model='device')\\ntarget_pools = MultipleInstanceField('Pools', model='pool')\\ndevice_query = StringField('Device Query', python=True, widget=TextArea(), render_kw={'rows': 2})\\ndevice_query_property = SelectField('Query Property Type', choices=(('name', 'Name'), ('ip_address', 'IP address')))\\nmultiprocessing = BooleanField('Multiprocessing', default=False)\\nmax_processes = IntegerField('Maximum number of processes', default=15)\", 'text', 'default', True, '', '', False, False, '', 'non_default_iteration_value_name', False, '', '', 'text', '', True, '[(R) Combined Device & Target Iteration] Iteration Targets Workflow - Test 1', '', False, {}, 'Iteration Targets Workflow - Test 1', False, {}, 1, 'netmiko_commands_service', None, 0, 'show interface {{non_default_iteration_value_name}}', '', [], 'get_var(\"Derived Devices\", device=device.name)', 'always', '', True, 10.0, False, False, None, 'any', 'text', False, False, 'success', False, '', False, 'mail', 10.0, 100, 'Arista', '', 'fJmhua3tiJ4', 'ip_address', 'admin', 'success', '', 'does not exist', True, False, 'per_device', 'Default Value', 10, False, False, 1, '', 15.0, '', '', '', \"results['result']\", False, False, 11, 'EOS', 0, '471d0603-85ba-43a4-b84e-7200c3e85650', '', 'Definition', False, False, False, 0.1, False, False, '', '', False, None, True, 'admin', '[\"Loopback11\",\"Loopback15\"]', '', 'device', '', 'device', 5])","definition":"Definition","reserved":false,"impacting":true,"completion_time":1,"default_uuid":"471d0603-85ba-43a4-b84e-7200c3e85650","mandatory_parameter":"Default Value","admin_only":false,"credentials":"device","custom_username":"","custom_password":"","start_new_connection":false,"connection_name":"default","close_connection":false,"enable_mode":true,"config_mode":false,"commands":"show interface {{non_default_iteration_value_name}}","jinja2_template":false,"results_as_list":false,"driver":"device","use_textfsm":false,"use_genie":false,"read_timeout":10.0,"conn_timeout":10.0,"auth_timeout":0.0,"banner_timeout":15.0,"global_delay_factor":0.1,"expect_string":"","config_mode_command":"","auto_find_prompt":true,"strip_prompt":true,"strip_command":true,"jump_on_connect":false,"jump_command":"","jump_username":"","jump_password":"","exit_command":"","expect_username_prompt":"","expect_password_prompt":"","expect_prompt":""},{"persistent_id":"ZkirYTdVmVI","name":"[(R) Combined Device & Target Iteration] Iteration Target Workflow - Test 2","creator":"admin","soft_deleted":false,"shared":false,"scoped_name":"Iteration Target Workflow - Test 2","creation_time":"","last_modified":"2022-11-09 01:23:32.327752","last_modified_by":"admin","last_run":"","version":"","description":"Check the iteration mechanism (interfaces)","priority":11,"number_of_retries":0,"time_between_retries":10,"max_number_of_retries":100,"credential_type":"any","disable_result_creation":false,"restrict_to_owners":[],"vendor":"Arista","operating_system":"EOS","dry_run":false,"waiting_time":0,"device_query":"","device_query_property":"ip_address","update_target_pools":false,"update_pools_after_running":false,"report":"","report_format":"text","report_jinja2_template":false,"disabled":false,"disabled_info":"","display_report":false,"email_report":false,"send_notification":false,"send_notification_method":"mail","notification_header":"","display_only_failed_nodes":true,"include_device_results":true,"include_link_in_summary":true,"mail_recipient":"","mail_subject":"","mail_sender":"","mail_bcc":"","reply_to":"","initial_payload":{},"mandatory_parametrization":false,"parameterized_form":"name = StringField('Name', [InputRequired()])\ninitial_payload = DictField()\ntarget_devices = MultipleInstanceField('Devices', model='device')\ntarget_pools = MultipleInstanceField('Pools', model='pool')\ndevice_query = StringField('Device Query', python=True, widget=TextArea(), render_kw={'rows': 2})\ndevice_query_property = SelectField('Query Property Type', choices=(('name', 'Name'), ('ip_address', 'IP address')))\nmultiprocessing = BooleanField('Multiprocessing', default=False)\nmax_processes = IntegerField('Maximum number of processes', default=15)","parameterized_form_template":"","skip":{},"skip_query":"","skip_value":"success","iteration_values":"get_var('Interfaces 1', device=device.name)","iteration_variable_name":"iteration_value","iteration_devices":"","iteration_devices_property":"ip_address","preprocessing":"","postprocessing":"","postprocessing_mode":"always","builder_link":"","log_level":1,"show_user_logs":true,"maximum_runs":1,"multiprocessing":false,"max_processes":5,"validation_condition":"success","conversion_method":"text","validation_method":"text","validation_section":"results['result']","content_match":"does not exist","content_match_regex":false,"dict_match":{},"negative_logic":false,"delete_spaces_before_matching":false,"run_method":"per_device","serialized":"dict_values(['', True, 0.0, 'ip_address', True, '', False, '', False, '', True, None, 1, '', '2022-11-09 01:23:32.327752', False, None, 'Check the iteration mechanism (interfaces)', {}, True, \"name = StringField('Name', [InputRequired()])\\ninitial_payload = DictField()\\ntarget_devices = MultipleInstanceField('Devices', model='device')\\ntarget_pools = MultipleInstanceField('Pools', model='pool')\\ndevice_query = StringField('Device Query', python=True, widget=TextArea(), render_kw={'rows': 2})\\ndevice_query_property = SelectField('Query Property Type', choices=(('name', 'Name'), ('ip_address', 'IP address')))\\nmultiprocessing = BooleanField('Multiprocessing', default=False)\\nmax_processes = IntegerField('Maximum number of processes', default=15)\", 'text', 'default', True, '', '', False, False, '', 'iteration_value', False, '', '', 'text', '', True, '[(R) Combined Device & Target Iteration] Iteration Target Workflow - Test 2', '', False, {}, 'Iteration Target Workflow - Test 2', False, {}, 1, 'netmiko_commands_service', None, 0, 'show interface {{iteration_value}}', '', [], '', 'always', '', True, 10.0, False, False, None, 'any', 'text', False, False, 'success', False, '', False, 'mail', 10.0, 100, 'Arista', '', 'ZkirYTdVmVI', 'ip_address', 'admin', 'success', '', 'does not exist', True, False, 'per_device', 'Default Value', 10, False, False, 1, '', 15.0, '', '', '', \"results['result']\", False, False, 11, 'EOS', 0, 'f4f6dd23-2fab-4b7d-ad9c-0fc348915e63', '', 'Definition', False, False, False, 0.1, False, False, '', '', False, None, True, 'admin', \"get_var('Interfaces 1', device=device.name)\", '', 'device', '', 'device', 5])","definition":"Definition","reserved":false,"impacting":true,"completion_time":1,"default_uuid":"f4f6dd23-2fab-4b7d-ad9c-0fc348915e63","mandatory_parameter":"Default Value","admin_only":false,"credentials":"device","custom_username":"","custom_password":"","start_new_connection":false,"connection_name":"default","close_connection":false,"enable_mode":true,"config_mode":false,"commands":"show interface {{iteration_value}}","jinja2_template":false,"results_as_list":false,"driver":"device","use_textfsm":false,"use_genie":false,"read_timeout":10.0,"conn_timeout":10.0,"auth_timeout":0.0,"banner_timeout":15.0,"global_delay_factor":0.1,"expect_string":"","config_mode_command":"","auto_find_prompt":true,"strip_prompt":true,"strip_command":true,"jump_on_connect":false,"jump_command":"","jump_username":"","jump_password":"","exit_command":"","expect_username_prompt":"","expect_password_prompt":"","expect_prompt":""},{"persistent_id":"4WIZCsAopEM","name":"[(R) Combined Device & Target Iteration] Iteration Target Workflow - Test 3","creator":"admin","soft_deleted":false,"shared":false,"scoped_name":"Iteration Target Workflow - Test 3","creation_time":"","last_modified":"2022-11-09 01:23:32.331985","last_modified_by":"admin","last_run":"","version":"","description":"Check the iteration mechanism (interfaces)","priority":11,"number_of_retries":0,"time_between_retries":10,"max_number_of_retries":100,"credential_type":"any","disable_result_creation":false,"restrict_to_owners":[],"vendor":"Arista","operating_system":"EOS","dry_run":false,"waiting_time":0,"device_query":"","device_query_property":"ip_address","update_target_pools":false,"update_pools_after_running":false,"report":"","report_format":"text","report_jinja2_template":false,"disabled":false,"disabled_info":"","display_report":false,"email_report":false,"send_notification":false,"send_notification_method":"mail","notification_header":"","display_only_failed_nodes":true,"include_device_results":true,"include_link_in_summary":true,"mail_recipient":"","mail_subject":"","mail_sender":"","mail_bcc":"","reply_to":"","initial_payload":{},"mandatory_parametrization":false,"parameterized_form":"name = StringField('Name', [InputRequired()])\ninitial_payload = DictField()\ntarget_devices = MultipleInstanceField('Devices', model='device')\ntarget_pools = MultipleInstanceField('Pools', model='pool')\ndevice_query = StringField('Device Query', python=True, widget=TextArea(), render_kw={'rows': 2})\ndevice_query_property = SelectField('Query Property Type', choices=(('name', 'Name'), ('ip_address', 'IP address')))\nmultiprocessing = BooleanField('Multiprocessing', default=False)\nmax_processes = IntegerField('Maximum number of processes', default=15)","parameterized_form_template":"","skip":{},"skip_query":"","skip_value":"success","iteration_values":"get_var('Interfaces 2')","iteration_variable_name":"iteration_value","iteration_devices":"get_var(\"Derived Devices\", device=parent_device.name)","iteration_devices_property":"name","preprocessing":"","postprocessing":"","postprocessing_mode":"always","builder_link":"","log_level":1,"show_user_logs":true,"maximum_runs":1,"multiprocessing":false,"max_processes":5,"validation_condition":"success","conversion_method":"text","validation_method":"text","validation_section":"results['result']","content_match":"does not exist","content_match_regex":false,"dict_match":{},"negative_logic":false,"delete_spaces_before_matching":false,"run_method":"per_device","serialized":"dict_values(['', True, 0.0, 'name', True, '', False, '', False, '', True, None, 1, '', '2022-11-09 01:23:32.331985', False, None, 'Check the iteration mechanism (interfaces)', {}, True, \"name = StringField('Name', [InputRequired()])\\ninitial_payload = DictField()\\ntarget_devices = MultipleInstanceField('Devices', model='device')\\ntarget_pools = MultipleInstanceField('Pools', model='pool')\\ndevice_query = StringField('Device Query', python=True, widget=TextArea(), render_kw={'rows': 2})\\ndevice_query_property = SelectField('Query Property Type', choices=(('name', 'Name'), ('ip_address', 'IP address')))\\nmultiprocessing = BooleanField('Multiprocessing', default=False)\\nmax_processes = IntegerField('Maximum number of processes', default=15)\", 'text', 'default', True, '', '', False, False, '', 'iteration_value', False, '', '', 'text', '', True, '[(R) Combined Device & Target Iteration] Iteration Target Workflow - Test 3', '', False, {}, 'Iteration Target Workflow - Test 3', False, {}, 1, 'netmiko_commands_service', None, 0, 'show interface {{iteration_value}}', '', [], 'get_var(\"Derived Devices\", device=parent_device.name)', 'always', '', True, 10.0, False, False, None, 'any', 'text', False, False, 'success', False, '', False, 'mail', 10.0, 100, 'Arista', '', '4WIZCsAopEM', 'ip_address', 'admin', 'success', '', 'does not exist', True, False, 'per_device', 'Default Value', 10, False, False, 1, '', 15.0, '', '', '', \"results['result']\", False, False, 11, 'EOS', 0, 'bdad80c5-6861-4dcc-b446-6de2435ab08d', '', 'Definition', False, False, False, 0.1, False, False, '', '', False, None, True, 'admin', \"get_var('Interfaces 2')\", '', 'device', '', 'device', 5])","definition":"Definition","reserved":false,"impacting":true,"completion_time":1,"default_uuid":"bdad80c5-6861-4dcc-b446-6de2435ab08d","mandatory_parameter":"Default Value","admin_only":false,"credentials":"device","custom_username":"","custom_password":"","start_new_connection":false,"connection_name":"default","close_connection":false,"enable_mode":true,"config_mode":false,"commands":"show interface {{iteration_value}}","jinja2_template":false,"results_as_list":false,"driver":"device","use_textfsm":false,"use_genie":false,"read_timeout":10.0,"conn_timeout":10.0,"auth_timeout":0.0,"banner_timeout":15.0,"global_delay_factor":0.1,"expect_string":"","config_mode_command":"","auto_find_prompt":true,"strip_prompt":true,"strip_command":true,"jump_on_connect":false,"jump_command":"","jump_username":"","jump_password":"","exit_command":"","expect_username_prompt":"","expect_password_prompt":"","expect_prompt":""},{"persistent_id":"X9BZuUp3V_I","name":"[[DxD and SxS Run Methods] Workflow  in device by device mode] Validation show VRF","creator":"admin","soft_deleted":false,"shared":false,"scoped_name":"Validation show VRF","creation_time":"","last_modified":"2022-11-09 01:23:32.437010","last_modified_by":"admin","last_run":"","version":"","description":"","priority":11,"number_of_retries":0,"time_between_retries":10,"max_number_of_retries":100,"credential_type":"any","disable_result_creation":false,"restrict_to_owners":[],"vendor":"","operating_system":"","dry_run":false,"waiting_time":0,"device_query":"","device_query_property":"name","update_target_pools":false,"update_pools_after_running":false,"report":"","report_format":"text","report_jinja2_template":false,"disabled":false,"disabled_info":"","display_report":false,"email_report":false,"send_notification":false,"send_notification_method":"mail","notification_header":"","display_only_failed_nodes":false,"include_device_results":false,"include_link_in_summary":false,"mail_recipient":"","mail_subject":"","mail_sender":"","mail_bcc":"","reply_to":"","initial_payload":{},"mandatory_parametrization":false,"parameterized_form":"name = StringField('Name', [InputRequired()])\ninitial_payload = DictField()\ntarget_devices = MultipleInstanceField('Devices', model='device')\ntarget_pools = MultipleInstanceField('Pools', model='pool')\ndevice_query = StringField('Device Query', python=True, widget=TextArea(), render_kw={'rows': 2})\ndevice_query_property = SelectField('Query Property Type', choices=(('name', 'Name'), ('ip_address', 'IP address')))\nmultiprocessing = BooleanField('Multiprocessing', default=False)\nmax_processes = IntegerField('Maximum number of processes', default=15)","parameterized_form_template":"","skip":{},"skip_query":"","skip_value":"success","iteration_values":"","iteration_variable_name":"iteration_value","iteration_devices":"","iteration_devices_property":"name","preprocessing":"","postprocessing":"","postprocessing_mode":"always","builder_link":"_FWZZTjsuR4>Kcf-9tetnBM","log_level":1,"show_user_logs":true,"maximum_runs":1,"multiprocessing":false,"max_processes":15,"validation_condition":"none","conversion_method":"none","validation_method":"text","validation_section":"results['result']","content_match":"","content_match_regex":false,"dict_match":{},"negative_logic":false,"delete_spaces_before_matching":false,"run_method":"per_device","serialized":"dict_values(['', True, 0.0, 'name', True, '', False, '', False, '', False, None, 1, '', '2022-11-09 01:23:32.437010', False, None, '', {}, False, \"name = StringField('Name', [InputRequired()])\\ninitial_payload = DictField()\\ntarget_devices = MultipleInstanceField('Devices', model='device')\\ntarget_pools = MultipleInstanceField('Pools', model='pool')\\ndevice_query = StringField('Device Query', python=True, widget=TextArea(), render_kw={'rows': 2})\\ndevice_query_property = SelectField('Query Property Type', choices=(('name', 'Name'), ('ip_address', 'IP address')))\\nmultiprocessing = BooleanField('Multiprocessing', default=False)\\nmax_processes = IntegerField('Maximum number of processes', default=15)\", 'text', 'default', True, '', '', False, False, '', 'iteration_value', False, '', '', 'none', '', True, '[[DxD and SxS Run Methods] Workflow  in device by device mode] Validation show VRF', '', False, {}, 'Validation show VRF', False, {}, 1, 'netmiko_commands_service', None, 0, '', '', [], '', 'always', '', True, 10.0, False, False, None, 'any', 'text', False, False, 'none', False, '', False, 'mail', 10.0, 100, '', '', 'X9BZuUp3V_I', 'name', 'admin', 'success', '', '', False, False, 'per_device', 'Default Value', 10, False, False, 1, '', 15.0, '', '', '_FWZZTjsuR4>Kcf-9tetnBM', \"results['result']\", False, False, 11, '', 0, '73862812-df82-4ac4-8318-88b6234ab115', '', 'Definition', False, False, False, 0.1, False, False, '', '', False, None, True, 'admin', '', '', 'device', '', 'device', 15])","definition":"Definition","reserved":false,"impacting":true,"completion_time":1,"default_uuid":"73862812-df82-4ac4-8318-88b6234ab115","mandatory_parameter":"Default Value","admin_only":false,"credentials":"device","custom_username":"","custom_password":"","start_new_connection":false,"connection_name":"default","close_connection":false,"enable_mode":true,"config_mode":false,"commands":"","jinja2_template":false,"results_as_list":false,"driver":"device","use_textfsm":false,"use_genie":false,"read_timeout":10.0,"conn_timeout":10.0,"auth_timeout":0.0,"banner_timeout":15.0,"global_delay_factor":0.1,"expect_string":"","config_mode_command":"","auto_find_prompt":true,"strip_prompt":true,"strip_command":true,"jump_on_connect":false,"jump_command":"","jump_username":"","jump_password":"","exit_command":"","expect_username_prompt":"","expect_password_prompt":"","expect_prompt":""},{"persistent_id":"z-JOb_5yu4c","name":"[[DxD and SxS Run Methods] Workflow in service by service mode (workflow targets)] Validation show VRF","creator":"admin","soft_deleted":false,"shared":false,"scoped_name":"Validation show VRF","creation_time":"","last_modified":"2022-11-09 01:23:32.439485","last_modified_by":"admin","last_run":"","version":"","description":"","priority":11,"number_of_retries":0,"time_between_retries":10,"max_number_of_retries":100,"credential_type":"any","disable_result_creation":false,"restrict_to_owners":[],"vendor":"","operating_system":"","dry_run":false,"waiting_time":0,"device_query":"","device_query_property":"name","update_target_pools":false,"update_pools_after_running":false,"report":"","report_format":"text","report_jinja2_template":false,"disabled":false,"disabled_info":"","display_report":false,"email_report":false,"send_notification":false,"send_notification_method":"mail","notification_header":"","display_only_failed_nodes":false,"include_device_results":false,"include_link_in_summary":false,"mail_recipient":"","mail_subject":"","mail_sender":"","mail_bcc":"","reply_to":"","initial_payload":{},"mandatory_parametrization":false,"parameterized_form":"name = StringField('Name', [InputRequired()])\ninitial_payload = DictField()\ntarget_devices = MultipleInstanceField('Devices', model='device')\ntarget_pools = MultipleInstanceField('Pools', model='pool')\ndevice_query = StringField('Device Query', python=True, widget=TextArea(), render_kw={'rows': 2})\ndevice_query_property = SelectField('Query Property Type', choices=(('name', 'Name'), ('ip_address', 'IP address')))\nmultiprocessing = BooleanField('Multiprocessing', default=False)\nmax_processes = IntegerField('Maximum number of processes', default=15)","parameterized_form_template":"","skip":{},"skip_query":"","skip_value":"success","iteration_values":"","iteration_variable_name":"iteration_value","iteration_devices":"","iteration_devices_property":"name","preprocessing":"","postprocessing":"","postprocessing_mode":"always","builder_link":"_FWZZTjsuR4>kMjfHjen84g","log_level":1,"show_user_logs":true,"maximum_runs":1,"multiprocessing":false,"max_processes":15,"validation_condition":"none","conversion_method":"none","validation_method":"text","validation_section":"results['result']","content_match":"","content_match_regex":false,"dict_match":{},"negative_logic":false,"delete_spaces_before_matching":false,"run_method":"per_device","serialized":"dict_values(['', True, 0.0, 'name', True, '', False, '', False, '', False, None, 1, '', '2022-11-09 01:23:32.439485', False, None, '', {}, False, \"name = StringField('Name', [InputRequired()])\\ninitial_payload = DictField()\\ntarget_devices = MultipleInstanceField('Devices', model='device')\\ntarget_pools = MultipleInstanceField('Pools', model='pool')\\ndevice_query = StringField('Device Query', python=True, widget=TextArea(), render_kw={'rows': 2})\\ndevice_query_property = SelectField('Query Property Type', choices=(('name', 'Name'), ('ip_address', 'IP address')))\\nmultiprocessing = BooleanField('Multiprocessing', default=False)\\nmax_processes = IntegerField('Maximum number of processes', default=15)\", 'text', 'default', True, '', '', False, False, '', 'iteration_value', False, '', '', 'none', '', True, '[[DxD and SxS Run Methods] Workflow in service by service mode (workflow targets)] Validation show VRF', '', False, {}, 'Validation show VRF', False, {}, 1, 'netmiko_commands_service', None, 0, '', '', [], '', 'always', '', True, 10.0, False, False, None, 'any', 'text', False, False, 'none', False, '', False, 'mail', 10.0, 100, '', '', 'z-JOb_5yu4c', 'name', 'admin', 'success', '', '', False, False, 'per_device', 'Default Value', 10, False, False, 1, '', 15.0, '', '', '_FWZZTjsuR4>kMjfHjen84g', \"results['result']\", False, False, 11, '', 0, 'ae0e2167-e441-413f-94ef-f4973b0d80dd', '', 'Definition', False, False, False, 0.1, False, False, '', '', False, None, True, 'admin', '', '', 'device', '', 'device', 15])","definition":"Definition","reserved":false,"impacting":true,"completion_time":1,"default_uuid":"ae0e2167-e441-413f-94ef-f4973b0d80dd","mandatory_parameter":"Default Value","admin_only":false,"credentials":"device","custom_username":"","custom_password":"","start_new_connection":false,"connection_name":"default","close_connection":false,"enable_mode":true,"config_mode":false,"commands":"","jinja2_template":false,"results_as_list":false,"driver":"device","use_textfsm":false,"use_genie":false,"read_timeout":10.0,"conn_timeout":10.0,"auth_timeout":0.0,"banner_timeout":15.0,"global_delay_factor":0.1,"expect_string":"","config_mode_command":"","auto_find_prompt":true,"strip_prompt":true,"strip_command":true,"jump_on_connect":false,"jump_command":"","jump_username":"","jump_password":"","exit_command":"","expect_username_prompt":"","expect_password_prompt":"","expect_prompt":""},{"persistent_id":"N3r3SW0C55s","name":"[[DxD and SxS Run Methods] Workflow in service targets mode] Validation show VRF","creator":"admin","soft_deleted":false,"shared":false,"scoped_name":"Validation show VRF","creation_time":"","last_modified":"2022-11-09 01:23:32.441443","last_modified_by":"admin","last_run":"","version":"","description":"","priority":11,"number_of_retries":0,"time_between_retries":10,"max_number_of_retries":100,"credential_type":"any","disable_result_creation":false,"restrict_to_owners":[],"vendor":"","operating_system":"","dry_run":false,"waiting_time":0,"device_query":"","device_query_property":"name","update_target_pools":false,"update_pools_after_running":false,"report":"","report_format":"text","report_jinja2_template":false,"disabled":false,"disabled_info":"","display_report":false,"email_report":false,"send_notification":false,"send_notification_method":"mail","notification_header":"","display_only_failed_nodes":false,"include_device_results":false,"include_link_in_summary":false,"mail_recipient":"","mail_subject":"","mail_sender":"","mail_bcc":"","reply_to":"","initial_payload":{},"mandatory_parametrization":false,"parameterized_form":"name = StringField('Name', [InputRequired()])\ninitial_payload = DictField()\ntarget_devices = MultipleInstanceField('Devices', model='device')\ntarget_pools = MultipleInstanceField('Pools', model='pool')\ndevice_query = StringField('Device Query', python=True, widget=TextArea(), render_kw={'rows': 2})\ndevice_query_property = SelectField('Query Property Type', choices=(('name', 'Name'), ('ip_address', 'IP address')))\nmultiprocessing = BooleanField('Multiprocessing', default=False)\nmax_processes = IntegerField('Maximum number of processes', default=15)","parameterized_form_template":"","skip":{},"skip_query":"","skip_value":"success","iteration_values":"","iteration_variable_name":"iteration_value","iteration_devices":"","iteration_devices_property":"name","preprocessing":"","postprocessing":"","postprocessing_mode":"always","builder_link":"_FWZZTjsuR4>vvXH4AzftLc","log_level":1,"show_user_logs":true,"maximum_runs":1,"multiprocessing":false,"max_processes":15,"validation_condition":"none","conversion_method":"none","validation_method":"text","validation_section":"results['result']","content_match":"","content_match_regex":false,"dict_match":{},"negative_logic":false,"delete_spaces_before_matching":false,"run_method":"per_device","serialized":"dict_values(['', True, 0.0, 'name', True, '', False, '', False, '', False, None, 1, '', '2022-11-09 01:23:32.441443', False, None, '', {}, False, \"name = StringField('Name', [InputRequired()])\\ninitial_payload = DictField()\\ntarget_devices = MultipleInstanceField('Devices', model='device')\\ntarget_pools = MultipleInstanceField('Pools', model='pool')\\ndevice_query = StringField('Device Query', python=True, widget=TextArea(), render_kw={'rows': 2})\\ndevice_query_property = SelectField('Query Property Type', choices=(('name', 'Name'), ('ip_address', 'IP address')))\\nmultiprocessing = BooleanField('Multiprocessing', default=False)\\nmax_processes = IntegerField('Maximum number of processes', default=15)\", 'text', 'default', True, '', '', False, False, '', 'iteration_value', False, '', '', 'none', '', True, '[[DxD and SxS Run Methods] Workflow in service targets mode] Validation show VRF', '', False, {}, 'Validation show VRF', False, {}, 1, 'netmiko_commands_service', None, 0, '', '', [], '', 'always', '', True, 10.0, False, False, None, 'any', 'text', False, False, 'none', False, '', False, 'mail', 10.0, 100, '', '', 'N3r3SW0C55s', 'name', 'admin', 'success', '', '', False, False, 'per_device', 'Default Value', 10, False, False, 1, '', 15.0, '', '', '_FWZZTjsuR4>vvXH4AzftLc', \"results['result']\", False, False, 11, '', 0, '137503f6-65b0-4a77-8b0e-fd4b4b234c8a', '', 'Definition', False, False, False, 0.1, False, False, '', '', False, None, True, 'admin', '', '', 'device', '', 'device', 15])","definition":"Definition","reserved":false,"impacting":true,"completion_time":1,"default_uuid":"137503f6-65b0-4a77-8b0e-fd4b4b234c8a","mandatory_parameter":"Default Value","admin_only":false,"credentials":"device","custom_username":"","custom_password":"","start_new_connection":false,"connection_name":"default","close_connection":false,"enable_mode":true,"config_mode":false,"commands":"","jinja2_template":false,"results_as_list":false,"driver":"device","use_textfsm":false,"use_genie":false,"read_timeout":10.0,"conn_timeout":10.0,"auth_timeout":0.0,"banner_timeout":15.0,"global_delay_factor":0.1,"expect_string":"","config_mode_command":"","auto_find_prompt":true,"strip_prompt":true,"strip_command":true,"jump_on_connect":false,"jump_command":"","jump_username":"","jump_password":"","exit_command":"","expect_username_prompt":"","expect_password_prompt":"","expect_prompt":""},{"persistent_id":"lpztqhDnf90","name":"[Shared] Shared Service used Twice in Workflow","creator":"admin","soft_deleted":false,"shared":true,"scoped_name":"Shared Service used Twice in Workflow","creation_time":"","last_modified":"2022-11-09 01:23:32.458867","last_modified_by":"admin","last_run":"","version":"","description":"","priority":11,"number_of_retries":0,"time_between_retries":10,"max_number_of_retries":100,"credential_type":"any","disable_result_creation":false,"restrict_to_owners":[],"vendor":"","operating_system":"","dry_run":false,"waiting_time":0,"device_query":"","device_query_property":"name","update_target_pools":false,"update_pools_after_running":false,"report":"","report_format":"text","report_jinja2_template":false,"disabled":false,"disabled_info":"","display_report":false,"email_report":false,"send_notification":false,"send_notification_method":"mail","notification_header":"","display_only_failed_nodes":false,"include_device_results":false,"include_link_in_summary":false,"mail_recipient":"","mail_subject":"","mail_sender":"","mail_bcc":"","reply_to":"","initial_payload":{},"mandatory_parametrization":false,"parameterized_form":"name = StringField('Name', [InputRequired()])\ninitial_payload = DictField()\ntarget_devices = MultipleInstanceField('Devices', model='device')\ntarget_pools = MultipleInstanceField('Pools', model='pool')\ndevice_query = StringField('Device Query', python=True, widget=TextArea(), render_kw={'rows': 2})\ndevice_query_property = SelectField('Query Property Type', choices=(('name', 'Name'), ('ip_address', 'IP address')))\nmultiprocessing = BooleanField('Multiprocessing', default=False)\nmax_processes = IntegerField('Maximum number of processes', default=15)","parameterized_form_template":"","skip":{},"skip_query":"","skip_value":"success","iteration_values":"","iteration_variable_name":"iteration_value","iteration_devices":"","iteration_devices_property":"name","preprocessing":"","postprocessing":"","postprocessing_mode":"always","builder_link":"","log_level":1,"show_user_logs":true,"maximum_runs":1,"multiprocessing":false,"max_processes":15,"validation_condition":"success","conversion_method":"none","validation_method":"text","validation_section":"results['result']","content_match":"Loopback","content_match_regex":false,"dict_match":{},"negative_logic":false,"delete_spaces_before_matching":false,"run_method":"per_device","serialized":"dict_values(['', True, 0.0, 'name', True, '', False, '', False, '', False, None, 1, '', '2022-11-09 01:23:32.458867', False, None, '', {}, False, \"name = StringField('Name', [InputRequired()])\\ninitial_payload = DictField()\\ntarget_devices = MultipleInstanceField('Devices', model='device')\\ntarget_pools = MultipleInstanceField('Pools', model='pool')\\ndevice_query = StringField('Device Query', python=True, widget=TextArea(), render_kw={'rows': 2})\\ndevice_query_property = SelectField('Query Property Type', choices=(('name', 'Name'), ('ip_address', 'IP address')))\\nmultiprocessing = BooleanField('Multiprocessing', default=False)\\nmax_processes = IntegerField('Maximum number of processes', default=15)\", 'text', 'default', True, '', '', False, False, '', 'iteration_value', False, '', '', 'none', '', True, '[Shared] Shared Service used Twice in Workflow', '', True, {}, 'Shared Service used Twice in Workflow', False, {}, 1, 'netmiko_commands_service', None, 0, 'show vrf', '', [], '', 'always', '', True, 10.0, False, False, None, 'any', 'text', False, False, 'success', False, '', False, 'mail', 10.0, 100, '', '', 'lpztqhDnf90', 'name', 'admin', 'success', '', 'Loopback', False, False, 'per_device', 'Default Value', 10, False, False, 1, '', 15.0, '', '', '', \"results['result']\", False, False, 11, '', 0, '285e7d00-beb9-4208-8dfe-8296c861816d', '', 'Definition', False, False, False, 0.1, False, False, '', '', False, None, True, 'admin', '', '', 'device', '', 'device', 15])","definition":"Definition","reserved":false,"impacting":true,"completion_time":1,"default_uuid":"285e7d00-beb9-4208-8dfe-8296c861816d","mandatory_parameter":"Default Value","admin_only":false,"credentials":"device","custom_username":"","custom_password":"","start_new_connection":false,"connection_name":"default","close_connection":false,"enable_mode":true,"config_mode":false,"commands":"show vrf","jinja2_template":false,"results_as_list":false,"driver":"device","use_textfsm":false,"use_genie":false,"read_timeout":10.0,"conn_timeout":10.0,"auth_timeout":0.0,"banner_timeout":15.0,"global_delay_factor":0.1,"expect_string":"","config_mode_command":"","auto_find_prompt":true,"strip_prompt":true,"strip_command":true,"jump_on_connect":false,"jump_command":"","jump_username":"","jump_password":"","exit_command":"","expect_username_prompt":"","expect_password_prompt":"","expect_prompt":""},{"persistent_id":"oSMRC9cLlt8","name":"[(R) Dictionary as Iteration Target Variable] Show VRF with iteration","creator":"admin","soft_deleted":false,"shared":false,"scoped_name":"Show VRF with iteration","creation_time":"","last_modified":"2022-11-09 01:23:32.475062","last_modified_by":"admin","last_run":"","version":"","description":"","priority":11,"number_of_retries":0,"time_between_retries":10,"max_number_of_retries":100,"credential_type":"any","disable_result_creation":false,"restrict_to_owners":[],"vendor":"","operating_system":"","dry_run":false,"waiting_time":0,"device_query":"","device_query_property":"name","update_target_pools":false,"update_pools_after_running":false,"report":"","report_format":"text","report_jinja2_template":false,"disabled":false,"disabled_info":"","display_report":false,"email_report":false,"send_notification":false,"send_notification_method":"mail","notification_header":"","display_only_failed_nodes":false,"include_device_results":false,"include_link_in_summary":false,"mail_recipient":"","mail_subject":"","mail_sender":"","mail_bcc":"","reply_to":"","initial_payload":{},"mandatory_parametrization":false,"parameterized_form":"name = StringField('Name', [InputRequired()])\ninitial_payload = DictField()\ntarget_devices = MultipleInstanceField('Devices', model='device')\ntarget_pools = MultipleInstanceField('Pools', model='pool')\ndevice_query = StringField('Device Query', python=True, widget=TextArea(), render_kw={'rows': 2})\ndevice_query_property = SelectField('Query Property Type', choices=(('name', 'Name'), ('ip_address', 'IP address')))\nmultiprocessing = BooleanField('Multiprocessing', default=False)\nmax_processes = IntegerField('Maximum number of processes', default=15)","parameterized_form_template":"","skip":{"Regression Workflow: Advanced Iteration Targets":false},"skip_query":"","skip_value":"success","iteration_values":"get_result(\"Set Variables for Iteration\", device=device.name)[\"result\"][\"dict_iteration\"]","iteration_variable_name":"command_dict","iteration_devices":"","iteration_devices_property":"name","preprocessing":"","postprocessing":"","postprocessing_mode":"always","builder_link":"9vJljp8xcag","log_level":1,"show_user_logs":true,"maximum_runs":1,"multiprocessing":false,"max_processes":15,"validation_condition":"none","conversion_method":"none","validation_method":"text","validation_section":"results['result']","content_match":"","content_match_regex":false,"dict_match":{},"negative_logic":false,"delete_spaces_before_matching":false,"run_method":"per_device","serialized":"dict_values(['', True, 0.0, 'name', True, '', False, '', False, '', False, None, 1, '', '2022-11-09 01:23:32.475062', False, None, '', {}, False, \"name = StringField('Name', [InputRequired()])\\ninitial_payload = DictField()\\ntarget_devices = MultipleInstanceField('Devices', model='device')\\ntarget_pools = MultipleInstanceField('Pools', model='pool')\\ndevice_query = StringField('Device Query', python=True, widget=TextArea(), render_kw={'rows': 2})\\ndevice_query_property = SelectField('Query Property Type', choices=(('name', 'Name'), ('ip_address', 'IP address')))\\nmultiprocessing = BooleanField('Multiprocessing', default=False)\\nmax_processes = IntegerField('Maximum number of processes', default=15)\", 'text', 'default', True, '', '', False, False, '', 'command_dict', False, '', '', 'none', '', True, '[(R) Dictionary as Iteration Target Variable] Show VRF with iteration', '', False, {}, 'Show VRF with iteration', False, {'Regression Workflow: Advanced Iteration Targets': False}, 1, 'netmiko_commands_service', None, 0, 'show vrf {{command_dict[\"command\"]}}', '', [], '', 'always', '', True, 10.0, False, False, None, 'any', 'text', False, False, 'none', False, '', False, 'mail', 10.0, 100, '', '', 'oSMRC9cLlt8', 'name', 'admin', 'success', '', '', False, False, 'per_device', 'Default Value', 10, False, False, 1, '', 15.0, '', '', '9vJljp8xcag', \"results['result']\", False, False, 11, '', 0, '3a9da36d-9c15-4233-ad27-eff0e91e4b71', '', 'Definition', False, False, False, 0.1, False, False, '', '', False, None, True, 'admin', 'get_result(\"Set Variables for Iteration\", device=device.name)[\"result\"][\"dict_iteration\"]', '', 'device', '', 'device', 15])","definition":"Definition","reserved":false,"impacting":true,"completion_time":1,"default_uuid":"3a9da36d-9c15-4233-ad27-eff0e91e4b71","mandatory_parameter":"Default Value","admin_only":false,"credentials":"device","custom_username":"","custom_password":"","start_new_connection":false,"connection_name":"default","close_connection":false,"enable_mode":true,"config_mode":false,"commands":"show vrf {{command_dict[\"command\"]}}","jinja2_template":false,"results_as_list":false,"driver":"device","use_textfsm":false,"use_genie":false,"read_timeout":10.0,"conn_timeout":10.0,"auth_timeout":0.0,"banner_timeout":15.0,"global_delay_factor":0.1,"expect_string":"","config_mode_command":"","auto_find_prompt":true,"strip_prompt":true,"strip_command":true,"jump_on_connect":false,"jump_command":"","jump_username":"","jump_password":"","exit_command":"","expect_username_prompt":"","expect_password_prompt":"","expect_prompt":""},{"persistent_id":"zSh7YnqGLC8","name":"[(R) Unix Command & Chell, Ping Service, Jump on Connect mechanism] Validation: jump on server 2 from Washington","creator":"admin","soft_deleted":false,"shared":false,"scoped_name":"Validation: jump on server 2 from Washington","creation_time":"","last_modified":"2022-11-09 01:23:32.550684","last_modified_by":"admin","last_run":"","version":"","description":"","priority":11,"number_of_retries":0,"time_between_retries":10,"max_number_of_retries":100,"credential_type":"any","disable_result_creation":false,"restrict_to_owners":[],"vendor":"","operating_system":"","dry_run":false,"waiting_time":0,"device_query":"","device_query_property":"name","update_target_pools":false,"update_pools_after_running":false,"report":"","report_format":"text","report_jinja2_template":false,"disabled":false,"disabled_info":"","display_report":false,"email_report":false,"send_notification":false,"send_notification_method":"mail","notification_header":"","display_only_failed_nodes":false,"include_device_results":false,"include_link_in_summary":false,"mail_recipient":"","mail_subject":"","mail_sender":"","mail_bcc":"","reply_to":"","initial_payload":{},"mandatory_parametrization":false,"parameterized_form":"name = StringField('Name', [InputRequired()])\ninitial_payload = DictField()\ntarget_devices = MultipleInstanceField('Devices', model='device')\ntarget_pools = MultipleInstanceField('Pools', model='pool')\ndevice_query = StringField('Device Query', python=True, widget=TextArea(), render_kw={'rows': 2})\ndevice_query_property = SelectField('Query Property Type', choices=(('name', 'Name'), ('ip_address', 'IP address')))\nmultiprocessing = BooleanField('Multiprocessing', default=False)\nmax_processes = IntegerField('Maximum number of processes', default=15)","parameterized_form_template":"","skip":{},"skip_query":"","skip_value":"success","iteration_values":"","iteration_variable_name":"iteration_value","iteration_devices":"","iteration_devices_property":"name","preprocessing":"","postprocessing":"","postprocessing_mode":"always","builder_link":"kQGJyuhCTA8","log_level":1,"show_user_logs":true,"maximum_runs":1,"multiprocessing":false,"max_processes":15,"validation_condition":"success","conversion_method":"none","validation_method":"text","validation_section":"results['result']","content_match":"python\\d","content_match_regex":true,"dict_match":{},"negative_logic":false,"delete_spaces_before_matching":false,"run_method":"per_device","serialized":"dict_values(['', True, 0.0, 'name', True, '.*$', False, '', False, '', False, None, 1, '', '2022-11-09 01:23:32.550684', False, None, '', {}, False, \"name = StringField('Name', [InputRequired()])\\ninitial_payload = DictField()\\ntarget_devices = MultipleInstanceField('Devices', model='device')\\ntarget_pools = MultipleInstanceField('Pools', model='pool')\\ndevice_query = StringField('Device Query', python=True, widget=TextArea(), render_kw={'rows': 2})\\ndevice_query_property = SelectField('Query Property Type', choices=(('name', 'Name'), ('ip_address', 'IP address')))\\nmultiprocessing = BooleanField('Multiprocessing', default=False)\\nmax_processes = IntegerField('Maximum number of processes', default=15)\", 'text', 'default', True, 'admin.*:', '', False, False, '', 'iteration_value', False, 'exit', '', 'none', '', True, '[(R) Unix Command & Chell, Ping Service, Jump on Connect mechanism] Validation: jump on server 2 from Washington', '', False, {}, 'Validation: jump on server 2 from Washington', False, {}, 1, 'netmiko_commands_service', None, 0, 'ps -ef', '', [], '', 'always', '', True, 10.0, False, True, None, 'any', 'text', False, True, 'success', False, '', False, 'mail', 10.0, 100, '', '', 'zSh7YnqGLC8', 'name', 'admin', 'success', '', 'python\\\\d', False, False, 'per_device', 'Default Value', 10, False, False, 1, '', 15.0, '', '', 'kQGJyuhCTA8', \"results['result']\", False, False, 11, '', 0, '1c56e96a-8795-418c-8046-55092e008676', '', 'Definition', False, False, False, 0.1, False, False, '', '', False, None, True, 'admin', '', 'ssh 192.168.56.103', 'device', '', 'device', 15])","definition":"Definition","reserved":false,"impacting":true,"completion_time":1,"default_uuid":"1c56e96a-8795-418c-8046-55092e008676","mandatory_parameter":"Default Value","admin_only":false,"credentials":"device","custom_username":"","custom_password":"","start_new_connection":false,"connection_name":"default","close_connection":false,"enable_mode":true,"config_mode":false,"commands":"ps -ef","jinja2_template":false,"results_as_list":false,"driver":"device","use_textfsm":false,"use_genie":false,"read_timeout":10.0,"conn_timeout":10.0,"auth_timeout":0.0,"banner_timeout":15.0,"global_delay_factor":0.1,"expect_string":"","config_mode_command":"","auto_find_prompt":true,"strip_prompt":true,"strip_command":true,"jump_on_connect":true,"jump_command":"ssh 192.168.56.103","jump_username":"","jump_password":"","exit_command":"exit","expect_username_prompt":"","expect_password_prompt":"admin.*:","expect_prompt":".*$"},{"persistent_id":"j4TV6rD_rF0","name":"Open File Descriptors Leak (public)","creator":"admin","soft_deleted":false,"shared":false,"scoped_name":"Open File Descriptors Leak (public)","creation_time":"","last_modified":"2022-11-09 01:23:32.555351","last_modified_by":"admin","last_run":"","version":"","description":"","priority":11,"number_of_retries":0,"time_between_retries":10,"max_number_of_retries":100,"credential_type":"any","disable_result_creation":false,"restrict_to_owners":[],"vendor":"","operating_system":"","dry_run":false,"waiting_time":0,"device_query":"","device_query_property":"name","update_target_pools":false,"update_pools_after_running":false,"report":"","report_format":"text","report_jinja2_template":false,"disabled":false,"disabled_info":"","display_report":false,"email_report":false,"send_notification":false,"send_notification_method":"mail","notification_header":"","display_only_failed_nodes":false,"include_device_results":false,"include_link_in_summary":false,"mail_recipient":"","mail_subject":"","mail_sender":"","mail_bcc":"","reply_to":"","initial_payload":{},"mandatory_parametrization":false,"parameterized_form":"name = StringField('Name', [InputRequired()])\ninitial_payload = DictField()\ntarget_devices = MultipleInstanceField('Devices', model='device')\ntarget_pools = MultipleInstanceField('Pools', model='pool')\ndevice_query = StringField('Device Query', python=True, widget=TextArea(), render_kw={'rows': 2})\ndevice_query_property = SelectField('Query Property Type', choices=(('name', 'Name'), ('ip_address', 'IP address')))\nmultiprocessing = BooleanField('Multiprocessing', default=False)\nmax_processes = IntegerField('Maximum number of processes', default=15)","parameterized_form_template":"","skip":{},"skip_query":"","skip_value":"success","iteration_values":"","iteration_variable_name":"iteration_value","iteration_devices":"","iteration_devices_property":"name","preprocessing":"","postprocessing":"","postprocessing_mode":"always","builder_link":"","log_level":1,"show_user_logs":true,"maximum_runs":1,"multiprocessing":true,"max_processes":5,"validation_condition":"none","conversion_method":"none","validation_method":"text","validation_section":"results['result']","content_match":"","content_match_regex":false,"dict_match":{},"negative_logic":false,"delete_spaces_before_matching":false,"run_method":"per_device","serialized":"dict_values(['', True, 0.0, 'name', True, 'admin.*$', False, '', False, '', False, None, 1, '', '2022-11-09 01:23:32.555351', False, None, '', {}, False, \"name = StringField('Name', [InputRequired()])\\ninitial_payload = DictField()\\ntarget_devices = MultipleInstanceField('Devices', model='device')\\ntarget_pools = MultipleInstanceField('Pools', model='pool')\\ndevice_query = StringField('Device Query', python=True, widget=TextArea(), render_kw={'rows': 2})\\ndevice_query_property = SelectField('Query Property Type', choices=(('name', 'Name'), ('ip_address', 'IP address')))\\nmultiprocessing = BooleanField('Multiprocessing', default=False)\\nmax_processes = IntegerField('Maximum number of processes', default=15)\", 'text', 'default', True, 'password', '', False, True, '', 'iteration_value', False, 'exit', '', 'none', '', True, 'Open File Descriptors Leak (public)', 'username:', False, {}, 'Open File Descriptors Leak (public)', False, {}, 1, 'netmiko_commands_service', None, 0, 'show version', '', [], '', 'always', '', True, 10.0, False, False, None, 'any', 'text', False, False, 'none', False, '', False, 'mail', 10.0, 100, '', '', 'j4TV6rD_rF0', 'name', 'admin', 'success', '', '', False, False, 'per_device', 'Default Value', 10, False, False, 1, '', 15.0, '', '', '', \"results['result']\", False, False, 11, '', 0, 'b553111e-c447-4b33-8456-c6d7feb735d3', '', 'Definition', False, False, False, 0.1, False, False, '', '', False, None, True, 'admin', '', 'ssh jump_server_IP', 'device', '', 'device', 5])","definition":"Definition","reserved":false,"impacting":true,"completion_time":1,"default_uuid":"b553111e-c447-4b33-8456-c6d7feb735d3","mandatory_parameter":"Default Value","admin_only":false,"credentials":"device","custom_username":"","custom_password":"","start_new_connection":false,"connection_name":"default","close_connection":false,"enable_mode":true,"config_mode":false,"commands":"show version","jinja2_template":false,"results_as_list":false,"driver":"device","use_textfsm":false,"use_genie":false,"read_timeout":10.0,"conn_timeout":10.0,"auth_timeout":0.0,"banner_timeout":15.0,"global_delay_factor":0.1,"expect_string":"","config_mode_command":"","auto_find_prompt":true,"strip_prompt":true,"strip_command":true,"jump_on_connect":false,"jump_command":"ssh jump_server_IP","jump_username":"","jump_password":"","exit_command":"exit","expect_username_prompt":"username:","expect_password_prompt":"password","expect_prompt":"admin.*$"},{"persistent_id":"wfaDss40okk","name":"[(R) Generic File Transfer Service] Check that test file does not exist","creator":"admin","soft_deleted":false,"shared":false,"scoped_name":"Check that test file does not exist","creation_time":"","last_modified":"2022-11-09 01:23:32.592378","last_modified_by":"admin","last_run":"","version":"","description":"","priority":11,"number_of_retries":0,"time_between_retries":10,"max_number_of_retries":100,"credential_type":"any","disable_result_creation":false,"restrict_to_owners":[],"vendor":"","operating_system":"","dry_run":false,"waiting_time":0,"device_query":"","device_query_property":"name","update_target_pools":false,"update_pools_after_running":false,"report":"","report_format":"text","report_jinja2_template":false,"disabled":false,"disabled_info":"","display_report":false,"email_report":false,"send_notification":false,"send_notification_method":"mail","notification_header":"","display_only_failed_nodes":false,"include_device_results":false,"include_link_in_summary":false,"mail_recipient":"","mail_subject":"","mail_sender":"","mail_bcc":"","reply_to":"","initial_payload":{},"mandatory_parametrization":false,"parameterized_form":"name = StringField('Name', [InputRequired()])\ninitial_payload = DictField()\ntarget_devices = MultipleInstanceField('Devices', model='device')\ntarget_pools = MultipleInstanceField('Pools', model='pool')\ndevice_query = StringField('Device Query', python=True, widget=TextArea(), render_kw={'rows': 2})\ndevice_query_property = SelectField('Query Property Type', choices=(('name', 'Name'), ('ip_address', 'IP address')))\nmultiprocessing = BooleanField('Multiprocessing', default=False)\nmax_processes = IntegerField('Maximum number of processes', default=15)","parameterized_form_template":"","skip":{},"skip_query":"","skip_value":"success","iteration_values":"","iteration_variable_name":"iteration_value","iteration_devices":"","iteration_devices_property":"name","preprocessing":"","postprocessing":"results[\"success\"] = \"a.bin\" not in results[\"result\"]","postprocessing_mode":"always","builder_link":"uEjgq5CUwTU","log_level":1,"show_user_logs":true,"maximum_runs":1,"multiprocessing":false,"max_processes":15,"validation_condition":"none","conversion_method":"none","validation_method":"text","validation_section":"results['result']","content_match":"","content_match_regex":false,"dict_match":{},"negative_logic":false,"delete_spaces_before_matching":false,"run_method":"per_device","serialized":"dict_values(['', True, 0.0, 'name', True, 'admin.*$', False, 'results[\"success\"] = \"a.bin\" not in results[\"result\"]', False, '', False, None, 1, '', '2022-11-09 01:23:32.592378', False, None, '', {}, False, \"name = StringField('Name', [InputRequired()])\\ninitial_payload = DictField()\\ntarget_devices = MultipleInstanceField('Devices', model='device')\\ntarget_pools = MultipleInstanceField('Pools', model='pool')\\ndevice_query = StringField('Device Query', python=True, widget=TextArea(), render_kw={'rows': 2})\\ndevice_query_property = SelectField('Query Property Type', choices=(('name', 'Name'), ('ip_address', 'IP address')))\\nmultiprocessing = BooleanField('Multiprocessing', default=False)\\nmax_processes = IntegerField('Maximum number of processes', default=15)\", 'text', 'default', True, 'password', '', False, False, '', 'iteration_value', False, 'exit', '', 'none', '', True, '[(R) Generic File Transfer Service] Check that test file does not exist', 'username:', False, {}, 'Check that test file does not exist', False, {}, 1, 'netmiko_commands_service', None, 0, 'dir enms_files', '', [], '', 'always', '', True, 10.0, False, False, None, 'any', 'text', False, False, 'none', False, '', False, 'mail', 10.0, 100, '', '', 'wfaDss40okk', 'name', 'admin', 'success', '', '', False, False, 'per_device', 'Default Value', 10, False, False, 1, '', 15.0, '', '', 'uEjgq5CUwTU', \"results['result']\", False, False, 11, '', 0, '1859c746-68ae-48bb-b1d2-61af82ba883d', '', 'Definition', False, False, False, 0.1, False, False, '', '', False, None, True, 'admin', '', 'ssh jump_server_IP', 'device', '', 'device', 15])","definition":"Definition","reserved":false,"impacting":true,"completion_time":1,"default_uuid":"1859c746-68ae-48bb-b1d2-61af82ba883d","mandatory_parameter":"Default Value","admin_only":false,"credentials":"device","custom_username":"","custom_password":"","start_new_connection":false,"connection_name":"default","close_connection":false,"enable_mode":true,"config_mode":false,"commands":"dir enms_files","jinja2_template":false,"results_as_list":false,"driver":"device","use_textfsm":false,"use_genie":false,"read_timeout":10.0,"conn_timeout":10.0,"auth_timeout":0.0,"banner_timeout":15.0,"global_delay_factor":0.1,"expect_string":"","config_mode_command":"","auto_find_prompt":true,"strip_prompt":true,"strip_command":true,"jump_on_connect":false,"jump_command":"ssh jump_server_IP","jump_username":"","jump_password":"","exit_command":"exit","expect_username_prompt":"username:","expect_password_prompt":"password","expect_prompt":"admin.*$"},{"persistent_id":"AUp2jvxrv_4","name":"[(R) Generic File Transfer Service] Check that the files are on the disk","creator":"admin","soft_deleted":false,"shared":false,"scoped_name":"Check that the files are on the disk","creation_time":"","last_modified":"2022-12-07 14:43:24.002385","last_modified_by":"admin","last_run":"","version":"","description":"","priority":11,"number_of_retries":0,"time_between_retries":10,"max_number_of_retries":100,"credential_type":"any","disable_result_creation":false,"restrict_to_owners":[],"vendor":"","operating_system":"","dry_run":false,"waiting_time":0,"device_query":"","device_query_property":"name","update_target_pools":false,"update_pools_after_running":false,"report":"","report_format":"text","report_jinja2_template":false,"disabled":false,"disabled_info":"","display_report":false,"email_report":false,"send_notification":false,"send_notification_method":"mail","notification_header":"","display_only_failed_nodes":false,"include_device_results":false,"include_link_in_summary":false,"mail_recipient":"","mail_subject":"","mail_sender":"","mail_bcc":"","reply_to":"","initial_payload":{},"mandatory_parametrization":false,"parameterized_form":"name = StringField('Name', [InputRequired()])\ninitial_payload = DictField()\ntarget_devices = MultipleInstanceField('Devices', model='device')\ntarget_pools = MultipleInstanceField('Pools', model='pool')\ndevice_query = StringField('Device Query', python=True, widget=TextArea(), render_kw={'rows': 2})\ndevice_query_property = SelectField('Query Property Type', choices=(('name', 'Name'), ('ip_address', 'IP address')))\nmultiprocessing = BooleanField('Multiprocessing', default=False)\nmax_processes = IntegerField('Maximum number of processes', default=15)","parameterized_form_template":"","skip":{},"skip_query":"","skip_value":"success","iteration_values":"","iteration_variable_name":"iteration_value","iteration_devices":"","iteration_devices_property":"name","preprocessing":"","postprocessing":"simple_file = \"a.bin\" in results[\"result\"]\nglob_files = \"bc.bin\" in results[\"result\"] and \"bd.bin\" in results[\"result\"]\nresults[\"success\"] = simple_file and glob_files","postprocessing_mode":"always","builder_link":"uEjgq5CUwTU","log_level":1,"show_user_logs":true,"maximum_runs":1,"multiprocessing":false,"max_processes":15,"validation_condition":"none","conversion_method":"none","validation_method":"text","validation_section":"results['result']","content_match":"","content_match_regex":false,"dict_match":{},"negative_logic":false,"delete_spaces_before_matching":false,"run_method":"per_device","serialized":"dict_values(['', True, 0.0, 'name', True, 'admin.*$', False, 'simple_file = \"a.bin\" in results[\"result\"]\\nglob_files = \"bc.bin\" in results[\"result\"] and \"bd.bin\" in results[\"result\"]\\nresults[\"success\"] = simple_file and glob_files', False, '', False, None, 1, '', '2022-12-07 14:43:24.002385', False, None, '', {}, False, \"name = StringField('Name', [InputRequired()])\\ninitial_payload = DictField()\\ntarget_devices = MultipleInstanceField('Devices', model='device')\\ntarget_pools = MultipleInstanceField('Pools', model='pool')\\ndevice_query = StringField('Device Query', python=True, widget=TextArea(), render_kw={'rows': 2})\\ndevice_query_property = SelectField('Query Property Type', choices=(('name', 'Name'), ('ip_address', 'IP address')))\\nmultiprocessing = BooleanField('Multiprocessing', default=False)\\nmax_processes = IntegerField('Maximum number of processes', default=15)\", 'text', 'default', True, 'password', '', False, False, '', 'iteration_value', False, 'exit', '', 'none', '', True, '[(R) Generic File Transfer Service] Check that the files are on the disk', 'username:', False, {}, 'Check that the files are on the disk', False, {}, 1, 'netmiko_commands_service', None, 0, 'dir enms_files', '', [], '', 'always', '', True, 10.0, False, False, None, 'any', 'text', False, False, 'none', False, '', False, 'mail', 10.0, 100, '', '', 'AUp2jvxrv_4', 'name', 'admin', 'success', '', '', False, False, 'per_device', 'Default Value', 10, False, False, 1, '', 15.0, '', '', 'uEjgq5CUwTU', \"results['result']\", False, False, 11, '', 0, '6bd66b7f-a015-40d4-b49e-8234abee21dd', '', 'Definition', False, False, False, 0.1, False, False, '', '', False, None, True, 'admin', '', 'ssh jump_server_IP', 'device', '', 'device', 15])","definition":"Definition","reserved":false,"impacting":true,"completion_time":1,"default_uuid":"6bd66b7f-a015-40d4-b49e-8234abee21dd","mandatory_parameter":"Default Value","admin_only":false,"credentials":"device","custom_username":"","custom_password":"","start_new_connection":false,"connection_name":"default","close_connection":false,"enable_mode":true,"config_mode":false,"commands":"dir enms_files","jinja2_template":false,"results_as_list":false,"driver":"device","use_textfsm":false,"use_genie":false,"read_timeout":10.0,"conn_timeout":10.0,"auth_timeout":0.0,"banner_timeout":15.0,"global_delay_factor":0.1,"expect_string":"","config_mode_command":"","auto_find_prompt":true,"strip_prompt":true,"strip_command":true,"jump_on_connect":false,"jump_command":"ssh jump_server_IP","jump_username":"","jump_password":"","exit_command":"exit","expect_username_prompt":"username:","expect_password_prompt":"password","expect_prompt":"admin.*$"},{"persistent_id":"Mz9EwFk9ARg","name":"[(R) Generic File Transfer Service] Delete all transferred files","creator":"admin","soft_deleted":false,"shared":false,"scoped_name":"Delete all transferred files","creation_time":"","last_modified":"2022-11-09 01:23:32.602769","last_modified_by":"admin","last_run":"","version":"","description":"","priority":11,"number_of_retries":0,"time_between_retries":10,"max_number_of_retries":100,"credential_type":"any","disable_result_creation":false,"restrict_to_owners":[],"vendor":"","operating_system":"","dry_run":false,"waiting_time":0,"device_query":"","device_query_property":"name","update_target_pools":false,"update_pools_after_running":false,"report":"","report_format":"text","report_jinja2_template":false,"disabled":false,"disabled_info":"","display_report":false,"email_report":false,"send_notification":false,"send_notification_method":"mail","notification_header":"","display_only_failed_nodes":false,"include_device_results":false,"include_link_in_summary":false,"mail_recipient":"","mail_subject":"","mail_sender":"","mail_bcc":"","reply_to":"","initial_payload":{},"mandatory_parametrization":false,"parameterized_form":"name = StringField('Name', [InputRequired()])\ninitial_payload = DictField()\ntarget_devices = MultipleInstanceField('Devices', model='device')\ntarget_pools = MultipleInstanceField('Pools', model='pool')\ndevice_query = StringField('Device Query', python=True, widget=TextArea(), render_kw={'rows': 2})\ndevice_query_property = SelectField('Query Property Type', choices=(('name', 'Name'), ('ip_address', 'IP address')))\nmultiprocessing = BooleanField('Multiprocessing', default=False)\nmax_processes = IntegerField('Maximum number of processes', default=15)","parameterized_form_template":"","skip":{},"skip_query":"","skip_value":"success","iteration_values":"","iteration_variable_name":"iteration_value","iteration_devices":"","iteration_devices_property":"name","preprocessing":"","postprocessing":"","postprocessing_mode":"always","builder_link":"uEjgq5CUwTU","log_level":1,"show_user_logs":true,"maximum_runs":1,"multiprocessing":false,"max_processes":15,"validation_condition":"none","conversion_method":"none","validation_method":"text","validation_section":"results['result']","content_match":"","content_match_regex":false,"dict_match":{},"negative_logic":false,"delete_spaces_before_matching":false,"run_method":"per_device","serialized":"dict_values(['', True, 0.0, 'name', True, 'admin.*$', False, '', False, '', False, None, 1, '', '2022-11-09 01:23:32.602769', False, None, '', {}, False, \"name = StringField('Name', [InputRequired()])\\ninitial_payload = DictField()\\ntarget_devices = MultipleInstanceField('Devices', model='device')\\ntarget_pools = MultipleInstanceField('Pools', model='pool')\\ndevice_query = StringField('Device Query', python=True, widget=TextArea(), render_kw={'rows': 2})\\ndevice_query_property = SelectField('Query Property Type', choices=(('name', 'Name'), ('ip_address', 'IP address')))\\nmultiprocessing = BooleanField('Multiprocessing', default=False)\\nmax_processes = IntegerField('Maximum number of processes', default=15)\", 'text', 'default', True, 'password', '', False, False, '', 'iteration_value', False, 'exit', '', 'none', '', True, '[(R) Generic File Transfer Service] Delete all transferred files', 'username:', False, {}, 'Delete all transferred files', False, {}, 1, 'netmiko_commands_service', None, 0, 'delete flash:/enms_files/*.bin', '', [], '', 'always', '', True, 10.0, False, False, None, 'any', 'text', False, False, 'none', False, '', False, 'mail', 10.0, 100, '', '', 'Mz9EwFk9ARg', 'name', 'admin', 'success', '', '', False, False, 'per_device', 'Default Value', 10, False, False, 1, '', 15.0, '', '', 'uEjgq5CUwTU', \"results['result']\", False, False, 11, '', 0, 'f801cf7b-ecd9-47af-a65b-d9d42222ab88', '', 'Definition', False, False, False, 0.1, False, False, '', '', False, None, True, 'admin', '', 'ssh jump_server_IP', 'device', '', 'device', 15])","definition":"Definition","reserved":false,"impacting":true,"completion_time":1,"default_uuid":"f801cf7b-ecd9-47af-a65b-d9d42222ab88","mandatory_parameter":"Default Value","admin_only":false,"credentials":"device","custom_username":"","custom_password":"","start_new_connection":false,"connection_name":"default","close_connection":false,"enable_mode":true,"config_mode":false,"commands":"delete flash:/enms_files/*.bin","jinja2_template":false,"results_as_list":false,"driver":"device","use_textfsm":false,"use_genie":false,"read_timeout":10.0,"conn_timeout":10.0,"auth_timeout":0.0,"banner_timeout":15.0,"global_delay_factor":0.1,"expect_string":"","config_mode_command":"","auto_find_prompt":true,"strip_prompt":true,"strip_command":true,"jump_on_connect":false,"jump_command":"ssh jump_server_IP","jump_username":"","jump_password":"","exit_command":"exit","expect_username_prompt":"username:","expect_password_prompt":"password","expect_prompt":"admin.*$"},{"persistent_id":"QvXFPxkpCio","name":"[(R) Netmiko Prompts Service] Check VRF (NOVRF) exists","creator":"admin","soft_deleted":false,"shared":false,"scoped_name":"Check VRF (NOVRF) exists","creation_time":"","last_modified":"2022-11-09 01:23:32.644322","last_modified_by":"admin","last_run":"","version":"","description":"","priority":11,"number_of_retries":2,"time_between_retries":2,"max_number_of_retries":100,"credential_type":"any","disable_result_creation":false,"restrict_to_owners":[],"vendor":"","operating_system":"","dry_run":false,"waiting_time":0,"device_query":"","device_query_property":"name","update_target_pools":false,"update_pools_after_running":false,"report":"","report_format":"text","report_jinja2_template":false,"disabled":false,"disabled_info":"","display_report":false,"email_report":false,"send_notification":false,"send_notification_method":"mail","notification_header":"","display_only_failed_nodes":false,"include_device_results":true,"include_link_in_summary":false,"mail_recipient":"","mail_subject":"","mail_sender":"","mail_bcc":"","reply_to":"","initial_payload":{},"mandatory_parametrization":false,"parameterized_form":"name = StringField('Name', [InputRequired()])\ninitial_payload = DictField()\ntarget_devices = MultipleInstanceField('Devices', model='device')\ntarget_pools = MultipleInstanceField('Pools', model='pool')\ndevice_query = StringField('Device Query', python=True, widget=TextArea(), render_kw={'rows': 2})\ndevice_query_property = SelectField('Query Property Type', choices=(('name', 'Name'), ('ip_address', 'IP address')))\nmultiprocessing = BooleanField('Multiprocessing', default=False)\nmax_processes = IntegerField('Maximum number of processes', default=15)","parameterized_form_template":"","skip":{},"skip_query":"","skip_value":"success","iteration_values":"","iteration_variable_name":"iteration_value","iteration_devices":"","iteration_devices_property":"name","preprocessing":"","postprocessing":"","postprocessing_mode":"always","builder_link":"jI25HCYGVrQ","log_level":1,"show_user_logs":true,"maximum_runs":1,"multiprocessing":false,"max_processes":15,"validation_condition":"success","conversion_method":"none","validation_method":"text","validation_section":"results['result']","content_match":"NOVRF","content_match_regex":false,"dict_match":{},"negative_logic":false,"delete_spaces_before_matching":false,"run_method":"per_device","serialized":"dict_values(['', True, 0.0, 'name', True, '', False, '', False, '', False, None, 1, '', '2022-11-09 01:23:32.644322', False, None, '', {}, False, \"name = StringField('Name', [InputRequired()])\\ninitial_payload = DictField()\\ntarget_devices = MultipleInstanceField('Devices', model='device')\\ntarget_pools = MultipleInstanceField('Pools', model='pool')\\ndevice_query = StringField('Device Query', python=True, widget=TextArea(), render_kw={'rows': 2})\\ndevice_query_property = SelectField('Query Property Type', choices=(('name', 'Name'), ('ip_address', 'IP address')))\\nmultiprocessing = BooleanField('Multiprocessing', default=False)\\nmax_processes = IntegerField('Maximum number of processes', default=15)\", 'text', 'default', True, '', '', False, False, '', 'iteration_value', False, '', '', 'none', '', True, '[(R) Netmiko Prompts Service] Check VRF (NOVRF) exists', '', False, {}, 'Check VRF (NOVRF) exists', False, {}, 1, 'netmiko_commands_service', None, 2, 'show vrf', '', [], '', 'always', '', True, 10.0, False, False, None, 'any', 'text', False, False, 'success', False, '', False, 'mail', 10.0, 100, '', '', 'QvXFPxkpCio', 'name', 'admin', 'success', '', 'NOVRF', True, False, 'per_device', 'Default Value', 2, False, False, 1, '', 15.0, '', '', 'jI25HCYGVrQ', \"results['result']\", False, False, 11, '', 0, '9e1c4ee2-6f0d-4450-80b8-3843e484bf6d', '', 'Definition', False, False, False, 0.1, False, False, '', '', False, None, True, 'admin', '', '', 'device', '', 'device', 15])","definition":"Definition","reserved":false,"impacting":true,"completion_time":1,"default_uuid":"9e1c4ee2-6f0d-4450-80b8-3843e484bf6d","mandatory_parameter":"Default Value","admin_only":false,"credentials":"device","custom_username":"","custom_password":"","start_new_connection":false,"connection_name":"default","close_connection":false,"enable_mode":true,"config_mode":false,"commands":"show vrf","jinja2_template":false,"results_as_list":false,"driver":"device","use_textfsm":false,"use_genie":false,"read_timeout":10.0,"conn_timeout":10.0,"auth_timeout":0.0,"banner_timeout":15.0,"global_delay_factor":0.1,"expect_string":"","config_mode_command":"","auto_find_prompt":true,"strip_prompt":true,"strip_command":true,"jump_on_connect":false,"jump_command":"","jump_username":"","jump_password":"","exit_command":"","expect_username_prompt":"","expect_password_prompt":"","expect_prompt":""},{"persistent_id":"dTOy7aEy7no","name":"[Functions: factory, fetch, fetch_all, encrypt and get_result] Show vrf with custom encrypted credentials","creator":"admin","soft_deleted":false,"shared":false,"scoped_name":"Show vrf with custom encrypted credentials","creation_time":"","last_modified":"2022-12-04 07:42:49.854606","last_modified_by":"admin","last_run":"","version":"","description":"","priority":11,"number_of_retries":0,"time_between_retries":10,"max_number_of_retries":100,"credential_type":"any","disable_result_creation":false,"restrict_to_owners":[],"vendor":"","operating_system":"","dry_run":false,"waiting_time":0,"device_query":"","device_query_property":"name","update_target_pools":false,"update_pools_after_running":false,"report":"","report_format":"text","report_jinja2_template":false,"disabled":false,"disabled_info":"","display_report":false,"email_report":false,"send_notification":false,"send_notification_method":"mail","notification_header":"","display_only_failed_nodes":false,"include_device_results":false,"include_link_in_summary":false,"mail_recipient":"","mail_subject":"","mail_sender":"","mail_bcc":"","reply_to":"","initial_payload":{},"mandatory_parametrization":false,"parameterized_form":"name = StringField('Name', [InputRequired()])\ninitial_payload = DictField()\ntarget_devices = MultipleInstanceField('Devices', model='device')\ntarget_pools = MultipleInstanceField('Pools', model='pool')\ndevice_query = StringField('Device Query', python=True, widget=TextArea(), render_kw={'rows': 2})\ndevice_query_property = SelectField('Query Property Type', choices=(('name', 'Name'), ('ip_address', 'IP address')))\nmultiprocessing = BooleanField('Multiprocessing', default=False)\nmax_processes = IntegerField('Maximum number of processes', default=15)","parameterized_form_template":"","skip":{},"skip_query":"","skip_value":"success","iteration_values":"","iteration_variable_name":"iteration_value","iteration_devices":"","iteration_devices_property":"name","preprocessing":"","postprocessing":"","postprocessing_mode":"always","builder_link":"LvQPl--B5M0","log_level":1,"show_user_logs":true,"maximum_runs":1,"multiprocessing":false,"max_processes":15,"validation_condition":"none","conversion_method":"none","validation_method":"text","validation_section":"results['result']","content_match":"","content_match_regex":false,"dict_match":{},"negative_logic":false,"delete_spaces_before_matching":false,"run_method":"per_device","serialized":"dict_values(['', True, 0.0, 'name', True, 'admin.*$', False, '', False, '', False, None, 1, '', '2022-12-04 07:42:49.854606', False, None, '', {}, False, \"name = StringField('Name', [InputRequired()])\\ninitial_payload = DictField()\\ntarget_devices = MultipleInstanceField('Devices', model='device')\\ntarget_pools = MultipleInstanceField('Pools', model='pool')\\ndevice_query = StringField('Device Query', python=True, widget=TextArea(), render_kw={'rows': 2})\\ndevice_query_property = SelectField('Query Property Type', choices=(('name', 'Name'), ('ip_address', 'IP address')))\\nmultiprocessing = BooleanField('Multiprocessing', default=False)\\nmax_processes = IntegerField('Maximum number of processes', default=15)\", 'text', 'default', True, 'password', '', False, False, '', 'iteration_value', False, 'exit', '', 'none', '{{ get_result(\"Credentials encryption\", device=device.name)[\"username\"] }}', True, '[Functions: factory, fetch, fetch_all, encrypt and get_result] Show vrf with custom encrypted credentials', 'username:', False, {}, 'Show vrf with custom encrypted credentials', False, {}, 1, 'netmiko_commands_service', None, 0, 'show vrf', '', [], '', 'always', '', True, 10.0, False, False, None, 'any', 'text', False, False, 'none', False, '', False, 'mail', 10.0, 100, '', '', 'dTOy7aEy7no', 'name', 'admin', 'success', '', '', False, False, 'per_device', 'Default Value', 10, False, False, 1, '', 15.0, '', '', 'LvQPl--B5M0', \"results['result']\", False, False, 11, '', 0, '76a56fbc-64f8-4ad7-a51b-8883e32dcd14', '', 'Definition', False, False, False, 0.1, False, False, '', '', False, None, True, 'admin', '', 'ssh jump_server_IP', 'device', '', 'custom', 15])","definition":"Definition","reserved":false,"impacting":true,"completion_time":1,"default_uuid":"76a56fbc-64f8-4ad7-a51b-8883e32dcd14","mandatory_parameter":"Default Value","admin_only":false,"credentials":"custom","custom_username":"{{ get_result(\"Credentials encryption\", device=device.name)[\"username\"] }}","custom_password":"e3sgZ2V0X3Jlc3VsdCgiQ3JlZGVudGlhbHMgZW5jcnlwdGlvbiIsIGRldmljZT1kZXZpY2UubmFtZSlbInBhc3N3b3JkIl0gfX0=","start_new_connection":false,"connection_name":"default","close_connection":false,"enable_mode":true,"config_mode":false,"commands":"show vrf","jinja2_template":false,"results_as_list":false,"driver":"device","use_textfsm":false,"use_genie":false,"read_timeout":10.0,"conn_timeout":10.0,"auth_timeout":0.0,"banner_timeout":15.0,"global_delay_factor":0.1,"expect_string":"","config_mode_command":"","auto_find_prompt":true,"strip_prompt":true,"strip_command":true,"jump_on_connect":false,"jump_command":"ssh jump_server_IP","jump_username":"","jump_password":"","exit_command":"exit","expect_username_prompt":"username:","expect_password_prompt":"password","expect_prompt":"admin.*$"},{"persistent_id":"llTs8FpBiP4","name":"[Fork based on value with Skip Discard Mechanism] Show VRF","creator":"admin","soft_deleted":false,"shared":false,"scoped_name":"Show VRF","creation_time":"","last_modified":"2022-11-09 01:23:32.684932","last_modified_by":"admin","last_run":"","version":"","description":"","priority":11,"number_of_retries":0,"time_between_retries":10,"max_number_of_retries":100,"credential_type":"any","disable_result_creation":false,"restrict_to_owners":[],"vendor":"","operating_system":"","dry_run":false,"waiting_time":0,"device_query":"","device_query_property":"name","update_target_pools":false,"update_pools_after_running":false,"report":"","report_format":"text","report_jinja2_template":false,"disabled":false,"disabled_info":"","display_report":false,"email_report":false,"send_notification":false,"send_notification_method":"mail","notification_header":"","display_only_failed_nodes":false,"include_device_results":false,"include_link_in_summary":false,"mail_recipient":"","mail_subject":"","mail_sender":"","mail_bcc":"","reply_to":"","initial_payload":{},"mandatory_parametrization":false,"parameterized_form":"name = StringField('Name', [InputRequired()])\ninitial_payload = DictField()\ntarget_devices = MultipleInstanceField('Devices', model='device')\ntarget_pools = MultipleInstanceField('Pools', model='pool')\ndevice_query = StringField('Device Query', python=True, widget=TextArea(), render_kw={'rows': 2})\ndevice_query_property = SelectField('Query Property Type', choices=(('name', 'Name'), ('ip_address', 'IP address')))\nmultiprocessing = BooleanField('Multiprocessing', default=False)\nmax_processes = IntegerField('Maximum number of processes', default=15)","parameterized_form_template":"","skip":{},"skip_query":"","skip_value":"success","iteration_values":"","iteration_variable_name":"iteration_value","iteration_devices":"","iteration_devices_property":"name","preprocessing":"","postprocessing":"","postprocessing_mode":"always","builder_link":"sDGlN6Ru_Vg","log_level":1,"show_user_logs":true,"maximum_runs":1,"multiprocessing":false,"max_processes":15,"validation_condition":"none","conversion_method":"none","validation_method":"text","validation_section":"results['result']","content_match":"","content_match_regex":false,"dict_match":{},"negative_logic":false,"delete_spaces_before_matching":false,"run_method":"per_device","serialized":"dict_values(['', True, 0.0, 'name', True, 'admin.*$', False, '', False, '', False, None, 1, '', '2022-11-09 01:23:32.684932', False, None, '', {}, False, \"name = StringField('Name', [InputRequired()])\\ninitial_payload = DictField()\\ntarget_devices = MultipleInstanceField('Devices', model='device')\\ntarget_pools = MultipleInstanceField('Pools', model='pool')\\ndevice_query = StringField('Device Query', python=True, widget=TextArea(), render_kw={'rows': 2})\\ndevice_query_property = SelectField('Query Property Type', choices=(('name', 'Name'), ('ip_address', 'IP address')))\\nmultiprocessing = BooleanField('Multiprocessing', default=False)\\nmax_processes = IntegerField('Maximum number of processes', default=15)\", 'text', 'default', True, 'password', '', False, False, '', 'iteration_value', False, 'exit', '', 'none', '', True, '[Fork based on value with Skip Discard Mechanism] Show VRF', 'username:', False, {}, 'Show VRF', False, {}, 1, 'netmiko_commands_service', None, 0, 'show vrf', '', [], '', 'always', '', True, 10.0, False, False, None, 'any', 'text', False, False, 'none', False, '', False, 'mail', 10.0, 100, '', '', 'llTs8FpBiP4', 'name', 'admin', 'success', '', '', False, False, 'per_device', 'Default Value', 10, False, False, 1, '', 15.0, '', '', 'sDGlN6Ru_Vg', \"results['result']\", False, False, 11, '', 0, '989a75aa-6888-44aa-a72b-038c1ef9a928', '', 'Definition', False, False, False, 0.1, False, False, '', '', False, None, True, 'admin', '', 'ssh jump_server_IP', 'device', '', 'device', 15])","definition":"Definition","reserved":false,"impacting":true,"completion_time":1,"default_uuid":"989a75aa-6888-44aa-a72b-038c1ef9a928","mandatory_parameter":"Default Value","admin_only":false,"credentials":"device","custom_username":"","custom_password":"","start_new_connection":false,"connection_name":"default","close_connection":false,"enable_mode":true,"config_mode":false,"commands":"show vrf","jinja2_template":false,"results_as_list":false,"driver":"device","use_textfsm":false,"use_genie":false,"read_timeout":10.0,"conn_timeout":10.0,"auth_timeout":0.0,"banner_timeout":15.0,"global_delay_factor":0.1,"expect_string":"","config_mode_command":"","auto_find_prompt":true,"strip_prompt":true,"strip_command":true,"jump_on_connect":false,"jump_command":"ssh jump_server_IP","jump_username":"","jump_password":"","exit_command":"exit","expect_username_prompt":"username:","expect_password_prompt":"password","expect_prompt":"admin.*$"},{"persistent_id":"8Y5KK92Zj7A","name":"Connect to Router with Device Credentials","creator":"admin","soft_deleted":false,"shared":false,"scoped_name":"Connect to Router with Device Credentials","creation_time":"","last_modified":"2022-11-09 01:23:32.749308","last_modified_by":"admin","last_run":"","version":"","description":"","priority":11,"number_of_retries":0,"time_between_retries":10,"max_number_of_retries":100,"credential_type":"any","disable_result_creation":false,"restrict_to_owners":[],"vendor":"","operating_system":"","dry_run":false,"waiting_time":0,"device_query":"","device_query_property":"name","update_target_pools":false,"update_pools_after_running":false,"report":"","report_format":"text","report_jinja2_template":false,"disabled":false,"disabled_info":"","display_report":false,"email_report":false,"send_notification":false,"send_notification_method":"mail","notification_header":"","display_only_failed_nodes":false,"include_device_results":false,"include_link_in_summary":false,"mail_recipient":"","mail_subject":"","mail_sender":"","mail_bcc":"","reply_to":"","initial_payload":{},"mandatory_parametrization":false,"parameterized_form":"name = StringField('Name', [InputRequired()])\ninitial_payload = DictField()\ntarget_devices = MultipleInstanceField('Devices', model='device')\ntarget_pools = MultipleInstanceField('Pools', model='pool')\ndevice_query = StringField('Device Query', python=True, widget=TextArea(), render_kw={'rows': 2})\ndevice_query_property = SelectField('Query Property Type', choices=(('name', 'Name'), ('ip_address', 'IP address')))\nmultiprocessing = BooleanField('Multiprocessing', default=False)\nmax_processes = IntegerField('Maximum number of processes', default=15)","parameterized_form_template":"","skip":{},"skip_query":"","skip_value":"success","iteration_values":"","iteration_variable_name":"iteration_value","iteration_devices":"","iteration_devices_property":"name","preprocessing":"","postprocessing":"","postprocessing_mode":"always","builder_link":"","log_level":1,"show_user_logs":true,"maximum_runs":1,"multiprocessing":false,"max_processes":15,"validation_condition":"none","conversion_method":"none","validation_method":"text","validation_section":"results['result']","content_match":"","content_match_regex":false,"dict_match":{},"negative_logic":false,"delete_spaces_before_matching":false,"run_method":"per_device","serialized":"dict_values(['', True, 0.0, 'name', True, 'admin.*$', False, '', False, '', False, None, 1, '', '2022-11-09 01:23:32.749308', False, None, '', {}, False, \"name = StringField('Name', [InputRequired()])\\ninitial_payload = DictField()\\ntarget_devices = MultipleInstanceField('Devices', model='device')\\ntarget_pools = MultipleInstanceField('Pools', model='pool')\\ndevice_query = StringField('Device Query', python=True, widget=TextArea(), render_kw={'rows': 2})\\ndevice_query_property = SelectField('Query Property Type', choices=(('name', 'Name'), ('ip_address', 'IP address')))\\nmultiprocessing = BooleanField('Multiprocessing', default=False)\\nmax_processes = IntegerField('Maximum number of processes', default=15)\", 'text', 'default', True, 'password', '', False, False, '', 'iteration_value', False, 'exit', '', 'none', '', True, 'Connect to Router with Device Credentials', 'username:', False, {}, 'Connect to Router with Device Credentials', False, {}, 1, 'netmiko_commands_service', None, 0, 'show run', '', [], '', 'always', '', True, 10.0, False, False, None, 'any', 'text', False, False, 'none', False, '', False, 'mail', 10.0, 100, '', '', '8Y5KK92Zj7A', 'name', 'admin', 'success', '', '', False, False, 'per_device', 'Default Value', 10, False, False, 1, '', 15.0, '', '', '', \"results['result']\", False, False, 11, '', 0, '6d816a51-3740-498a-a5f6-3382d9adb0df', '', 'Definition', False, False, False, 0.1, False, False, '', '', False, None, True, 'admin', '', 'ssh jump_server_IP', 'device', '', 'device', 15])","definition":"Definition","reserved":false,"impacting":true,"completion_time":1,"default_uuid":"6d816a51-3740-498a-a5f6-3382d9adb0df","mandatory_parameter":"Default Value","admin_only":false,"credentials":"device","custom_username":"","custom_password":"","start_new_connection":false,"connection_name":"default","close_connection":false,"enable_mode":true,"config_mode":false,"commands":"show run","jinja2_template":false,"results_as_list":false,"driver":"device","use_textfsm":false,"use_genie":false,"read_timeout":10.0,"conn_timeout":10.0,"auth_timeout":0.0,"banner_timeout":15.0,"global_delay_factor":0.1,"expect_string":"","config_mode_command":"","auto_find_prompt":true,"strip_prompt":true,"strip_command":true,"jump_on_connect":false,"jump_command":"ssh jump_server_IP","jump_username":"","jump_password":"","exit_command":"exit","expect_username_prompt":"username:","expect_password_prompt":"password","expect_prompt":"admin.*$"},{"persistent_id":"xzJU_mLJv8g","name":"[(R) Credentials (Password & Key, Priority Mechanism)] Show interfaces with netmiko","creator":"admin","soft_deleted":false,"shared":false,"scoped_name":"Show interfaces with netmiko","creation_time":"","last_modified":"2022-11-09 01:23:32.760359","last_modified_by":"admin","last_run":"","version":"","description":"","priority":11,"number_of_retries":0,"time_between_retries":10,"max_number_of_retries":100,"credential_type":"any","disable_result_creation":false,"restrict_to_owners":[],"vendor":"","operating_system":"","dry_run":false,"waiting_time":0,"device_query":"","device_query_property":"name","update_target_pools":false,"update_pools_after_running":false,"report":"","report_format":"text","report_jinja2_template":false,"disabled":false,"disabled_info":"","display_report":false,"email_report":false,"send_notification":false,"send_notification_method":"mail","notification_header":"","display_only_failed_nodes":false,"include_device_results":false,"include_link_in_summary":false,"mail_recipient":"","mail_subject":"","mail_sender":"","mail_bcc":"","reply_to":"","initial_payload":{},"mandatory_parametrization":false,"parameterized_form":"name = StringField('Name', [InputRequired()])\ninitial_payload = DictField()\ntarget_devices = MultipleInstanceField('Devices', model='device')\ntarget_pools = MultipleInstanceField('Pools', model='pool')\ndevice_query = StringField('Device Query', python=True, widget=TextArea(), render_kw={'rows': 2})\ndevice_query_property = SelectField('Query Property Type', choices=(('name', 'Name'), ('ip_address', 'IP address')))\nmultiprocessing = BooleanField('Multiprocessing', default=False)\nmax_processes = IntegerField('Maximum number of processes', default=15)","parameterized_form_template":"","skip":{},"skip_query":"","skip_value":"success","iteration_values":"","iteration_variable_name":"iteration_value","iteration_devices":"","iteration_devices_property":"name","preprocessing":"","postprocessing":"","postprocessing_mode":"always","builder_link":"NYVhBGLM3UA","log_level":1,"show_user_logs":true,"maximum_runs":1,"multiprocessing":false,"max_processes":15,"validation_condition":"none","conversion_method":"none","validation_method":"text","validation_section":"results['result']","content_match":"","content_match_regex":false,"dict_match":{},"negative_logic":false,"delete_spaces_before_matching":false,"run_method":"per_device","serialized":"dict_values(['', True, 0.0, 'name', True, 'admin.*$', False, '', False, '', False, None, 1, '', '2022-11-09 01:23:32.760359', False, None, '', {}, False, \"name = StringField('Name', [InputRequired()])\\ninitial_payload = DictField()\\ntarget_devices = MultipleInstanceField('Devices', model='device')\\ntarget_pools = MultipleInstanceField('Pools', model='pool')\\ndevice_query = StringField('Device Query', python=True, widget=TextArea(), render_kw={'rows': 2})\\ndevice_query_property = SelectField('Query Property Type', choices=(('name', 'Name'), ('ip_address', 'IP address')))\\nmultiprocessing = BooleanField('Multiprocessing', default=False)\\nmax_processes = IntegerField('Maximum number of processes', default=15)\", 'text', 'default', True, 'password', '', False, False, '', 'iteration_value', False, 'exit', '', 'none', '', True, '[(R) Credentials (Password & Key, Priority Mechanism)] Show interfaces with netmiko', 'username:', False, {}, 'Show interfaces with netmiko', False, {}, 1, 'netmiko_commands_service', None, 0, 'show interfaces', '', [], '', 'always', '', True, 10.0, False, False, None, 'any', 'text', False, False, 'none', False, '', False, 'mail', 10.0, 100, '', '', 'xzJU_mLJv8g', 'name', 'admin', 'success', '', '', False, False, 'per_device', 'Default Value', 10, False, False, 1, '', 15.0, '', '', 'NYVhBGLM3UA', \"results['result']\", False, False, 11, '', 0, '59fce2e6-4092-4ab8-8ff1-cb6435bfc977', '', 'Definition', False, False, False, 0.1, False, False, '', '', False, None, True, 'admin', '', 'ssh jump_server_IP', 'device', '', 'device', 15])","definition":"Definition","reserved":false,"impacting":true,"completion_time":1,"default_uuid":"59fce2e6-4092-4ab8-8ff1-cb6435bfc977","mandatory_parameter":"Default Value","admin_only":false,"credentials":"device","custom_username":"","custom_password":"","start_new_connection":false,"connection_name":"default","close_connection":false,"enable_mode":true,"config_mode":false,"commands":"show interfaces","jinja2_template":false,"results_as_list":false,"driver":"device","use_textfsm":false,"use_genie":false,"read_timeout":10.0,"conn_timeout":10.0,"auth_timeout":0.0,"banner_timeout":15.0,"global_delay_factor":0.1,"expect_string":"","config_mode_command":"","auto_find_prompt":true,"strip_prompt":true,"strip_command":true,"jump_on_connect":false,"jump_command":"ssh jump_server_IP","jump_username":"","jump_password":"","exit_command":"exit","expect_username_prompt":"username:","expect_password_prompt":"password","expect_prompt":"admin.*$"},{"persistent_id":"BQ_v2b_psl4","name":"[(R) Labels and Custom Property] Show interface from initial form (default: Lo1)","creator":"admin","soft_deleted":false,"shared":false,"scoped_name":"Show interface from initial form (default: Lo1)","creation_time":"","last_modified":"2022-11-09 01:23:32.836462","last_modified_by":"admin","last_run":"","version":"","description":"","priority":11,"number_of_retries":0,"time_between_retries":10,"max_number_of_retries":100,"credential_type":"any","disable_result_creation":false,"restrict_to_owners":[],"vendor":"","operating_system":"","dry_run":false,"waiting_time":0,"device_query":"","device_query_property":"name","update_target_pools":false,"update_pools_after_running":false,"report":"","report_format":"text","report_jinja2_template":false,"disabled":false,"disabled_info":"","display_report":false,"email_report":false,"send_notification":false,"send_notification_method":"mail","notification_header":"","display_only_failed_nodes":false,"include_device_results":false,"include_link_in_summary":false,"mail_recipient":"","mail_subject":"","mail_sender":"","mail_bcc":"","reply_to":"","initial_payload":{},"mandatory_parametrization":false,"parameterized_form":"name = StringField('Name', [InputRequired()])\ninitial_payload = DictField()\ntarget_devices = MultipleInstanceField('Devices', model='device')\ntarget_pools = MultipleInstanceField('Pools', model='pool')\ndevice_query = StringField('Device Query', python=True, widget=TextArea(), render_kw={'rows': 2})\ndevice_query_property = SelectField('Query Property Type', choices=(('name', 'Name'), ('ip_address', 'IP address')))\nmultiprocessing = BooleanField('Multiprocessing', default=False)\nmax_processes = IntegerField('Maximum number of processes', default=15)","parameterized_form_template":"","skip":{},"skip_query":"","skip_value":"success","iteration_values":"","iteration_variable_name":"iteration_value","iteration_devices":"","iteration_devices_property":"name","preprocessing":"","postprocessing":"","postprocessing_mode":"always","builder_link":"1dmkk3ifSIk","log_level":1,"show_user_logs":true,"maximum_runs":1,"multiprocessing":false,"max_processes":15,"validation_condition":"none","conversion_method":"none","validation_method":"text","validation_section":"results['result']","content_match":"","content_match_regex":false,"dict_match":{},"negative_logic":false,"delete_spaces_before_matching":false,"run_method":"per_device","serialized":"dict_values(['', True, 0.0, 'name', True, 'admin.*$', False, '', False, '', False, None, 1, '', '2022-11-09 01:23:32.836462', False, None, '', {}, False, \"name = StringField('Name', [InputRequired()])\\ninitial_payload = DictField()\\ntarget_devices = MultipleInstanceField('Devices', model='device')\\ntarget_pools = MultipleInstanceField('Pools', model='pool')\\ndevice_query = StringField('Device Query', python=True, widget=TextArea(), render_kw={'rows': 2})\\ndevice_query_property = SelectField('Query Property Type', choices=(('name', 'Name'), ('ip_address', 'IP address')))\\nmultiprocessing = BooleanField('Multiprocessing', default=False)\\nmax_processes = IntegerField('Maximum number of processes', default=15)\", 'text', 'default', True, 'password', '', False, False, '', 'iteration_value', False, 'exit', '', 'none', '', True, '[(R) Labels and Custom Property] Show interface from initial form (default: Lo1)', 'username:', False, {}, 'Show interface from initial form (default: Lo1)', False, {}, 1, 'netmiko_commands_service', None, 0, 'show interface {{payload[\"form\"][\"interface\"]}}', '', [], '', 'always', '', True, 10.0, False, False, None, 'any', 'text', False, False, 'none', False, '', False, 'mail', 10.0, 100, '', '', 'BQ_v2b_psl4', 'name', 'admin', 'success', '', '', False, False, 'per_device', 'Default Value', 10, False, False, 1, '', 15.0, '', '', '1dmkk3ifSIk', \"results['result']\", False, False, 11, '', 0, '746e4cf7-74e6-498f-ae2b-6bdfce04a59b', '', 'Definition', False, False, False, 0.1, False, False, '', '', False, None, False, 'admin', '', 'ssh jump_server_IP', 'device', '', 'device', 15])","definition":"Definition","reserved":false,"impacting":false,"completion_time":1,"default_uuid":"746e4cf7-74e6-498f-ae2b-6bdfce04a59b","mandatory_parameter":"Default Value","admin_only":false,"credentials":"device","custom_username":"","custom_password":"","start_new_connection":false,"connection_name":"default","close_connection":false,"enable_mode":true,"config_mode":false,"commands":"show interface {{payload[\"form\"][\"interface\"]}}","jinja2_template":false,"results_as_list":false,"driver":"device","use_textfsm":false,"use_genie":false,"read_timeout":10.0,"conn_timeout":10.0,"auth_timeout":0.0,"banner_timeout":15.0,"global_delay_factor":0.1,"expect_string":"","config_mode_command":"","auto_find_prompt":true,"strip_prompt":true,"strip_command":true,"jump_on_connect":false,"jump_command":"ssh jump_server_IP","jump_username":"","jump_password":"","exit_command":"exit","expect_username_prompt":"username:","expect_password_prompt":"password","expect_prompt":"admin.*$"},{"persistent_id":"tJr853f9vvQ","name":"[(R) Multiple parallel connections to same device] Show VRF with default connection","creator":"admin","soft_deleted":false,"shared":false,"scoped_name":"Show VRF with default connection","creation_time":"","last_modified":"2022-11-09 01:23:32.886238","last_modified_by":"admin","last_run":"","version":"","description":"","priority":11,"number_of_retries":0,"time_between_retries":10,"max_number_of_retries":100,"credential_type":"any","disable_result_creation":false,"restrict_to_owners":[],"vendor":"","operating_system":"","dry_run":false,"waiting_time":0,"device_query":"","device_query_property":"name","update_target_pools":false,"update_pools_after_running":false,"report":"","report_format":"text","report_jinja2_template":false,"disabled":false,"disabled_info":"","display_report":false,"email_report":false,"send_notification":false,"send_notification_method":"mail","notification_header":"","display_only_failed_nodes":false,"include_device_results":false,"include_link_in_summary":false,"mail_recipient":"","mail_subject":"","mail_sender":"","mail_bcc":"","reply_to":"","initial_payload":{},"mandatory_parametrization":false,"parameterized_form":"name = StringField('Name', [InputRequired()])\ninitial_payload = DictField()\ntarget_devices = MultipleInstanceField('Devices', model='device')\ntarget_pools = MultipleInstanceField('Pools', model='pool')\ndevice_query = StringField('Device Query', python=True, widget=TextArea(), render_kw={'rows': 2})\ndevice_query_property = SelectField('Query Property Type', choices=(('name', 'Name'), ('ip_address', 'IP address')))\nmultiprocessing = BooleanField('Multiprocessing', default=False)\nmax_processes = IntegerField('Maximum number of processes', default=15)","parameterized_form_template":"","skip":{},"skip_query":"","skip_value":"success","iteration_values":"","iteration_variable_name":"iteration_value","iteration_devices":"","iteration_devices_property":"name","preprocessing":"","postprocessing":"","postprocessing_mode":"success","builder_link":"FVxpAHKyPaE","log_level":1,"show_user_logs":true,"maximum_runs":1,"multiprocessing":false,"max_processes":15,"validation_condition":"none","conversion_method":"none","validation_method":"text","validation_section":"results['result']","content_match":"","content_match_regex":false,"dict_match":{},"negative_logic":false,"delete_spaces_before_matching":false,"run_method":"per_device","serialized":"dict_values(['', True, 0.0, 'name', True, 'admin.*$', False, '', False, '', False, None, 1, '', '2022-11-09 01:23:32.886238', False, None, '', {}, False, \"name = StringField('Name', [InputRequired()])\\ninitial_payload = DictField()\\ntarget_devices = MultipleInstanceField('Devices', model='device')\\ntarget_pools = MultipleInstanceField('Pools', model='pool')\\ndevice_query = StringField('Device Query', python=True, widget=TextArea(), render_kw={'rows': 2})\\ndevice_query_property = SelectField('Query Property Type', choices=(('name', 'Name'), ('ip_address', 'IP address')))\\nmultiprocessing = BooleanField('Multiprocessing', default=False)\\nmax_processes = IntegerField('Maximum number of processes', default=15)\", 'text', 'default', True, 'password', '', False, False, '', 'iteration_value', False, 'exit', '', 'none', '', True, '[(R) Multiple parallel connections to same device] Show VRF with default connection', 'username:', False, {}, 'Show VRF with default connection', False, {}, 1, 'netmiko_commands_service', None, 0, 'show vrf', '', [], '', 'success', '', True, 10.0, False, False, None, 'any', 'text', False, False, 'none', False, '', False, 'mail', 10.0, 100, '', '', 'tJr853f9vvQ', 'name', 'admin', 'success', '', '', False, False, 'per_device', 'Default Value', 10, False, False, 1, '', 15.0, '', '', 'FVxpAHKyPaE', \"results['result']\", False, False, 11, '', 0, '5f18826d-2fc7-4398-9323-a48821d6791d', '', 'Definition', False, False, False, 0.1, False, False, '', '', False, None, False, 'admin', '', 'ssh jump_server_IP', 'device', '', 'device', 15])","definition":"Definition","reserved":false,"impacting":false,"completion_time":1,"default_uuid":"5f18826d-2fc7-4398-9323-a48821d6791d","mandatory_parameter":"Default Value","admin_only":false,"credentials":"device","custom_username":"","custom_password":"","start_new_connection":false,"connection_name":"default","close_connection":false,"enable_mode":true,"config_mode":false,"commands":"show vrf","jinja2_template":false,"results_as_list":false,"driver":"device","use_textfsm":false,"use_genie":false,"read_timeout":10.0,"conn_timeout":10.0,"auth_timeout":0.0,"banner_timeout":15.0,"global_delay_factor":0.1,"expect_string":"","config_mode_command":"","auto_find_prompt":true,"strip_prompt":true,"strip_command":true,"jump_on_connect":false,"jump_command":"ssh jump_server_IP","jump_username":"","jump_password":"","exit_command":"exit","expect_username_prompt":"username:","expect_password_prompt":"password","expect_prompt":"admin.*$"},{"persistent_id":"lvQHxacetYk","name":"[(R) Multiple parallel connections to same device] Show VRF with connection connection2","creator":"admin","soft_deleted":false,"shared":false,"scoped_name":"Show VRF with connection connection2","creation_time":"","last_modified":"2022-11-09 01:23:32.888984","last_modified_by":"admin","last_run":"","version":"","description":"","priority":11,"number_of_retries":0,"time_between_retries":10,"max_number_of_retries":100,"credential_type":"any","disable_result_creation":false,"restrict_to_owners":[],"vendor":"","operating_system":"","dry_run":false,"waiting_time":0,"device_query":"","device_query_property":"name","update_target_pools":false,"update_pools_after_running":false,"report":"","report_format":"text","report_jinja2_template":false,"disabled":false,"disabled_info":"","display_report":false,"email_report":false,"send_notification":false,"send_notification_method":"mail","notification_header":"","display_only_failed_nodes":false,"include_device_results":false,"include_link_in_summary":false,"mail_recipient":"","mail_subject":"","mail_sender":"","mail_bcc":"","reply_to":"","initial_payload":{},"mandatory_parametrization":false,"parameterized_form":"name = StringField('Name', [InputRequired()])\ninitial_payload = DictField()\ntarget_devices = MultipleInstanceField('Devices', model='device')\ntarget_pools = MultipleInstanceField('Pools', model='pool')\ndevice_query = StringField('Device Query', python=True, widget=TextArea(), render_kw={'rows': 2})\ndevice_query_property = SelectField('Query Property Type', choices=(('name', 'Name'), ('ip_address', 'IP address')))\nmultiprocessing = BooleanField('Multiprocessing', default=False)\nmax_processes = IntegerField('Maximum number of processes', default=15)","parameterized_form_template":"","skip":{},"skip_query":"","skip_value":"success","iteration_values":"","iteration_variable_name":"iteration_value","iteration_devices":"","iteration_devices_property":"name","preprocessing":"","postprocessing":"","postprocessing_mode":"success","builder_link":"FVxpAHKyPaE","log_level":1,"show_user_logs":true,"maximum_runs":1,"multiprocessing":false,"max_processes":15,"validation_condition":"none","conversion_method":"none","validation_method":"text","validation_section":"results['result']","content_match":"","content_match_regex":false,"dict_match":{},"negative_logic":false,"delete_spaces_before_matching":false,"run_method":"per_device","serialized":"dict_values(['', True, 0.0, 'name', True, 'admin.*$', False, '', False, '', False, None, 1, '', '2022-11-09 01:23:32.888984', False, None, '', {}, False, \"name = StringField('Name', [InputRequired()])\\ninitial_payload = DictField()\\ntarget_devices = MultipleInstanceField('Devices', model='device')\\ntarget_pools = MultipleInstanceField('Pools', model='pool')\\ndevice_query = StringField('Device Query', python=True, widget=TextArea(), render_kw={'rows': 2})\\ndevice_query_property = SelectField('Query Property Type', choices=(('name', 'Name'), ('ip_address', 'IP address')))\\nmultiprocessing = BooleanField('Multiprocessing', default=False)\\nmax_processes = IntegerField('Maximum number of processes', default=15)\", 'text', 'connection2', True, 'password', '', False, False, '', 'iteration_value', False, 'exit', '', 'none', '', True, '[(R) Multiple parallel connections to same device] Show VRF with connection connection2', 'username:', False, {}, 'Show VRF with connection connection2', False, {}, 1, 'netmiko_commands_service', None, 0, 'show vrf', '', [], '', 'success', '', True, 10.0, False, False, None, 'any', 'text', False, False, 'none', False, '', False, 'mail', 10.0, 100, '', '', 'lvQHxacetYk', 'name', 'admin', 'success', '', '', False, False, 'per_device', 'Default Value', 10, False, False, 1, '', 15.0, '', '', 'FVxpAHKyPaE', \"results['result']\", False, False, 11, '', 0, '389983a9-1e6f-4e1e-9dec-67a37d5eebf8', '', 'Definition', False, False, False, 0.1, False, False, '', '', False, None, False, 'admin', '', 'ssh jump_server_IP', 'device', '', 'device', 15])","definition":"Definition","reserved":false,"impacting":false,"completion_time":1,"default_uuid":"389983a9-1e6f-4e1e-9dec-67a37d5eebf8","mandatory_parameter":"Default Value","admin_only":false,"credentials":"device","custom_username":"","custom_password":"","start_new_connection":false,"connection_name":"connection2","close_connection":false,"enable_mode":true,"config_mode":false,"commands":"show vrf","jinja2_template":false,"results_as_list":false,"driver":"device","use_textfsm":false,"use_genie":false,"read_timeout":10.0,"conn_timeout":10.0,"auth_timeout":0.0,"banner_timeout":15.0,"global_delay_factor":0.1,"expect_string":"","config_mode_command":"","auto_find_prompt":true,"strip_prompt":true,"strip_command":true,"jump_on_connect":false,"jump_command":"ssh jump_server_IP","jump_username":"","jump_password":"","exit_command":"exit","expect_username_prompt":"username:","expect_password_prompt":"password","expect_prompt":"admin.*$"},{"persistent_id":"PS4gZDUSylQ","name":"[(R) Multiple parallel connections to same device] Show users with connection2 and close","creator":"admin","soft_deleted":false,"shared":false,"scoped_name":"Show users with connection2 and close","creation_time":"","last_modified":"2022-11-09 01:23:32.891709","last_modified_by":"admin","last_run":"","version":"","description":"","priority":11,"number_of_retries":0,"time_between_retries":10,"max_number_of_retries":100,"credential_type":"any","disable_result_creation":false,"restrict_to_owners":[],"vendor":"","operating_system":"","dry_run":false,"waiting_time":0,"device_query":"","device_query_property":"name","update_target_pools":false,"update_pools_after_running":false,"report":"","report_format":"text","report_jinja2_template":false,"disabled":false,"disabled_info":"","display_report":false,"email_report":false,"send_notification":false,"send_notification_method":"mail","notification_header":"","display_only_failed_nodes":false,"include_device_results":false,"include_link_in_summary":false,"mail_recipient":"","mail_subject":"","mail_sender":"","mail_bcc":"","reply_to":"","initial_payload":{},"mandatory_parametrization":false,"parameterized_form":"name = StringField('Name', [InputRequired()])\ninitial_payload = DictField()\ntarget_devices = MultipleInstanceField('Devices', model='device')\ntarget_pools = MultipleInstanceField('Pools', model='pool')\ndevice_query = StringField('Device Query', python=True, widget=TextArea(), render_kw={'rows': 2})\ndevice_query_property = SelectField('Query Property Type', choices=(('name', 'Name'), ('ip_address', 'IP address')))\nmultiprocessing = BooleanField('Multiprocessing', default=False)\nmax_processes = IntegerField('Maximum number of processes', default=15)","parameterized_form_template":"","skip":{},"skip_query":"","skip_value":"success","iteration_values":"","iteration_variable_name":"iteration_value","iteration_devices":"","iteration_devices_property":"name","preprocessing":"","postprocessing":"","postprocessing_mode":"success","builder_link":"FVxpAHKyPaE","log_level":1,"show_user_logs":true,"maximum_runs":1,"multiprocessing":false,"max_processes":15,"validation_condition":"none","conversion_method":"none","validation_method":"text","validation_section":"results['result']","content_match":"","content_match_regex":false,"dict_match":{},"negative_logic":false,"delete_spaces_before_matching":false,"run_method":"per_device","serialized":"dict_values(['', True, 0.0, 'name', True, 'admin.*$', False, '', False, '', False, None, 1, '', '2022-11-09 01:23:32.891709', True, None, '', {}, False, \"name = StringField('Name', [InputRequired()])\\ninitial_payload = DictField()\\ntarget_devices = MultipleInstanceField('Devices', model='device')\\ntarget_pools = MultipleInstanceField('Pools', model='pool')\\ndevice_query = StringField('Device Query', python=True, widget=TextArea(), render_kw={'rows': 2})\\ndevice_query_property = SelectField('Query Property Type', choices=(('name', 'Name'), ('ip_address', 'IP address')))\\nmultiprocessing = BooleanField('Multiprocessing', default=False)\\nmax_processes = IntegerField('Maximum number of processes', default=15)\", 'text', 'connection2', True, 'password', '', False, False, '', 'iteration_value', False, 'exit', '', 'none', '', True, '[(R) Multiple parallel connections to same device] Show users with connection2 and close', 'username:', False, {}, 'Show users with connection2 and close', False, {}, 1, 'netmiko_commands_service', None, 0, 'show vrf', '', [], '', 'success', '', True, 10.0, False, False, None, 'any', 'text', False, False, 'none', False, '', False, 'mail', 10.0, 100, '', '', 'PS4gZDUSylQ', 'name', 'admin', 'success', '', '', False, False, 'per_device', 'Default Value', 10, False, False, 1, '', 15.0, '', '', 'FVxpAHKyPaE', \"results['result']\", False, False, 11, '', 0, '2478ee9e-fafc-43e2-80aa-a117c99c9167', '', 'Definition', False, False, False, 0.1, False, False, '', '', False, None, False, 'admin', '', 'ssh jump_server_IP', 'device', '', 'device', 15])","definition":"Definition","reserved":false,"impacting":false,"completion_time":1,"default_uuid":"2478ee9e-fafc-43e2-80aa-a117c99c9167","mandatory_parameter":"Default Value","admin_only":false,"credentials":"device","custom_username":"","custom_password":"","start_new_connection":false,"connection_name":"connection2","close_connection":true,"enable_mode":true,"config_mode":false,"commands":"show vrf","jinja2_template":false,"results_as_list":false,"driver":"device","use_textfsm":false,"use_genie":false,"read_timeout":10.0,"conn_timeout":10.0,"auth_timeout":0.0,"banner_timeout":15.0,"global_delay_factor":0.1,"expect_string":"","config_mode_command":"","auto_find_prompt":true,"strip_prompt":true,"strip_command":true,"jump_on_connect":false,"jump_command":"ssh jump_server_IP","jump_username":"","jump_password":"","exit_command":"exit","expect_username_prompt":"username:","expect_password_prompt":"password","expect_prompt":"admin.*$"},{"persistent_id":"1X9tScYqa_M","name":"[(R) Netmiko File Transfer Service] Check no file in enms_files directory","creator":"admin","soft_deleted":false,"shared":false,"scoped_name":"Check no file in enms_files directory","creation_time":"","last_modified":"2023-05-23 17:10:39.542604","last_modified_by":"admin","last_run":"","version":"","description":"","priority":11,"number_of_retries":0,"time_between_retries":10,"max_number_of_retries":100,"credential_type":"any","disable_result_creation":false,"restrict_to_owners":[],"vendor":"","operating_system":"","dry_run":false,"waiting_time":0,"device_query":"","device_query_property":"name","update_target_pools":false,"update_pools_after_running":false,"report":"","report_format":"text","report_jinja2_template":false,"disabled":false,"disabled_info":"","display_report":false,"email_report":false,"send_notification":false,"send_notification_method":"mail","notification_header":"","display_only_failed_nodes":false,"include_device_results":false,"include_link_in_summary":false,"mail_recipient":"","mail_subject":"","mail_sender":"","mail_bcc":"","reply_to":"","initial_payload":{},"mandatory_parametrization":false,"parameterized_form":"name = StringField('Name', [InputRequired()])\ninitial_payload = DictField()\ntarget_devices = MultipleInstanceField('Devices', model='device')\ntarget_pools = MultipleInstanceField('Pools', model='pool')\ndevice_query = StringField('Device Query', python=True, widget=TextArea(), render_kw={'rows': 2})\ndevice_query_property = SelectField('Query Property Type', choices=(('name', 'Name'), ('ip_address', 'IP address')))\nmultiprocessing = BooleanField('Multiprocessing', default=False)\nmax_processes = IntegerField('Maximum number of processes', default=15)","parameterized_form_template":"","skip":{},"skip_query":"","skip_value":"success","iteration_values":"","iteration_variable_name":"iteration_value","iteration_devices":"","iteration_devices_property":"name","preprocessing":"","postprocessing":"","postprocessing_mode":"success","builder_link":"pL2BfKr13UY","log_level":1,"show_user_logs":true,"maximum_runs":1,"multiprocessing":false,"max_processes":15,"validation_condition":"success","conversion_method":"none","validation_method":"text","validation_section":"results['result']","content_match":"netmiko_file","content_match_regex":false,"dict_match":{},"negative_logic":true,"delete_spaces_before_matching":false,"run_method":"per_device","serialized":"dict_values(['', True, 0.0, 'name', True, 'admin.*$', False, '', False, '', False, None, 1, '', '2023-05-23 17:10:39.542604', True, None, '', {}, False, \"name = StringField('Name', [InputRequired()])\\ninitial_payload = DictField()\\ntarget_devices = MultipleInstanceField('Devices', model='device')\\ntarget_pools = MultipleInstanceField('Pools', model='pool')\\ndevice_query = StringField('Device Query', python=True, widget=TextArea(), render_kw={'rows': 2})\\ndevice_query_property = SelectField('Query Property Type', choices=(('name', 'Name'), ('ip_address', 'IP address')))\\nmultiprocessing = BooleanField('Multiprocessing', default=False)\\nmax_processes = IntegerField('Maximum number of processes', default=15)\", 'text', 'default', True, 'password', '', False, False, '', 'iteration_value', False, 'exit', '', 'none', '', True, '[(R) Netmiko File Transfer Service] Check no file in enms_files directory', 'username:', False, {}, 'Check no file in enms_files directory', False, {}, 1, 'netmiko_commands_service', None, 0, 'dir enms_files', '', [], '', 'success', '', True, 10.0, False, False, None, 'any', 'text', False, False, 'success', False, '', False, 'mail', 10.0, 100, '', '', '1X9tScYqa_M', 'name', 'admin', 'success', '', 'netmiko_file', False, False, 'per_device', 'Default Value', 10, False, False, 1, '', 15.0, '', '', 'pL2BfKr13UY', \"results['result']\", False, True, 11, '', 0, 'a3c540d0-9816-49bb-a2d9-75978ba89fb3', '', 'Definition', False, False, False, 0.1, False, False, '', '', False, None, False, 'admin', '', 'ssh jump_server_IP', 'device', '', 'device', 15])","definition":"Definition","reserved":false,"impacting":false,"completion_time":1,"default_uuid":"a3c540d0-9816-49bb-a2d9-75978ba89fb3","mandatory_parameter":"Default Value","admin_only":false,"credentials":"device","custom_username":"","custom_password":"","start_new_connection":false,"connection_name":"default","close_connection":true,"enable_mode":true,"config_mode":false,"commands":"dir enms_files","jinja2_template":false,"results_as_list":false,"driver":"device","use_textfsm":false,"use_genie":false,"read_timeout":10.0,"conn_timeout":10.0,"auth_timeout":0.0,"banner_timeout":15.0,"global_delay_factor":0.1,"expect_string":"","config_mode_command":"","auto_find_prompt":true,"strip_prompt":true,"strip_command":true,"jump_on_connect":false,"jump_command":"ssh jump_server_IP","jump_username":"","jump_password":"","exit_command":"exit","expect_username_prompt":"username:","expect_password_prompt":"password","expect_prompt":"admin.*$"},{"persistent_id":"X5LWWlSTTJI","name":"[(R) Netmiko File Transfer Service] Check file in directory","creator":"admin","soft_deleted":false,"shared":false,"scoped_name":"Check file in directory","creation_time":"","last_modified":"2022-11-09 01:23:32.925253","last_modified_by":"admin","last_run":"","version":"","description":"","priority":11,"number_of_retries":0,"time_between_retries":10,"max_number_of_retries":100,"credential_type":"any","disable_result_creation":false,"restrict_to_owners":[],"vendor":"","operating_system":"","dry_run":false,"waiting_time":0,"device_query":"","device_query_property":"name","update_target_pools":false,"update_pools_after_running":false,"report":"","report_format":"text","report_jinja2_template":false,"disabled":false,"disabled_info":"","display_report":false,"email_report":false,"send_notification":false,"send_notification_method":"mail","notification_header":"","display_only_failed_nodes":false,"include_device_results":false,"include_link_in_summary":false,"mail_recipient":"","mail_subject":"","mail_sender":"","mail_bcc":"","reply_to":"","initial_payload":{},"mandatory_parametrization":false,"parameterized_form":"name = StringField('Name', [InputRequired()])\ninitial_payload = DictField()\ntarget_devices = MultipleInstanceField('Devices', model='device')\ntarget_pools = MultipleInstanceField('Pools', model='pool')\ndevice_query = StringField('Device Query', python=True, widget=TextArea(), render_kw={'rows': 2})\ndevice_query_property = SelectField('Query Property Type', choices=(('name', 'Name'), ('ip_address', 'IP address')))\nmultiprocessing = BooleanField('Multiprocessing', default=False)\nmax_processes = IntegerField('Maximum number of processes', default=15)","parameterized_form_template":"","skip":{},"skip_query":"","skip_value":"success","iteration_values":"","iteration_variable_name":"iteration_value","iteration_devices":"","iteration_devices_property":"name","preprocessing":"","postprocessing":"","postprocessing_mode":"success","builder_link":"pL2BfKr13UY","log_level":1,"show_user_logs":true,"maximum_runs":1,"multiprocessing":false,"max_processes":15,"validation_condition":"success","conversion_method":"none","validation_method":"text","validation_section":"results['result']","content_match":"netmiko_file","content_match_regex":false,"dict_match":{},"negative_logic":false,"delete_spaces_before_matching":false,"run_method":"per_device","serialized":"dict_values(['', True, 0.0, 'name', True, 'admin.*$', False, '', False, '', False, None, 1, '', '2022-11-09 01:23:32.925253', False, None, '', {}, False, \"name = StringField('Name', [InputRequired()])\\ninitial_payload = DictField()\\ntarget_devices = MultipleInstanceField('Devices', model='device')\\ntarget_pools = MultipleInstanceField('Pools', model='pool')\\ndevice_query = StringField('Device Query', python=True, widget=TextArea(), render_kw={'rows': 2})\\ndevice_query_property = SelectField('Query Property Type', choices=(('name', 'Name'), ('ip_address', 'IP address')))\\nmultiprocessing = BooleanField('Multiprocessing', default=False)\\nmax_processes = IntegerField('Maximum number of processes', default=15)\", 'text', 'default', True, 'password', '', False, False, '', 'iteration_value', False, 'exit', '', 'none', '', True, '[(R) Netmiko File Transfer Service] Check file in directory', 'username:', False, {}, 'Check file in directory', False, {}, 1, 'netmiko_commands_service', None, 0, 'dir enms_files', '', [], '', 'success', '', True, 10.0, False, False, None, 'any', 'text', False, False, 'success', False, '', False, 'mail', 10.0, 100, '', '', 'X5LWWlSTTJI', 'name', 'admin', 'success', '', 'netmiko_file', False, False, 'per_device', 'Default Value', 10, False, False, 1, '', 15.0, '', '', 'pL2BfKr13UY', \"results['result']\", False, False, 11, '', 0, '72f3b7dd-fe02-4157-bd7f-e28577578dc5', '', 'Definition', False, False, False, 0.1, False, False, '', '', False, None, False, 'admin', '', 'ssh jump_server_IP', 'device', '', 'device', 15])","definition":"Definition","reserved":false,"impacting":false,"completion_time":1,"default_uuid":"72f3b7dd-fe02-4157-bd7f-e28577578dc5","mandatory_parameter":"Default Value","admin_only":false,"credentials":"device","custom_username":"","custom_password":"","start_new_connection":false,"connection_name":"default","close_connection":false,"enable_mode":true,"config_mode":false,"commands":"dir enms_files","jinja2_template":false,"results_as_list":false,"driver":"device","use_textfsm":false,"use_genie":false,"read_timeout":10.0,"conn_timeout":10.0,"auth_timeout":0.0,"banner_timeout":15.0,"global_delay_factor":0.1,"expect_string":"","config_mode_command":"","auto_find_prompt":true,"strip_prompt":true,"strip_command":true,"jump_on_connect":false,"jump_command":"ssh jump_server_IP","jump_username":"","jump_password":"","exit_command":"exit","expect_username_prompt":"username:","expect_password_prompt":"password","expect_prompt":"admin.*$"},{"persistent_id":"i4p_q93Nub8","name":"[(R) Netmiko File Transfer Service] Delete netmiko_file","creator":"admin","soft_deleted":false,"shared":false,"scoped_name":"Delete netmiko_file","creation_time":"","last_modified":"2022-11-09 01:23:32.927628","last_modified_by":"admin","last_run":"","version":"","description":"","priority":11,"number_of_retries":0,"time_between_retries":10,"max_number_of_retries":100,"credential_type":"any","disable_result_creation":false,"restrict_to_owners":[],"vendor":"","operating_system":"","dry_run":false,"waiting_time":0,"device_query":"","device_query_property":"name","update_target_pools":false,"update_pools_after_running":false,"report":"","report_format":"text","report_jinja2_template":false,"disabled":false,"disabled_info":"","display_report":false,"email_report":false,"send_notification":false,"send_notification_method":"mail","notification_header":"","display_only_failed_nodes":false,"include_device_results":false,"include_link_in_summary":false,"mail_recipient":"","mail_subject":"","mail_sender":"","mail_bcc":"","reply_to":"","initial_payload":{},"mandatory_parametrization":false,"parameterized_form":"name = StringField('Name', [InputRequired()])\ninitial_payload = DictField()\ntarget_devices = MultipleInstanceField('Devices', model='device')\ntarget_pools = MultipleInstanceField('Pools', model='pool')\ndevice_query = StringField('Device Query', python=True, widget=TextArea(), render_kw={'rows': 2})\ndevice_query_property = SelectField('Query Property Type', choices=(('name', 'Name'), ('ip_address', 'IP address')))\nmultiprocessing = BooleanField('Multiprocessing', default=False)\nmax_processes = IntegerField('Maximum number of processes', default=15)","parameterized_form_template":"","skip":{},"skip_query":"","skip_value":"success","iteration_values":"","iteration_variable_name":"iteration_value","iteration_devices":"","iteration_devices_property":"name","preprocessing":"","postprocessing":"","postprocessing_mode":"success","builder_link":"pL2BfKr13UY","log_level":1,"show_user_logs":true,"maximum_runs":1,"multiprocessing":false,"max_processes":15,"validation_condition":"none","conversion_method":"none","validation_method":"text","validation_section":"results['result']","content_match":"","content_match_regex":false,"dict_match":{},"negative_logic":false,"delete_spaces_before_matching":false,"run_method":"per_device","serialized":"dict_values(['', True, 0.0, 'name', True, 'admin.*$', False, '', False, '', False, None, 1, '', '2022-11-09 01:23:32.927628', False, None, '', {}, False, \"name = StringField('Name', [InputRequired()])\\ninitial_payload = DictField()\\ntarget_devices = MultipleInstanceField('Devices', model='device')\\ntarget_pools = MultipleInstanceField('Pools', model='pool')\\ndevice_query = StringField('Device Query', python=True, widget=TextArea(), render_kw={'rows': 2})\\ndevice_query_property = SelectField('Query Property Type', choices=(('name', 'Name'), ('ip_address', 'IP address')))\\nmultiprocessing = BooleanField('Multiprocessing', default=False)\\nmax_processes = IntegerField('Maximum number of processes', default=15)\", 'text', 'default', True, 'password', '', False, False, '', 'iteration_value', False, 'exit', '', 'none', '', True, '[(R) Netmiko File Transfer Service] Delete netmiko_file', 'username:', False, {}, 'Delete netmiko_file', False, {}, 1, 'netmiko_commands_service', None, 0, 'delete enms_files/netmiko_file', '', [], '', 'success', '', True, 10.0, False, False, None, 'any', 'text', False, False, 'none', False, '', False, 'mail', 10.0, 100, '', '', 'i4p_q93Nub8', 'name', 'admin', 'success', '', '', False, False, 'per_device', 'Default Value', 10, False, False, 1, '', 15.0, '', '', 'pL2BfKr13UY', \"results['result']\", False, False, 11, '', 0, 'f3c9afdc-408c-4d56-bf8a-d394eee58c02', '', 'Definition', False, False, False, 0.1, False, False, '', '', False, None, False, 'admin', '', 'ssh jump_server_IP', 'device', '', 'device', 15])","definition":"Definition","reserved":false,"impacting":false,"completion_time":1,"default_uuid":"f3c9afdc-408c-4d56-bf8a-d394eee58c02","mandatory_parameter":"Default Value","admin_only":false,"credentials":"device","custom_username":"","custom_password":"","start_new_connection":false,"connection_name":"default","close_connection":false,"enable_mode":true,"config_mode":false,"commands":"delete enms_files/netmiko_file","jinja2_template":false,"results_as_list":false,"driver":"device","use_textfsm":false,"use_genie":false,"read_timeout":10.0,"conn_timeout":10.0,"auth_timeout":0.0,"banner_timeout":15.0,"global_delay_factor":0.1,"expect_string":"","config_mode_command":"","auto_find_prompt":true,"strip_prompt":true,"strip_command":true,"jump_on_connect":false,"jump_command":"ssh jump_server_IP","jump_username":"","jump_password":"","exit_command":"exit","expect_username_prompt":"username:","expect_password_prompt":"password","expect_prompt":"admin.*$"},{"persistent_id":"P4z4Ba-CPT8","name":"[(R) Netmiko File Transfer Service] Check netmiko_file is deleted","creator":"admin","soft_deleted":false,"shared":false,"scoped_name":"Check netmiko_file is deleted","creation_time":"","last_modified":"2022-11-09 01:23:32.929961","last_modified_by":"admin","last_run":"","version":"","description":"","priority":11,"number_of_retries":0,"time_between_retries":10,"max_number_of_retries":100,"credential_type":"any","disable_result_creation":false,"restrict_to_owners":[],"vendor":"","operating_system":"","dry_run":false,"waiting_time":0,"device_query":"","device_query_property":"name","update_target_pools":false,"update_pools_after_running":false,"report":"","report_format":"text","report_jinja2_template":false,"disabled":false,"disabled_info":"","display_report":false,"email_report":false,"send_notification":false,"send_notification_method":"mail","notification_header":"","display_only_failed_nodes":false,"include_device_results":false,"include_link_in_summary":false,"mail_recipient":"","mail_subject":"","mail_sender":"","mail_bcc":"","reply_to":"","initial_payload":{},"mandatory_parametrization":false,"parameterized_form":"name = StringField('Name', [InputRequired()])\ninitial_payload = DictField()\ntarget_devices = MultipleInstanceField('Devices', model='device')\ntarget_pools = MultipleInstanceField('Pools', model='pool')\ndevice_query = StringField('Device Query', python=True, widget=TextArea(), render_kw={'rows': 2})\ndevice_query_property = SelectField('Query Property Type', choices=(('name', 'Name'), ('ip_address', 'IP address')))\nmultiprocessing = BooleanField('Multiprocessing', default=False)\nmax_processes = IntegerField('Maximum number of processes', default=15)","parameterized_form_template":"","skip":{},"skip_query":"","skip_value":"success","iteration_values":"","iteration_variable_name":"iteration_value","iteration_devices":"","iteration_devices_property":"name","preprocessing":"","postprocessing":"","postprocessing_mode":"success","builder_link":"pL2BfKr13UY","log_level":1,"show_user_logs":true,"maximum_runs":1,"multiprocessing":false,"max_processes":15,"validation_condition":"success","conversion_method":"none","validation_method":"text","validation_section":"results['result']","content_match":"netmiko_file","content_match_regex":false,"dict_match":{},"negative_logic":true,"delete_spaces_before_matching":false,"run_method":"per_device","serialized":"dict_values(['', True, 0.0, 'name', True, 'admin.*$', False, '', False, '', False, None, 1, '', '2022-11-09 01:23:32.929961', False, None, '', {}, False, \"name = StringField('Name', [InputRequired()])\\ninitial_payload = DictField()\\ntarget_devices = MultipleInstanceField('Devices', model='device')\\ntarget_pools = MultipleInstanceField('Pools', model='pool')\\ndevice_query = StringField('Device Query', python=True, widget=TextArea(), render_kw={'rows': 2})\\ndevice_query_property = SelectField('Query Property Type', choices=(('name', 'Name'), ('ip_address', 'IP address')))\\nmultiprocessing = BooleanField('Multiprocessing', default=False)\\nmax_processes = IntegerField('Maximum number of processes', default=15)\", 'text', 'default', True, 'password', '', False, False, '', 'iteration_value', False, 'exit', '', 'none', '', True, '[(R) Netmiko File Transfer Service] Check netmiko_file is deleted', 'username:', False, {}, 'Check netmiko_file is deleted', False, {}, 1, 'netmiko_commands_service', None, 0, 'dir enms_files', '', [], '', 'success', '', True, 10.0, False, False, None, 'any', 'text', False, False, 'success', False, '', False, 'mail', 10.0, 100, '', '', 'P4z4Ba-CPT8', 'name', 'admin', 'success', '', 'netmiko_file', False, False, 'per_device', 'Default Value', 10, False, False, 1, '', 15.0, '', '', 'pL2BfKr13UY', \"results['result']\", False, True, 11, '', 0, '18c4131f-f1b7-44f3-8a4a-c1d5d1526dfb', '', 'Definition', False, False, False, 0.1, False, False, '', '', False, None, False, 'admin', '', 'ssh jump_server_IP', 'device', '', 'device', 15])","definition":"Definition","reserved":false,"impacting":false,"completion_time":1,"default_uuid":"18c4131f-f1b7-44f3-8a4a-c1d5d1526dfb","mandatory_parameter":"Default Value","admin_only":false,"credentials":"device","custom_username":"","custom_password":"","start_new_connection":false,"connection_name":"default","close_connection":false,"enable_mode":true,"config_mode":false,"commands":"dir enms_files","jinja2_template":false,"results_as_list":false,"driver":"device","use_textfsm":false,"use_genie":false,"read_timeout":10.0,"conn_timeout":10.0,"auth_timeout":0.0,"banner_timeout":15.0,"global_delay_factor":0.1,"expect_string":"","config_mode_command":"","auto_find_prompt":true,"strip_prompt":true,"strip_command":true,"jump_on_connect":false,"jump_command":"ssh jump_server_IP","jump_username":"","jump_password":"","exit_command":"exit","expect_username_prompt":"username:","expect_password_prompt":"password","expect_prompt":"admin.*$"},{"persistent_id":"_SGXwIajdVU","name":"[(R) Function: get_credential] Show interface via get_credential","creator":"admin","soft_deleted":false,"shared":false,"scoped_name":"Show interface via get_credential","creation_time":"","last_modified":"2022-11-09 01:23:32.943544","last_modified_by":"admin","last_run":"","version":"","description":"","priority":11,"number_of_retries":0,"time_between_retries":10,"max_number_of_retries":100,"credential_type":"any","disable_result_creation":false,"restrict_to_owners":[],"vendor":"","operating_system":"","dry_run":false,"waiting_time":0,"device_query":"","device_query_property":"name","update_target_pools":false,"update_pools_after_running":false,"report":"","report_format":"text","report_jinja2_template":false,"disabled":false,"disabled_info":"","display_report":false,"email_report":false,"send_notification":false,"send_notification_method":"mail","notification_header":"","display_only_failed_nodes":false,"include_device_results":false,"include_link_in_summary":false,"mail_recipient":"","mail_subject":"","mail_sender":"","mail_bcc":"","reply_to":"","initial_payload":{},"mandatory_parametrization":false,"parameterized_form":"name = StringField('Name', [InputRequired()])\ninitial_payload = DictField()\ntarget_devices = MultipleInstanceField('Devices', model='device')\ntarget_pools = MultipleInstanceField('Pools', model='pool')\ndevice_query = StringField('Device Query', python=True, widget=TextArea(), render_kw={'rows': 2})\ndevice_query_property = SelectField('Query Property Type', choices=(('name', 'Name'), ('ip_address', 'IP address')))\nmultiprocessing = BooleanField('Multiprocessing', default=False)\nmax_processes = IntegerField('Maximum number of processes', default=15)","parameterized_form_template":"","skip":{},"skip_query":"","skip_value":"success","iteration_values":"","iteration_variable_name":"iteration_value","iteration_devices":"","iteration_devices_property":"name","preprocessing":"","postprocessing":"","postprocessing_mode":"success","builder_link":"rENgPmOC3eo","log_level":1,"show_user_logs":true,"maximum_runs":1,"multiprocessing":false,"max_processes":15,"validation_condition":"none","conversion_method":"none","validation_method":"text","validation_section":"results['result']","content_match":"","content_match_regex":false,"dict_match":{},"negative_logic":false,"delete_spaces_before_matching":false,"run_method":"per_device","serialized":"dict_values(['', True, 0.0, 'name', True, 'admin.*$', False, '', False, '', False, None, 1, '', '2022-11-09 01:23:32.943544', False, None, '', {}, False, \"name = StringField('Name', [InputRequired()])\\ninitial_payload = DictField()\\ntarget_devices = MultipleInstanceField('Devices', model='device')\\ntarget_pools = MultipleInstanceField('Pools', model='pool')\\ndevice_query = StringField('Device Query', python=True, widget=TextArea(), render_kw={'rows': 2})\\ndevice_query_property = SelectField('Query Property Type', choices=(('name', 'Name'), ('ip_address', 'IP address')))\\nmultiprocessing = BooleanField('Multiprocessing', default=False)\\nmax_processes = IntegerField('Maximum number of processes', default=15)\", 'text', 'default', True, 'password', '', False, False, '', 'iteration_value', False, 'exit', '', 'none', '', True, '[(R) Function: get_credential] Show interface via get_credential', 'username:', False, {}, 'Show interface via get_credential', False, {}, 1, 'netmiko_commands_service', None, 0, 'show {{get_credential(name=\"Non Device Credential\")[\"password\"]}}', '', [], '', 'success', '', True, 10.0, False, False, None, 'any', 'text', False, False, 'none', False, '', False, 'mail', 10.0, 100, '', '', '_SGXwIajdVU', 'name', 'admin', 'success', '', '', False, False, 'per_device', 'Default Value', 10, False, False, 1, '', 15.0, '', '', 'rENgPmOC3eo', \"results['result']\", False, False, 11, '', 0, 'f8081a06-d639-43fb-b12e-b5c73e36fc37', '', 'Definition', False, False, False, 0.1, False, False, '', '', False, None, False, 'admin', '', 'ssh jump_server_IP', 'device', '', 'device', 15])","definition":"Definition","reserved":false,"impacting":false,"completion_time":1,"default_uuid":"f8081a06-d639-43fb-b12e-b5c73e36fc37","mandatory_parameter":"Default Value","admin_only":false,"credentials":"device","custom_username":"","custom_password":"","start_new_connection":false,"connection_name":"default","close_connection":false,"enable_mode":true,"config_mode":false,"commands":"show {{get_credential(name=\"Non Device Credential\")[\"password\"]}}","jinja2_template":false,"results_as_list":false,"driver":"device","use_textfsm":false,"use_genie":false,"read_timeout":10.0,"conn_timeout":10.0,"auth_timeout":0.0,"banner_timeout":15.0,"global_delay_factor":0.1,"expect_string":"","config_mode_command":"","auto_find_prompt":true,"strip_prompt":true,"strip_command":true,"jump_on_connect":false,"jump_command":"ssh jump_server_IP","jump_username":"","jump_password":"","exit_command":"exit","expect_username_prompt":"username:","expect_password_prompt":"password","expect_prompt":"admin.*$"},{"persistent_id":"QW62kGzYiCY","name":"[(R) Labels and Custom Property] Show inteface as global variable","creator":"admin","soft_deleted":false,"shared":false,"scoped_name":"Show inteface as global variable","creation_time":"","last_modified":"2022-11-09 01:23:33.012933","last_modified_by":"admin","last_run":"","version":"","description":"","priority":11,"number_of_retries":0,"time_between_retries":10,"max_number_of_retries":100,"credential_type":"any","disable_result_creation":false,"restrict_to_owners":[],"vendor":"","operating_system":"","dry_run":false,"waiting_time":0,"device_query":"","device_query_property":"name","update_target_pools":false,"update_pools_after_running":false,"report":"","report_format":"text","report_jinja2_template":false,"disabled":false,"disabled_info":"","display_report":false,"email_report":false,"send_notification":false,"send_notification_method":"mail","notification_header":"","display_only_failed_nodes":false,"include_device_results":false,"include_link_in_summary":false,"mail_recipient":"","mail_subject":"","mail_sender":"","mail_bcc":"","reply_to":"","initial_payload":{},"mandatory_parametrization":false,"parameterized_form":"name = StringField('Name', [InputRequired()])\ninitial_payload = DictField()\ntarget_devices = MultipleInstanceField('Devices', model='device')\ntarget_pools = MultipleInstanceField('Pools', model='pool')\ndevice_query = StringField('Device Query', python=True, widget=TextArea(), render_kw={'rows': 2})\ndevice_query_property = SelectField('Query Property Type', choices=(('name', 'Name'), ('ip_address', 'IP address')))\nmultiprocessing = BooleanField('Multiprocessing', default=False)\nmax_processes = IntegerField('Maximum number of processes', default=15)","parameterized_form_template":"","skip":{},"skip_query":"","skip_value":"success","iteration_values":"","iteration_variable_name":"iteration_value","iteration_devices":"","iteration_devices_property":"name","preprocessing":"","postprocessing":"","postprocessing_mode":"always","builder_link":"1dmkk3ifSIk","log_level":1,"show_user_logs":true,"maximum_runs":1,"multiprocessing":false,"max_processes":15,"validation_condition":"none","conversion_method":"none","validation_method":"text","validation_section":"results['result']","content_match":"","content_match_regex":false,"dict_match":{},"negative_logic":false,"delete_spaces_before_matching":false,"run_method":"per_device","serialized":"dict_values(['', True, 0.0, 'name', True, 'admin.*$', False, '', False, '', False, None, 1, '', '2022-11-09 01:23:33.012933', False, None, '', {}, False, \"name = StringField('Name', [InputRequired()])\\ninitial_payload = DictField()\\ntarget_devices = MultipleInstanceField('Devices', model='device')\\ntarget_pools = MultipleInstanceField('Pools', model='pool')\\ndevice_query = StringField('Device Query', python=True, widget=TextArea(), render_kw={'rows': 2})\\ndevice_query_property = SelectField('Query Property Type', choices=(('name', 'Name'), ('ip_address', 'IP address')))\\nmultiprocessing = BooleanField('Multiprocessing', default=False)\\nmax_processes = IntegerField('Maximum number of processes', default=15)\", 'text', 'default', True, 'password', '', False, False, '', 'iteration_value', False, 'exit', '', 'none', '', True, '[(R) Labels and Custom Property] Show inteface as global variable', 'username:', False, {}, 'Show inteface as global variable', False, {}, 1, 'netmiko_commands_service', None, 0, 'show interface {{interface}}', '', [], '', 'always', '', True, 10.0, False, False, None, 'any', 'text', False, False, 'none', False, '', False, 'mail', 10.0, 100, '', '', 'QW62kGzYiCY', 'name', 'admin', 'success', '', '', False, False, 'per_device', 'Default Value', 10, False, False, 1, '', 15.0, '', '', '1dmkk3ifSIk', \"results['result']\", False, False, 11, '', 0, '0f65ced9-2cfa-468f-8298-13098dcdab0a', '', 'Definition', False, False, False, 0.1, False, False, '', '', False, None, False, 'admin', '', 'ssh jump_server_IP', 'device', '', 'device', 15])","definition":"Definition","reserved":false,"impacting":false,"completion_time":1,"default_uuid":"0f65ced9-2cfa-468f-8298-13098dcdab0a","mandatory_parameter":"Default Value","admin_only":false,"credentials":"device","custom_username":"","custom_password":"","start_new_connection":false,"connection_name":"default","close_connection":false,"enable_mode":true,"config_mode":false,"commands":"show interface {{interface}}","jinja2_template":false,"results_as_list":false,"driver":"device","use_textfsm":false,"use_genie":false,"read_timeout":10.0,"conn_timeout":10.0,"auth_timeout":0.0,"banner_timeout":15.0,"global_delay_factor":0.1,"expect_string":"","config_mode_command":"","auto_find_prompt":true,"strip_prompt":true,"strip_command":true,"jump_on_connect":false,"jump_command":"ssh jump_server_IP","jump_username":"","jump_password":"","exit_command":"exit","expect_username_prompt":"username:","expect_password_prompt":"password","expect_prompt":"admin.*$"},{"persistent_id":"fSVDRmGWvbc","name":"[(R) Netmiko Validation with TextFSM Option] show ip int brief","creator":"admin","soft_deleted":false,"shared":false,"scoped_name":"show ip int brief","creation_time":"","last_modified":"2022-11-09 01:23:33.027030","last_modified_by":"admin","last_run":"","version":"","description":"","priority":11,"number_of_retries":0,"time_between_retries":10,"max_number_of_retries":100,"credential_type":"any","disable_result_creation":false,"restrict_to_owners":[],"vendor":"","operating_system":"","dry_run":false,"waiting_time":0,"device_query":"","device_query_property":"name","update_target_pools":false,"update_pools_after_running":false,"report":"","report_format":"text","report_jinja2_template":false,"disabled":false,"disabled_info":"","display_report":false,"email_report":false,"send_notification":false,"send_notification_method":"mail","notification_header":"","display_only_failed_nodes":false,"include_device_results":false,"include_link_in_summary":false,"mail_recipient":"","mail_subject":"","mail_sender":"","mail_bcc":"","reply_to":"","initial_payload":{},"mandatory_parametrization":false,"parameterized_form":"name = StringField('Name', [InputRequired()])\ninitial_payload = DictField()\ntarget_devices = MultipleInstanceField('Devices', model='device')\ntarget_pools = MultipleInstanceField('Pools', model='pool')\ndevice_query = StringField('Device Query', python=True, widget=TextArea(), render_kw={'rows': 2})\ndevice_query_property = SelectField('Query Property Type', choices=(('name', 'Name'), ('ip_address', 'IP address')))\nmultiprocessing = BooleanField('Multiprocessing', default=False)\nmax_processes = IntegerField('Maximum number of processes', default=15)","parameterized_form_template":"","skip":{},"skip_query":"","skip_value":"success","iteration_values":"","iteration_variable_name":"iteration_value","iteration_devices":"","iteration_devices_property":"name","preprocessing":"","postprocessing":"","postprocessing_mode":"success","builder_link":"vX253Z8r7sg","log_level":1,"show_user_logs":true,"maximum_runs":1,"multiprocessing":false,"max_processes":15,"validation_condition":"none","conversion_method":"none","validation_method":"text","validation_section":"results['result']","content_match":"","content_match_regex":false,"dict_match":{},"negative_logic":false,"delete_spaces_before_matching":false,"run_method":"per_device","serialized":"dict_values(['', True, 0.0, 'name', True, 'admin.*$', False, '', False, '', False, None, 1, '', '2022-11-09 01:23:33.027030', False, None, '', {}, False, \"name = StringField('Name', [InputRequired()])\\ninitial_payload = DictField()\\ntarget_devices = MultipleInstanceField('Devices', model='device')\\ntarget_pools = MultipleInstanceField('Pools', model='pool')\\ndevice_query = StringField('Device Query', python=True, widget=TextArea(), render_kw={'rows': 2})\\ndevice_query_property = SelectField('Query Property Type', choices=(('name', 'Name'), ('ip_address', 'IP address')))\\nmultiprocessing = BooleanField('Multiprocessing', default=False)\\nmax_processes = IntegerField('Maximum number of processes', default=15)\", 'text', 'default', True, 'password', '', False, False, '', 'iteration_value', False, 'exit', '', 'none', '', True, '[(R) Netmiko Validation with TextFSM Option] show ip int brief', 'username:', False, {}, 'show ip int brief', False, {}, 1, 'netmiko_commands_service', None, 0, 'show ip int brief', '', [], '', 'success', '', True, 10.0, False, False, None, 'any', 'text', False, False, 'none', True, '', False, 'mail', 10.0, 100, '', '', 'fSVDRmGWvbc', 'name', 'admin', 'success', '', '', False, False, 'per_device', 'Default Value', 10, False, False, 1, '', 15.0, '', '', 'vX253Z8r7sg', \"results['result']\", False, False, 11, '', 0, '86475764-3320-4806-bc29-93dc164b86ee', '', 'Definition', False, False, False, 0.1, False, False, '', '', False, None, True, 'admin', '', 'ssh jump_server_IP', 'device', '', 'device', 15])","definition":"Definition","reserved":false,"impacting":true,"completion_time":1,"default_uuid":"86475764-3320-4806-bc29-93dc164b86ee","mandatory_parameter":"Default Value","admin_only":false,"credentials":"device","custom_username":"","custom_password":"","start_new_connection":false,"connection_name":"default","close_connection":false,"enable_mode":true,"config_mode":false,"commands":"show ip int brief","jinja2_template":false,"results_as_list":false,"driver":"device","use_textfsm":true,"use_genie":false,"read_timeout":10.0,"conn_timeout":10.0,"auth_timeout":0.0,"banner_timeout":15.0,"global_delay_factor":0.1,"expect_string":"","config_mode_command":"","auto_find_prompt":true,"strip_prompt":true,"strip_command":true,"jump_on_connect":false,"jump_command":"ssh jump_server_IP","jump_username":"","jump_password":"","exit_command":"exit","expect_username_prompt":"username:","expect_password_prompt":"password","expect_prompt":"admin.*$"},{"persistent_id":"rTMGiQmAsrQ","name":"[(R) Netmiko Validation with TextFSM Option] show version","creator":"admin","soft_deleted":false,"shared":false,"scoped_name":"show version","creation_time":"","last_modified":"2022-11-09 01:23:33.029979","last_modified_by":"admin","last_run":"","version":"","description":"","priority":11,"number_of_retries":0,"time_between_retries":10,"max_number_of_retries":100,"credential_type":"any","disable_result_creation":false,"restrict_to_owners":[],"vendor":"","operating_system":"","dry_run":false,"waiting_time":0,"device_query":"","device_query_property":"name","update_target_pools":false,"update_pools_after_running":false,"report":"","report_format":"text","report_jinja2_template":false,"disabled":false,"disabled_info":"","display_report":false,"email_report":false,"send_notification":false,"send_notification_method":"mail","notification_header":"","display_only_failed_nodes":false,"include_device_results":false,"include_link_in_summary":false,"mail_recipient":"","mail_subject":"","mail_sender":"","mail_bcc":"","reply_to":"","initial_payload":{},"mandatory_parametrization":false,"parameterized_form":"name = StringField('Name', [InputRequired()])\ninitial_payload = DictField()\ntarget_devices = MultipleInstanceField('Devices', model='device')\ntarget_pools = MultipleInstanceField('Pools', model='pool')\ndevice_query = StringField('Device Query', python=True, widget=TextArea(), render_kw={'rows': 2})\ndevice_query_property = SelectField('Query Property Type', choices=(('name', 'Name'), ('ip_address', 'IP address')))\nmultiprocessing = BooleanField('Multiprocessing', default=False)\nmax_processes = IntegerField('Maximum number of processes', default=15)","parameterized_form_template":"","skip":{},"skip_query":"","skip_value":"success","iteration_values":"","iteration_variable_name":"iteration_value","iteration_devices":"","iteration_devices_property":"name","preprocessing":"","postprocessing":"","postprocessing_mode":"success","builder_link":"vX253Z8r7sg","log_level":1,"show_user_logs":true,"maximum_runs":1,"multiprocessing":false,"max_processes":15,"validation_condition":"none","conversion_method":"none","validation_method":"text","validation_section":"results['result']","content_match":"","content_match_regex":false,"dict_match":{},"negative_logic":false,"delete_spaces_before_matching":false,"run_method":"per_device","serialized":"dict_values(['', True, 0.0, 'name', True, 'admin.*$', False, '', False, '', False, None, 1, '', '2022-11-09 01:23:33.029979', False, None, '', {}, False, \"name = StringField('Name', [InputRequired()])\\ninitial_payload = DictField()\\ntarget_devices = MultipleInstanceField('Devices', model='device')\\ntarget_pools = MultipleInstanceField('Pools', model='pool')\\ndevice_query = StringField('Device Query', python=True, widget=TextArea(), render_kw={'rows': 2})\\ndevice_query_property = SelectField('Query Property Type', choices=(('name', 'Name'), ('ip_address', 'IP address')))\\nmultiprocessing = BooleanField('Multiprocessing', default=False)\\nmax_processes = IntegerField('Maximum number of processes', default=15)\", 'text', 'default', True, 'password', '', False, False, '', 'iteration_value', False, 'exit', '', 'none', '', True, '[(R) Netmiko Validation with TextFSM Option] show version', 'username:', False, {}, 'show version', False, {}, 1, 'netmiko_commands_service', None, 0, 'show version', '', [], '', 'success', '', True, 10.0, False, False, None, 'any', 'text', False, False, 'none', True, '', False, 'mail', 10.0, 100, '', '', 'rTMGiQmAsrQ', 'name', 'admin', 'success', '', '', False, False, 'per_device', 'Default Value', 10, False, False, 1, '', 15.0, '', '', 'vX253Z8r7sg', \"results['result']\", False, False, 11, '', 0, 'fc8c63e8-c3f7-47dc-b150-18b6b9971bb5', '', 'Definition', False, False, False, 0.1, False, False, '', '', False, None, True, 'admin', '', 'ssh jump_server_IP', 'device', '', 'device', 15])","definition":"Definition","reserved":false,"impacting":true,"completion_time":1,"default_uuid":"fc8c63e8-c3f7-47dc-b150-18b6b9971bb5","mandatory_parameter":"Default Value","admin_only":false,"credentials":"device","custom_username":"","custom_password":"","start_new_connection":false,"connection_name":"default","close_connection":false,"enable_mode":true,"config_mode":false,"commands":"show version","jinja2_template":false,"results_as_list":false,"driver":"device","use_textfsm":true,"use_genie":false,"read_timeout":10.0,"conn_timeout":10.0,"auth_timeout":0.0,"banner_timeout":15.0,"global_delay_factor":0.1,"expect_string":"","config_mode_command":"","auto_find_prompt":true,"strip_prompt":true,"strip_command":true,"jump_on_connect":false,"jump_command":"ssh jump_server_IP","jump_username":"","jump_password":"","exit_command":"exit","expect_username_prompt":"username:","expect_password_prompt":"password","expect_prompt":"admin.*$"},{"persistent_id":"BAXmlFEh69U","name":"[(R) Netmiko Validation with TextFSM Option] show arp","creator":"admin","soft_deleted":false,"shared":false,"scoped_name":"show arp","creation_time":"","last_modified":"2022-11-09 01:23:33.033970","last_modified_by":"admin","last_run":"","version":"","description":"","priority":11,"number_of_retries":0,"time_between_retries":10,"max_number_of_retries":100,"credential_type":"any","disable_result_creation":false,"restrict_to_owners":[],"vendor":"","operating_system":"","dry_run":false,"waiting_time":0,"device_query":"","device_query_property":"name","update_target_pools":false,"update_pools_after_running":false,"report":"","report_format":"text","report_jinja2_template":false,"disabled":false,"disabled_info":"","display_report":false,"email_report":false,"send_notification":false,"send_notification_method":"mail","notification_header":"","display_only_failed_nodes":false,"include_device_results":false,"include_link_in_summary":false,"mail_recipient":"","mail_subject":"","mail_sender":"","mail_bcc":"","reply_to":"","initial_payload":{},"mandatory_parametrization":false,"parameterized_form":"name = StringField('Name', [InputRequired()])\ninitial_payload = DictField()\ntarget_devices = MultipleInstanceField('Devices', model='device')\ntarget_pools = MultipleInstanceField('Pools', model='pool')\ndevice_query = StringField('Device Query', python=True, widget=TextArea(), render_kw={'rows': 2})\ndevice_query_property = SelectField('Query Property Type', choices=(('name', 'Name'), ('ip_address', 'IP address')))\nmultiprocessing = BooleanField('Multiprocessing', default=False)\nmax_processes = IntegerField('Maximum number of processes', default=15)","parameterized_form_template":"","skip":{},"skip_query":"","skip_value":"success","iteration_values":"","iteration_variable_name":"iteration_value","iteration_devices":"","iteration_devices_property":"name","preprocessing":"","postprocessing":"","postprocessing_mode":"success","builder_link":"vX253Z8r7sg","log_level":1,"show_user_logs":true,"maximum_runs":1,"multiprocessing":false,"max_processes":15,"validation_condition":"none","conversion_method":"none","validation_method":"text","validation_section":"results['result']","content_match":"","content_match_regex":false,"dict_match":{},"negative_logic":false,"delete_spaces_before_matching":false,"run_method":"per_device","serialized":"dict_values(['', True, 0.0, 'name', True, 'admin.*$', False, '', False, '', False, None, 1, '', '2022-11-09 01:23:33.033970', False, None, '', {}, False, \"name = StringField('Name', [InputRequired()])\\ninitial_payload = DictField()\\ntarget_devices = MultipleInstanceField('Devices', model='device')\\ntarget_pools = MultipleInstanceField('Pools', model='pool')\\ndevice_query = StringField('Device Query', python=True, widget=TextArea(), render_kw={'rows': 2})\\ndevice_query_property = SelectField('Query Property Type', choices=(('name', 'Name'), ('ip_address', 'IP address')))\\nmultiprocessing = BooleanField('Multiprocessing', default=False)\\nmax_processes = IntegerField('Maximum number of processes', default=15)\", 'text', 'default', True, 'password', '', False, False, '', 'iteration_value', False, 'exit', '', 'none', '', True, '[(R) Netmiko Validation with TextFSM Option] show arp', 'username:', False, {}, 'show arp', False, {}, 1, 'netmiko_commands_service', None, 0, 'show arp', '', [], '', 'success', '', True, 10.0, False, False, None, 'any', 'text', False, False, 'none', True, '', False, 'mail', 10.0, 100, '', '', 'BAXmlFEh69U', 'name', 'admin', 'success', '', '', False, False, 'per_device', 'Default Value', 10, False, False, 1, '', 15.0, '', '', 'vX253Z8r7sg', \"results['result']\", False, False, 11, '', 0, 'b4b3b95b-34c5-4279-a6c7-d416989bc97f', '', 'Definition', False, False, False, 0.1, False, False, '', '', False, None, True, 'admin', '', 'ssh jump_server_IP', 'device', '', 'device', 15])","definition":"Definition","reserved":false,"impacting":true,"completion_time":1,"default_uuid":"b4b3b95b-34c5-4279-a6c7-d416989bc97f","mandatory_parameter":"Default Value","admin_only":false,"credentials":"device","custom_username":"","custom_password":"","start_new_connection":false,"connection_name":"default","close_connection":false,"enable_mode":true,"config_mode":false,"commands":"show arp","jinja2_template":false,"results_as_list":false,"driver":"device","use_textfsm":true,"use_genie":false,"read_timeout":10.0,"conn_timeout":10.0,"auth_timeout":0.0,"banner_timeout":15.0,"global_delay_factor":0.1,"expect_string":"","config_mode_command":"","auto_find_prompt":true,"strip_prompt":true,"strip_command":true,"jump_on_connect":false,"jump_command":"ssh jump_server_IP","jump_username":"","jump_password":"","exit_command":"exit","expect_username_prompt":"username:","expect_password_prompt":"password","expect_prompt":"admin.*$"},{"persistent_id":"3_KOa23y_-U","name":"[(R) Netmiko Validation with TextFSM Option] show lldp neighbor","creator":"admin","soft_deleted":false,"shared":false,"scoped_name":"show lldp neighbor","creation_time":"","last_modified":"2022-11-09 01:23:33.036819","last_modified_by":"admin","last_run":"","version":"","description":"","priority":11,"number_of_retries":0,"time_between_retries":10,"max_number_of_retries":100,"credential_type":"any","disable_result_creation":false,"restrict_to_owners":[],"vendor":"","operating_system":"","dry_run":false,"waiting_time":0,"device_query":"","device_query_property":"name","update_target_pools":false,"update_pools_after_running":false,"report":"","report_format":"text","report_jinja2_template":false,"disabled":false,"disabled_info":"","display_report":false,"email_report":false,"send_notification":false,"send_notification_method":"mail","notification_header":"","display_only_failed_nodes":false,"include_device_results":false,"include_link_in_summary":false,"mail_recipient":"","mail_subject":"","mail_sender":"","mail_bcc":"","reply_to":"","initial_payload":{},"mandatory_parametrization":false,"parameterized_form":"name = StringField('Name', [InputRequired()])\ninitial_payload = DictField()\ntarget_devices = MultipleInstanceField('Devices', model='device')\ntarget_pools = MultipleInstanceField('Pools', model='pool')\ndevice_query = StringField('Device Query', python=True, widget=TextArea(), render_kw={'rows': 2})\ndevice_query_property = SelectField('Query Property Type', choices=(('name', 'Name'), ('ip_address', 'IP address')))\nmultiprocessing = BooleanField('Multiprocessing', default=False)\nmax_processes = IntegerField('Maximum number of processes', default=15)","parameterized_form_template":"","skip":{},"skip_query":"","skip_value":"success","iteration_values":"","iteration_variable_name":"iteration_value","iteration_devices":"","iteration_devices_property":"name","preprocessing":"","postprocessing":"","postprocessing_mode":"success","builder_link":"vX253Z8r7sg","log_level":1,"show_user_logs":true,"maximum_runs":1,"multiprocessing":false,"max_processes":15,"validation_condition":"none","conversion_method":"none","validation_method":"text","validation_section":"results['result']","content_match":"","content_match_regex":false,"dict_match":{},"negative_logic":false,"delete_spaces_before_matching":false,"run_method":"per_device","serialized":"dict_values(['', True, 0.0, 'name', True, 'admin.*$', False, '', False, '', False, None, 1, '', '2022-11-09 01:23:33.036819', False, None, '', {}, False, \"name = StringField('Name', [InputRequired()])\\ninitial_payload = DictField()\\ntarget_devices = MultipleInstanceField('Devices', model='device')\\ntarget_pools = MultipleInstanceField('Pools', model='pool')\\ndevice_query = StringField('Device Query', python=True, widget=TextArea(), render_kw={'rows': 2})\\ndevice_query_property = SelectField('Query Property Type', choices=(('name', 'Name'), ('ip_address', 'IP address')))\\nmultiprocessing = BooleanField('Multiprocessing', default=False)\\nmax_processes = IntegerField('Maximum number of processes', default=15)\", 'text', 'default', True, 'password', '', False, False, '', 'iteration_value', False, 'exit', '', 'none', '', True, '[(R) Netmiko Validation with TextFSM Option] show lldp neighbor', 'username:', False, {}, 'show lldp neighbor', False, {}, 1, 'netmiko_commands_service', None, 0, 'show lldp neighbor', '', [], '', 'success', '', True, 10.0, False, False, None, 'any', 'text', False, False, 'none', True, '', False, 'mail', 10.0, 100, '', '', '3_KOa23y_-U', 'name', 'admin', 'success', '', '', False, False, 'per_device', 'Default Value', 10, False, False, 1, '', 15.0, '', '', 'vX253Z8r7sg', \"results['result']\", False, False, 11, '', 0, '1088b834-3df5-43e9-b351-08ecd7d39ace', '', 'Definition', False, False, False, 0.1, False, False, '', '', False, None, True, 'admin', '', 'ssh jump_server_IP', 'device', '', 'device', 15])","definition":"Definition","reserved":false,"impacting":true,"completion_time":1,"default_uuid":"1088b834-3df5-43e9-b351-08ecd7d39ace","mandatory_parameter":"Default Value","admin_only":false,"credentials":"device","custom_username":"","custom_password":"","start_new_connection":false,"connection_name":"default","close_connection":false,"enable_mode":true,"config_mode":false,"commands":"show lldp neighbor","jinja2_template":false,"results_as_list":false,"driver":"device","use_textfsm":true,"use_genie":false,"read_timeout":10.0,"conn_timeout":10.0,"auth_timeout":0.0,"banner_timeout":15.0,"global_delay_factor":0.1,"expect_string":"","config_mode_command":"","auto_find_prompt":true,"strip_prompt":true,"strip_command":true,"jump_on_connect":false,"jump_command":"ssh jump_server_IP","jump_username":"","jump_password":"","exit_command":"exit","expect_username_prompt":"username:","expect_password_prompt":"password","expect_prompt":"admin.*$"},{"persistent_id":"iDy0SbK2dfw","name":"[(R) NAPALM Configuration and Rollback Services] Check VRF exists with Netmiko","creator":"admin","soft_deleted":false,"shared":false,"scoped_name":"Check VRF exists with Netmiko","creation_time":"","last_modified":"2022-11-09 01:23:33.057469","last_modified_by":"admin","last_run":"","version":"","description":"","priority":11,"number_of_retries":0,"time_between_retries":10,"max_number_of_retries":100,"credential_type":"any","disable_result_creation":false,"restrict_to_owners":[],"vendor":"","operating_system":"","dry_run":false,"waiting_time":0,"device_query":"","device_query_property":"ip_address","update_target_pools":false,"update_pools_after_running":false,"report":"","report_format":"text","report_jinja2_template":false,"disabled":false,"disabled_info":"","display_report":false,"email_report":false,"send_notification":false,"send_notification_method":"mail","notification_header":"","display_only_failed_nodes":false,"include_device_results":true,"include_link_in_summary":true,"mail_recipient":"","mail_subject":"","mail_sender":"","mail_bcc":"","reply_to":"","initial_payload":{},"mandatory_parametrization":false,"parameterized_form":"name = StringField('Name', [InputRequired()])\ninitial_payload = DictField()\ntarget_devices = MultipleInstanceField('Devices', model='device')\ntarget_pools = MultipleInstanceField('Pools', model='pool')\ndevice_query = StringField('Device Query', python=True, widget=TextArea(), render_kw={'rows': 2})\ndevice_query_property = SelectField('Query Property Type', choices=(('name', 'Name'), ('ip_address', 'IP address')))\nmultiprocessing = BooleanField('Multiprocessing', default=False)\nmax_processes = IntegerField('Maximum number of processes', default=15)","parameterized_form_template":"","skip":{},"skip_query":"","skip_value":"success","iteration_values":"","iteration_variable_name":"iteration_value","iteration_devices":"","iteration_devices_property":"name","preprocessing":"","postprocessing":"","postprocessing_mode":"always","builder_link":"bGgBnQtcZmQ","log_level":1,"show_user_logs":true,"maximum_runs":1,"multiprocessing":false,"max_processes":15,"validation_condition":"success","conversion_method":"text","validation_method":"text","validation_section":"results['result']","content_match":"napalm","content_match_regex":false,"dict_match":{},"negative_logic":false,"delete_spaces_before_matching":false,"run_method":"per_device","serialized":"dict_values(['', True, 0.0, 'name', True, '', False, '', False, '', True, None, 1, '', '2022-11-09 01:23:33.057469', False, None, '', {}, False, \"name = StringField('Name', [InputRequired()])\\ninitial_payload = DictField()\\ntarget_devices = MultipleInstanceField('Devices', model='device')\\ntarget_pools = MultipleInstanceField('Pools', model='pool')\\ndevice_query = StringField('Device Query', python=True, widget=TextArea(), render_kw={'rows': 2})\\ndevice_query_property = SelectField('Query Property Type', choices=(('name', 'Name'), ('ip_address', 'IP address')))\\nmultiprocessing = BooleanField('Multiprocessing', default=False)\\nmax_processes = IntegerField('Maximum number of processes', default=15)\", 'text', 'default', True, '', '', False, False, '', 'iteration_value', False, '', '', 'text', '', True, '[(R) NAPALM Configuration and Rollback Services] Check VRF exists with Netmiko', '', False, {}, 'Check VRF exists with Netmiko', False, {}, 1, 'netmiko_commands_service', None, 0, 'show vrf', '', [], '', 'always', '', True, 10.0, False, False, None, 'any', 'text', False, False, 'success', False, '', False, 'mail', 10.0, 100, '', '', 'iDy0SbK2dfw', 'ip_address', 'admin', 'success', '', 'napalm', True, False, 'per_device', 'Default Value', 10, False, False, 1, '', 15.0, '', '', 'bGgBnQtcZmQ', \"results['result']\", False, False, 11, '', 0, '78799b0d-208c-4dba-b1d6-35facc0f053f', '', 'Definition', False, False, False, 0.1, False, False, '', '', False, None, True, 'admin', '', '', 'device', '', 'device', 15])","definition":"Definition","reserved":false,"impacting":true,"completion_time":1,"default_uuid":"78799b0d-208c-4dba-b1d6-35facc0f053f","mandatory_parameter":"Default Value","admin_only":false,"credentials":"device","custom_username":"","custom_password":"","start_new_connection":false,"connection_name":"default","close_connection":false,"enable_mode":true,"config_mode":false,"commands":"show vrf","jinja2_template":false,"results_as_list":false,"driver":"device","use_textfsm":false,"use_genie":false,"read_timeout":10.0,"conn_timeout":10.0,"auth_timeout":0.0,"banner_timeout":15.0,"global_delay_factor":0.1,"expect_string":"","config_mode_command":"","auto_find_prompt":true,"strip_prompt":true,"strip_command":true,"jump_on_connect":false,"jump_command":"","jump_username":"","jump_password":"","exit_command":"","expect_username_prompt":"","expect_password_prompt":"","expect_prompt":""},{"persistent_id":"i1pOyNqHngw","name":"[(R) NAPALM Configuration and Rollback Services] Check VRF is not configured with Netmiko","creator":"admin","soft_deleted":false,"shared":false,"scoped_name":"Check VRF is not configured with Netmiko","creation_time":"","last_modified":"2022-12-07 15:08:18.469663","last_modified_by":"admin","last_run":"","version":"","description":"","priority":11,"number_of_retries":0,"time_between_retries":10,"max_number_of_retries":100,"credential_type":"any","disable_result_creation":false,"restrict_to_owners":[],"vendor":"","operating_system":"","dry_run":false,"waiting_time":0,"device_query":"","device_query_property":"ip_address","update_target_pools":false,"update_pools_after_running":false,"report":"","report_format":"text","report_jinja2_template":false,"disabled":false,"disabled_info":"","display_report":false,"email_report":false,"send_notification":false,"send_notification_method":"mail","notification_header":"","display_only_failed_nodes":false,"include_device_results":true,"include_link_in_summary":true,"mail_recipient":"","mail_subject":"","mail_sender":"","mail_bcc":"","reply_to":"","initial_payload":{},"mandatory_parametrization":false,"parameterized_form":"name = StringField('Name', [InputRequired()])\ninitial_payload = DictField()\ntarget_devices = MultipleInstanceField('Devices', model='device')\ntarget_pools = MultipleInstanceField('Pools', model='pool')\ndevice_query = StringField('Device Query', python=True, widget=TextArea(), render_kw={'rows': 2})\ndevice_query_property = SelectField('Query Property Type', choices=(('name', 'Name'), ('ip_address', 'IP address')))\nmultiprocessing = BooleanField('Multiprocessing', default=False)\nmax_processes = IntegerField('Maximum number of processes', default=15)","parameterized_form_template":"","skip":{},"skip_query":"","skip_value":"success","iteration_values":"","iteration_variable_name":"iteration_value","iteration_devices":"","iteration_devices_property":"name","preprocessing":"","postprocessing":"","postprocessing_mode":"always","builder_link":"bGgBnQtcZmQ","log_level":1,"show_user_logs":true,"maximum_runs":1,"multiprocessing":false,"max_processes":15,"validation_condition":"success","conversion_method":"text","validation_method":"text","validation_section":"results['result']","content_match":"12:19809","content_match_regex":false,"dict_match":{},"negative_logic":true,"delete_spaces_before_matching":false,"run_method":"per_device","serialized":"dict_values(['', True, 0.0, 'name', True, '', False, '', False, '', True, None, 1, '', '2022-12-07 15:08:18.469663', False, None, '', {}, False, \"name = StringField('Name', [InputRequired()])\\ninitial_payload = DictField()\\ntarget_devices = MultipleInstanceField('Devices', model='device')\\ntarget_pools = MultipleInstanceField('Pools', model='pool')\\ndevice_query = StringField('Device Query', python=True, widget=TextArea(), render_kw={'rows': 2})\\ndevice_query_property = SelectField('Query Property Type', choices=(('name', 'Name'), ('ip_address', 'IP address')))\\nmultiprocessing = BooleanField('Multiprocessing', default=False)\\nmax_processes = IntegerField('Maximum number of processes', default=15)\", 'text', 'default', True, '', '', False, False, '', 'iteration_value', False, '', '', 'text', '', True, '[(R) NAPALM Configuration and Rollback Services] Check VRF is not configured with Netmiko', '', False, {}, 'Check VRF is not configured with Netmiko', False, {}, 1, 'netmiko_commands_service', None, 0, 'show vrf', '', [], '', 'always', '', True, 10.0, False, False, None, 'any', 'text', False, False, 'success', False, '', False, 'mail', 10.0, 100, '', '', 'i1pOyNqHngw', 'ip_address', 'admin', 'success', '', '12:19809', True, False, 'per_device', 'Default Value', 10, False, False, 1, '', 15.0, '', '', 'bGgBnQtcZmQ', \"results['result']\", False, True, 11, '', 0, 'ce74aa50-a3ce-4f0d-aa7a-a74146d75333', '', 'Definition', False, False, False, 0.1, False, False, '', '', False, None, True, 'admin', '', '', 'device', '', 'device', 15])","definition":"Definition","reserved":false,"impacting":true,"completion_time":1,"default_uuid":"ce74aa50-a3ce-4f0d-aa7a-a74146d75333","mandatory_parameter":"Default Value","admin_only":false,"credentials":"device","custom_username":"","custom_password":"","start_new_connection":false,"connection_name":"default","close_connection":false,"enable_mode":true,"config_mode":false,"commands":"show vrf","jinja2_template":false,"results_as_list":false,"driver":"device","use_textfsm":false,"use_genie":false,"read_timeout":10.0,"conn_timeout":10.0,"auth_timeout":0.0,"banner_timeout":15.0,"global_delay_factor":0.1,"expect_string":"","config_mode_command":"","auto_find_prompt":true,"strip_prompt":true,"strip_command":true,"jump_on_connect":false,"jump_command":"","jump_username":"","jump_password":"","exit_command":"","expect_username_prompt":"","expect_password_prompt":"","expect_prompt":""},{"persistent_id":"2S8XnqonkFo","name":"[(R) Payload Extraction & Validation] netmiko_show_ip_route","creator":"admin","soft_deleted":false,"shared":false,"scoped_name":"netmiko_show_ip_route","creation_time":"","last_modified":"2024-05-12 08:40:06.089263","last_modified_by":"admin","last_run":"","version":"","description":"Show IP route","priority":11,"number_of_retries":0,"time_between_retries":10,"max_number_of_retries":100,"credential_type":"any","disable_result_creation":false,"restrict_to_owners":[],"vendor":"Arista","operating_system":"EOS","dry_run":false,"waiting_time":0,"device_query":"","device_query_property":"ip_address","update_target_pools":false,"update_pools_after_running":false,"report":"","report_format":"text","report_jinja2_template":false,"disabled":false,"disabled_info":"","display_report":false,"email_report":false,"send_notification":false,"send_notification_method":"mail","notification_header":"","display_only_failed_nodes":true,"include_device_results":true,"include_link_in_summary":true,"mail_recipient":"antoine.fourmy@gmail.com","mail_subject":"","mail_sender":"","mail_bcc":"","reply_to":"","initial_payload":{},"mandatory_parametrization":false,"parameterized_form":"name = StringField('Name', [InputRequired()])\ninitial_payload = DictField()\ntarget_devices = MultipleInstanceField('Devices', model='device')\ntarget_pools = MultipleInstanceField('Pools', model='pool')\ndevice_query = StringField('Device Query', python=True, widget=TextArea(), render_kw={'rows': 2})\ndevice_query_property = SelectField('Query Property Type', choices=(('name', 'Name'), ('ip_address', 'IP address')))\nmultiprocessing = BooleanField('Multiprocessing', default=False)\nmax_processes = IntegerField('Maximum number of processes', default=15)","parameterized_form_template":"","skip":{},"skip_query":"","skip_value":"success","iteration_values":"","iteration_variable_name":"iteration_value","iteration_devices":"","iteration_devices_property":"ip_address","preprocessing":"","postprocessing":"","postprocessing_mode":"always","builder_link":"juinZjoUWhk","log_level":1,"show_user_logs":true,"maximum_runs":1,"multiprocessing":false,"max_processes":5,"validation_condition":"none","conversion_method":"text","validation_method":"text","validation_section":"results['result']","content_match":"","content_match_regex":false,"dict_match":{},"negative_logic":false,"delete_spaces_before_matching":false,"run_method":"per_device","serialized":"dict_values(['', True, 0.0, 'ip_address', True, '', False, '', False, '', True, None, 1, '', '2024-05-12 08:40:06.089263', True, None, 'Show IP route', {}, True, \"name = StringField('Name', [InputRequired()])\\ninitial_payload = DictField()\\ntarget_devices = MultipleInstanceField('Devices', model='device')\\ntarget_pools = MultipleInstanceField('Pools', model='pool')\\ndevice_query = StringField('Device Query', python=True, widget=TextArea(), render_kw={'rows': 2})\\ndevice_query_property = SelectField('Query Property Type', choices=(('name', 'Name'), ('ip_address', 'IP address')))\\nmultiprocessing = BooleanField('Multiprocessing', default=False)\\nmax_processes = IntegerField('Maximum number of processes', default=15)\", 'text', 'default', True, '', '', False, False, '', 'iteration_value', False, '', 'antoine.fourmy@gmail.com', 'text', '', True, '[(R) Payload Extraction & Validation] netmiko_show_ip_route', '', False, {}, 'netmiko_show_ip_route', False, {}, 1, 'netmiko_commands_service', None, 0, 'show ip route', '', [], '', 'always', '', True, 10.0, False, False, None, 'any', 'text', False, False, 'none', False, '', False, 'mail', 10.0, 100, 'Arista', '', '2S8XnqonkFo', 'ip_address', 'admin', 'success', '', '', True, False, 'per_device', 'Default Value', 10, False, False, 1, '', 15.0, '', '', 'juinZjoUWhk', \"results['result']\", False, False, 11, 'EOS', 0, '3983764b-b4e5-4ad1-a552-a7e46efc50aa', '', 'Definition', False, False, False, 0.1, False, False, '', '', False, None, True, 'admin', '', '', 'device', '', 'device', 5])","definition":"Definition","reserved":false,"impacting":true,"completion_time":1,"default_uuid":"3983764b-b4e5-4ad1-a552-a7e46efc50aa","mandatory_parameter":"Default Value","admin_only":false,"credentials":"device","custom_username":"","custom_password":"","start_new_connection":false,"connection_name":"default","close_connection":true,"enable_mode":true,"config_mode":false,"commands":"show ip route","jinja2_template":false,"results_as_list":false,"driver":"device","use_textfsm":false,"use_genie":false,"read_timeout":10.0,"conn_timeout":10.0,"auth_timeout":0.0,"banner_timeout":15.0,"global_delay_factor":0.1,"expect_string":"","config_mode_command":"","auto_find_prompt":true,"strip_prompt":true,"strip_command":true,"jump_on_connect":false,"jump_command":"","jump_username":"","jump_password":"","exit_command":"","expect_username_prompt":"","expect_password_prompt":"","expect_prompt":""},{"persistent_id":"ojMoAu8w53A","name":"[(R) Gateway Mechanism (SSH Proxy with Netmiko)] Gateway 1","creator":"admin","soft_deleted":false,"shared":false,"scoped_name":"Gateway 1","creation_time":"","last_modified":"2022-11-09 01:23:33.314136","last_modified_by":"admin","last_run":"","version":"","description":"","priority":11,"number_of_retries":0,"time_between_retries":10,"max_number_of_retries":100,"credential_type":"any","disable_result_creation":false,"restrict_to_owners":[],"vendor":"","operating_system":"","dry_run":false,"waiting_time":0,"device_query":"","device_query_property":"name","update_target_pools":false,"update_pools_after_running":false,"report":"","report_format":"text","report_jinja2_template":false,"disabled":false,"disabled_info":"","display_report":false,"email_report":false,"send_notification":false,"send_notification_method":"mail","notification_header":"","display_only_failed_nodes":false,"include_device_results":false,"include_link_in_summary":false,"mail_recipient":"","mail_subject":"","mail_sender":"","mail_bcc":"","reply_to":"","initial_payload":{},"mandatory_parametrization":false,"parameterized_form":"name = StringField('Name', [InputRequired()])\ninitial_payload = DictField()\ntarget_devices = MultipleInstanceField('Devices', model='device')\ntarget_pools = MultipleInstanceField('Pools', model='pool')\ndevice_query = StringField('Device Query', python=True, widget=TextArea(), render_kw={'rows': 2})\ndevice_query_property = SelectField('Query Property Type', choices=(('name', 'Name'), ('ip_address', 'IP address')))\nmultiprocessing = BooleanField('Multiprocessing', default=False)\nmax_processes = IntegerField('Maximum number of processes', default=15)","parameterized_form_template":"","skip":{"(R) Gateway Mechanism (SSH Proxy with Scrapli)":false},"skip_query":"","skip_value":"success","iteration_values":"","iteration_variable_name":"iteration_value","iteration_devices":"","iteration_devices_property":"name","preprocessing":"","postprocessing":"","postprocessing_mode":"success","builder_link":"Jxho3cTVJUE","log_level":1,"show_user_logs":true,"maximum_runs":1,"multiprocessing":false,"max_processes":15,"validation_condition":"none","conversion_method":"none","validation_method":"text","validation_section":"results['result']","content_match":"","content_match_regex":false,"dict_match":{},"negative_logic":false,"delete_spaces_before_matching":false,"run_method":"per_device","serialized":"dict_values(['', True, 0.0, 'name', True, 'admin.*$', False, '', False, '', False, None, 1, '', '2022-11-09 01:23:33.314136', False, None, '', {}, False, \"name = StringField('Name', [InputRequired()])\\ninitial_payload = DictField()\\ntarget_devices = MultipleInstanceField('Devices', model='device')\\ntarget_pools = MultipleInstanceField('Pools', model='pool')\\ndevice_query = StringField('Device Query', python=True, widget=TextArea(), render_kw={'rows': 2})\\ndevice_query_property = SelectField('Query Property Type', choices=(('name', 'Name'), ('ip_address', 'IP address')))\\nmultiprocessing = BooleanField('Multiprocessing', default=False)\\nmax_processes = IntegerField('Maximum number of processes', default=15)\", 'text', 'default', True, 'password', '', False, False, '', 'iteration_value', False, 'exit', '', 'none', '', True, '[(R) Gateway Mechanism (SSH Proxy with Netmiko)] Gateway 1', 'username:', False, {}, 'Gateway 1', False, {'(R) Gateway Mechanism (SSH Proxy with Scrapli)': False}, 1, 'netmiko_commands_service', None, 0, 'sh ip int br', '', [], '', 'success', '', True, 10.0, False, False, None, 'any', 'text', False, False, 'none', False, '', False, 'mail', 10.0, 100, '', '', 'ojMoAu8w53A', 'name', 'admin', 'success', '', '', False, False, 'per_device', 'Default Value', 10, False, False, 1, '', 15.0, '', '', 'Jxho3cTVJUE', \"results['result']\", False, False, 11, '', 0, '60691a93-16ad-4b40-a55c-7216ed064000', '', 'Definition', False, False, False, 0.1, False, False, '', '', False, None, True, 'admin', '', 'ssh jump_server_IP', 'device', '', 'device', 15])","definition":"Definition","reserved":false,"impacting":true,"completion_time":1,"default_uuid":"60691a93-16ad-4b40-a55c-7216ed064000","mandatory_parameter":"Default Value","admin_only":false,"credentials":"device","custom_username":"","custom_password":"","start_new_connection":false,"connection_name":"default","close_connection":false,"enable_mode":true,"config_mode":false,"commands":"sh ip int br","jinja2_template":false,"results_as_list":false,"driver":"device","use_textfsm":false,"use_genie":false,"read_timeout":10.0,"conn_timeout":10.0,"auth_timeout":0.0,"banner_timeout":15.0,"global_delay_factor":0.1,"expect_string":"","config_mode_command":"","auto_find_prompt":true,"strip_prompt":true,"strip_command":true,"jump_on_connect":false,"jump_command":"ssh jump_server_IP","jump_username":"","jump_password":"","exit_command":"exit","expect_username_prompt":"username:","expect_password_prompt":"password","expect_prompt":"admin.*$"},{"persistent_id":"91tBBdUzxog","name":"[(R) Gateway Mechanism (SSH Proxy with Netmiko)] Gateway 3, 2 then 1","creator":"admin","soft_deleted":false,"shared":false,"scoped_name":"Gateway 3, 2 then 1","creation_time":"","last_modified":"2022-11-09 01:23:33.317517","last_modified_by":"admin","last_run":"","version":"","description":"","priority":11,"number_of_retries":0,"time_between_retries":10,"max_number_of_retries":100,"credential_type":"any","disable_result_creation":false,"restrict_to_owners":[],"vendor":"","operating_system":"","dry_run":false,"waiting_time":0,"device_query":"","device_query_property":"name","update_target_pools":false,"update_pools_after_running":false,"report":"","report_format":"text","report_jinja2_template":false,"disabled":false,"disabled_info":"","display_report":false,"email_report":false,"send_notification":false,"send_notification_method":"mail","notification_header":"","display_only_failed_nodes":false,"include_device_results":false,"include_link_in_summary":false,"mail_recipient":"","mail_subject":"","mail_sender":"","mail_bcc":"","reply_to":"","initial_payload":{},"mandatory_parametrization":false,"parameterized_form":"name = StringField('Name', [InputRequired()])\ninitial_payload = DictField()\ntarget_devices = MultipleInstanceField('Devices', model='device')\ntarget_pools = MultipleInstanceField('Pools', model='pool')\ndevice_query = StringField('Device Query', python=True, widget=TextArea(), render_kw={'rows': 2})\ndevice_query_property = SelectField('Query Property Type', choices=(('name', 'Name'), ('ip_address', 'IP address')))\nmultiprocessing = BooleanField('Multiprocessing', default=False)\nmax_processes = IntegerField('Maximum number of processes', default=15)","parameterized_form_template":"","skip":{"(R) Gateway Mechanism (SSH Proxy with Scrapli)":false},"skip_query":"","skip_value":"success","iteration_values":"","iteration_variable_name":"iteration_value","iteration_devices":"","iteration_devices_property":"name","preprocessing":"","postprocessing":"","postprocessing_mode":"success","builder_link":"Jxho3cTVJUE","log_level":1,"show_user_logs":true,"maximum_runs":1,"multiprocessing":false,"max_processes":15,"validation_condition":"none","conversion_method":"none","validation_method":"text","validation_section":"results['result']","content_match":"","content_match_regex":false,"dict_match":{},"negative_logic":false,"delete_spaces_before_matching":false,"run_method":"per_device","serialized":"dict_values(['', True, 0.0, 'name', True, 'admin.*$', False, '', False, '', False, None, 1, '', '2022-11-09 01:23:33.317517', False, None, '', {}, False, \"name = StringField('Name', [InputRequired()])\\ninitial_payload = DictField()\\ntarget_devices = MultipleInstanceField('Devices', model='device')\\ntarget_pools = MultipleInstanceField('Pools', model='pool')\\ndevice_query = StringField('Device Query', python=True, widget=TextArea(), render_kw={'rows': 2})\\ndevice_query_property = SelectField('Query Property Type', choices=(('name', 'Name'), ('ip_address', 'IP address')))\\nmultiprocessing = BooleanField('Multiprocessing', default=False)\\nmax_processes = IntegerField('Maximum number of processes', default=15)\", 'text', 'default', True, 'password', '', False, False, '', 'iteration_value', False, 'exit', '', 'none', '', True, '[(R) Gateway Mechanism (SSH Proxy with Netmiko)] Gateway 3, 2 then 1', 'username:', False, {}, 'Gateway 3, 2 then 1', False, {'(R) Gateway Mechanism (SSH Proxy with Scrapli)': False}, 1, 'netmiko_commands_service', None, 0, 'sh ip int br', '', [], '', 'success', '', True, 10.0, False, False, None, 'any', 'text', False, False, 'none', False, '', False, 'mail', 10.0, 100, '', '', '91tBBdUzxog', 'name', 'admin', 'success', '', '', False, False, 'per_device', 'Default Value', 10, False, False, 1, '', 15.0, '', '', 'Jxho3cTVJUE', \"results['result']\", False, False, 11, '', 0, '310e7b38-235f-4a82-96fc-64befbb2b0b5', '', 'Definition', False, False, False, 0.1, False, False, '', '', False, None, True, 'admin', '', 'ssh jump_server_IP', 'device', '', 'device', 15])","definition":"Definition","reserved":false,"impacting":true,"completion_time":1,"default_uuid":"310e7b38-235f-4a82-96fc-64befbb2b0b5","mandatory_parameter":"Default Value","admin_only":false,"credentials":"device","custom_username":"","custom_password":"","start_new_connection":false,"connection_name":"default","close_connection":false,"enable_mode":true,"config_mode":false,"commands":"sh ip int br","jinja2_template":false,"results_as_list":false,"driver":"device","use_textfsm":false,"use_genie":false,"read_timeout":10.0,"conn_timeout":10.0,"auth_timeout":0.0,"banner_timeout":15.0,"global_delay_factor":0.1,"expect_string":"","config_mode_command":"","auto_find_prompt":true,"strip_prompt":true,"strip_command":true,"jump_on_connect":false,"jump_command":"ssh jump_server_IP","jump_username":"","jump_password":"","exit_command":"exit","expect_username_prompt":"username:","expect_password_prompt":"password","expect_prompt":"admin.*$"},{"persistent_id":"RnA9a1mCKg0","name":"[(R) Gateway Mechanism (SSH Proxy with Netmiko)] Both","creator":"admin","soft_deleted":false,"shared":false,"scoped_name":"Both","creation_time":"","last_modified":"2022-11-09 01:23:33.320719","last_modified_by":"admin","last_run":"","version":"","description":"","priority":11,"number_of_retries":0,"time_between_retries":10,"max_number_of_retries":100,"credential_type":"any","disable_result_creation":false,"restrict_to_owners":[],"vendor":"","operating_system":"","dry_run":false,"waiting_time":0,"device_query":"","device_query_property":"name","update_target_pools":false,"update_pools_after_running":false,"report":"","report_format":"text","report_jinja2_template":false,"disabled":false,"disabled_info":"","display_report":false,"email_report":false,"send_notification":false,"send_notification_method":"mail","notification_header":"","display_only_failed_nodes":false,"include_device_results":false,"include_link_in_summary":false,"mail_recipient":"","mail_subject":"","mail_sender":"","mail_bcc":"","reply_to":"","initial_payload":{},"mandatory_parametrization":false,"parameterized_form":"name = StringField('Name', [InputRequired()])\ninitial_payload = DictField()\ntarget_devices = MultipleInstanceField('Devices', model='device')\ntarget_pools = MultipleInstanceField('Pools', model='pool')\ndevice_query = StringField('Device Query', python=True, widget=TextArea(), render_kw={'rows': 2})\ndevice_query_property = SelectField('Query Property Type', choices=(('name', 'Name'), ('ip_address', 'IP address')))\nmultiprocessing = BooleanField('Multiprocessing', default=False)\nmax_processes = IntegerField('Maximum number of processes', default=15)","parameterized_form_template":"","skip":{"(R) Gateway Mechanism (SSH Proxy with Scrapli)":false},"skip_query":"","skip_value":"success","iteration_values":"","iteration_variable_name":"iteration_value","iteration_devices":"","iteration_devices_property":"name","preprocessing":"","postprocessing":"","postprocessing_mode":"success","builder_link":"Jxho3cTVJUE","log_level":1,"show_user_logs":true,"maximum_runs":1,"multiprocessing":false,"max_processes":15,"validation_condition":"none","conversion_method":"none","validation_method":"text","validation_section":"results['result']","content_match":"","content_match_regex":false,"dict_match":{},"negative_logic":false,"delete_spaces_before_matching":false,"run_method":"per_device","serialized":"dict_values(['', True, 0.0, 'name', True, 'admin.*$', False, '', False, '', False, None, 1, '', '2022-11-09 01:23:33.320719', False, None, '', {}, False, \"name = StringField('Name', [InputRequired()])\\ninitial_payload = DictField()\\ntarget_devices = MultipleInstanceField('Devices', model='device')\\ntarget_pools = MultipleInstanceField('Pools', model='pool')\\ndevice_query = StringField('Device Query', python=True, widget=TextArea(), render_kw={'rows': 2})\\ndevice_query_property = SelectField('Query Property Type', choices=(('name', 'Name'), ('ip_address', 'IP address')))\\nmultiprocessing = BooleanField('Multiprocessing', default=False)\\nmax_processes = IntegerField('Maximum number of processes', default=15)\", 'text', 'default', True, 'password', '', False, False, '', 'iteration_value', False, 'exit', '', 'none', '', True, '[(R) Gateway Mechanism (SSH Proxy with Netmiko)] Both', 'username:', False, {}, 'Both', False, {'(R) Gateway Mechanism (SSH Proxy with Scrapli)': False}, 1, 'netmiko_commands_service', None, 0, 'sh ip int br', '', [], '', 'success', '', True, 10.0, False, False, None, 'any', 'text', False, False, 'none', False, '', False, 'mail', 10.0, 100, '', '', 'RnA9a1mCKg0', 'name', 'admin', 'success', '', '', False, False, 'per_device', 'Default Value', 10, False, False, 1, '', 15.0, '', '', 'Jxho3cTVJUE', \"results['result']\", False, False, 11, '', 0, '5613e3e0-79e5-4eaf-acd6-59e3e9543bd7', '', 'Definition', False, False, False, 0.1, False, False, '', '', False, None, True, 'admin', '', 'ssh jump_server_IP', 'device', '', 'device', 15])","definition":"Definition","reserved":false,"impacting":true,"completion_time":1,"default_uuid":"5613e3e0-79e5-4eaf-acd6-59e3e9543bd7","mandatory_parameter":"Default Value","admin_only":false,"credentials":"device","custom_username":"","custom_password":"","start_new_connection":false,"connection_name":"default","close_connection":false,"enable_mode":true,"config_mode":false,"commands":"sh ip int br","jinja2_template":false,"results_as_list":false,"driver":"device","use_textfsm":false,"use_genie":false,"read_timeout":10.0,"conn_timeout":10.0,"auth_timeout":0.0,"banner_timeout":15.0,"global_delay_factor":0.1,"expect_string":"","config_mode_command":"","auto_find_prompt":true,"strip_prompt":true,"strip_command":true,"jump_on_connect":false,"jump_command":"ssh jump_server_IP","jump_username":"","jump_password":"","exit_command":"exit","expect_username_prompt":"username:","expect_password_prompt":"password","expect_prompt":"admin.*$"},{"persistent_id":"wAseYsTooQo","name":"[(R) Scrapli and Netmiko Multiple Commands and Jinja2] Netmiko Jinja 2 conversion (text)","creator":"admin","soft_deleted":false,"shared":false,"scoped_name":"Netmiko Jinja 2 conversion (text)","creation_time":"","last_modified":"2022-11-09 01:23:33.512917","last_modified_by":"admin","last_run":"","version":"","description":"","priority":10,"number_of_retries":0,"time_between_retries":10,"max_number_of_retries":100,"credential_type":"any","disable_result_creation":false,"restrict_to_owners":[],"vendor":"","operating_system":"","dry_run":false,"waiting_time":0,"device_query":"","device_query_property":"name","update_target_pools":false,"update_pools_after_running":false,"report":"","report_format":"text","report_jinja2_template":false,"disabled":false,"disabled_info":"","display_report":false,"email_report":false,"send_notification":false,"send_notification_method":"mail","notification_header":"","display_only_failed_nodes":false,"include_device_results":false,"include_link_in_summary":false,"mail_recipient":"","mail_subject":"","mail_sender":"","mail_bcc":"","reply_to":"","initial_payload":{},"mandatory_parametrization":false,"parameterized_form":"name = StringField('Name', [InputRequired()])\ninitial_payload = DictField()\ntarget_devices = MultipleInstanceField('Devices', model='device')\ntarget_pools = MultipleInstanceField('Pools', model='pool')\ndevice_query = StringField('Device Query', python=True, widget=TextArea(), render_kw={'rows': 2})\ndevice_query_property = SelectField('Query Property Type', choices=(('name', 'Name'), ('ip_address', 'IP address')))\nmultiprocessing = BooleanField('Multiprocessing', default=False)\nmax_processes = IntegerField('Maximum number of processes', default=15)","parameterized_form_template":"","skip":{},"skip_query":"","skip_value":"success","iteration_values":"","iteration_variable_name":"iteration_value","iteration_devices":"","iteration_devices_property":"name","preprocessing":"","postprocessing":"is_string = isinstance(results[\"result\"], str)\nvalid_commands = True\nfor vrf in (\"a\", \"b\", \"c\"):\n  if f\"show vrf {vrf}\" not in results[\"commands\"]:\n    valid_commands = False\nvalid_content = results[\"result\"].count(\"Interfaces\") == 3\nresults[\"success\"] = is_string and valid_commands and valid_content\n","postprocessing_mode":"success","builder_link":"rN970EPoY5I","log_level":1,"show_user_logs":true,"maximum_runs":1,"multiprocessing":false,"max_processes":15,"validation_condition":"none","conversion_method":"none","validation_method":"text","validation_section":"results['result']","content_match":"","content_match_regex":false,"dict_match":{},"negative_logic":false,"delete_spaces_before_matching":false,"run_method":"per_device","serialized":"dict_values(['', True, 0.0, 'name', True, 'admin.*$', False, 'is_string = isinstance(results[\"result\"], str)\\nvalid_commands = True\\nfor vrf in (\"a\", \"b\", \"c\"):\\n  if f\"show vrf {vrf}\" not in results[\"commands\"]:\\n    valid_commands = False\\nvalid_content = results[\"result\"].count(\"Interfaces\") == 3\\nresults[\"success\"] = is_string and valid_commands and valid_content\\n', False, '', False, None, 1, '', '2022-11-09 01:23:33.512917', False, None, '', {}, False, \"name = StringField('Name', [InputRequired()])\\ninitial_payload = DictField()\\ntarget_devices = MultipleInstanceField('Devices', model='device')\\ntarget_pools = MultipleInstanceField('Pools', model='pool')\\ndevice_query = StringField('Device Query', python=True, widget=TextArea(), render_kw={'rows': 2})\\ndevice_query_property = SelectField('Query Property Type', choices=(('name', 'Name'), ('ip_address', 'IP address')))\\nmultiprocessing = BooleanField('Multiprocessing', default=False)\\nmax_processes = IntegerField('Maximum number of processes', default=15)\", 'text', 'default', True, 'password', '', False, False, '', 'iteration_value', False, 'exit', '', 'none', '', True, '[(R) Scrapli and Netmiko Multiple Commands and Jinja2] Netmiko Jinja 2 conversion (text)', 'username:', False, {}, 'Netmiko Jinja 2 conversion (text)', False, {}, 1, 'netmiko_commands_service', None, 0, '{%- for vrf in get_var(\"abc\", device=device.name) -%}\\nshow vrf {{ vrf }}\\n{% endfor %}', '', [], '', 'success', '', True, 10.0, False, False, None, 'any', 'text', False, False, 'none', False, '', False, 'mail', 10.0, 100, '', '', 'wAseYsTooQo', 'name', 'admin', 'success', '', '', False, False, 'per_device', 'Default Value', 10, False, False, 1, '', 15.0, '', '', 'rN970EPoY5I', \"results['result']\", False, False, 10, '', 0, '85001988-1b1f-4feb-9dee-12a8e994dad9', '', 'Definition', False, True, False, 0.1, False, False, '', '', False, None, True, 'admin', '', 'ssh jump_server_IP', 'device', '', 'device', 15])","definition":"Definition","reserved":false,"impacting":true,"completion_time":1,"default_uuid":"85001988-1b1f-4feb-9dee-12a8e994dad9","mandatory_parameter":"Default Value","admin_only":false,"credentials":"device","custom_username":"","custom_password":"","start_new_connection":false,"connection_name":"default","close_connection":false,"enable_mode":true,"config_mode":false,"commands":"{%- for vrf in get_var(\"abc\", device=device.name) -%}\nshow vrf {{ vrf }}\n{% endfor %}","jinja2_template":true,"results_as_list":false,"driver":"device","use_textfsm":false,"use_genie":false,"read_timeout":10.0,"conn_timeout":10.0,"auth_timeout":0.0,"banner_timeout":15.0,"global_delay_factor":0.1,"expect_string":"","config_mode_command":"","auto_find_prompt":true,"strip_prompt":true,"strip_command":true,"jump_on_connect":false,"jump_command":"ssh jump_server_IP","jump_username":"","jump_password":"","exit_command":"exit","expect_username_prompt":"username:","expect_password_prompt":"password","expect_prompt":"admin.*$"},{"persistent_id":"RP-7Af8jiHQ","name":"[(R) Scrapli and Netmiko Multiple Commands and Jinja2] Netmiko Jinja 2 conversion (list)","creator":"admin","soft_deleted":false,"shared":false,"scoped_name":"Netmiko Jinja 2 conversion (list)","creation_time":"","last_modified":"2022-11-09 01:23:33.516724","last_modified_by":"admin","last_run":"","version":"","description":"","priority":10,"number_of_retries":0,"time_between_retries":10,"max_number_of_retries":100,"credential_type":"any","disable_result_creation":false,"restrict_to_owners":[],"vendor":"","operating_system":"","dry_run":false,"waiting_time":0,"device_query":"","device_query_property":"name","update_target_pools":false,"update_pools_after_running":false,"report":"","report_format":"text","report_jinja2_template":false,"disabled":false,"disabled_info":"","display_report":false,"email_report":false,"send_notification":false,"send_notification_method":"mail","notification_header":"","display_only_failed_nodes":false,"include_device_results":false,"include_link_in_summary":false,"mail_recipient":"","mail_subject":"","mail_sender":"","mail_bcc":"","reply_to":"","initial_payload":{},"mandatory_parametrization":false,"parameterized_form":"name = StringField('Name', [InputRequired()])\ninitial_payload = DictField()\ntarget_devices = MultipleInstanceField('Devices', model='device')\ntarget_pools = MultipleInstanceField('Pools', model='pool')\ndevice_query = StringField('Device Query', python=True, widget=TextArea(), render_kw={'rows': 2})\ndevice_query_property = SelectField('Query Property Type', choices=(('name', 'Name'), ('ip_address', 'IP address')))\nmultiprocessing = BooleanField('Multiprocessing', default=False)\nmax_processes = IntegerField('Maximum number of processes', default=15)","parameterized_form_template":"","skip":{},"skip_query":"","skip_value":"success","iteration_values":"","iteration_variable_name":"iteration_value","iteration_devices":"","iteration_devices_property":"name","preprocessing":"","postprocessing":"is_list = isinstance(results[\"result\"], list)\nvalid_result = True\nfor index, vrf in enumerate((\"a\", \"b\", \"c\")):\n  if (\n    f\"show vrf {vrf}\" not in results[\"commands\"]\n    or \"Protocols\" not in results[\"result\"][index]\n  ):\n    valid_result = False\nresults[\"success\"] = is_list and valid_result","postprocessing_mode":"success","builder_link":"rN970EPoY5I","log_level":1,"show_user_logs":true,"maximum_runs":1,"multiprocessing":false,"max_processes":15,"validation_condition":"none","conversion_method":"none","validation_method":"text","validation_section":"results['result']","content_match":"","content_match_regex":false,"dict_match":{},"negative_logic":false,"delete_spaces_before_matching":false,"run_method":"per_device","serialized":"dict_values(['', True, 0.0, 'name', True, 'admin.*$', False, 'is_list = isinstance(results[\"result\"], list)\\nvalid_result = True\\nfor index, vrf in enumerate((\"a\", \"b\", \"c\")):\\n  if (\\n    f\"show vrf {vrf}\" not in results[\"commands\"]\\n    or \"Protocols\" not in results[\"result\"][index]\\n  ):\\n    valid_result = False\\nresults[\"success\"] = is_list and valid_result', False, '', False, None, 1, '', '2022-11-09 01:23:33.516724', False, None, '', {}, False, \"name = StringField('Name', [InputRequired()])\\ninitial_payload = DictField()\\ntarget_devices = MultipleInstanceField('Devices', model='device')\\ntarget_pools = MultipleInstanceField('Pools', model='pool')\\ndevice_query = StringField('Device Query', python=True, widget=TextArea(), render_kw={'rows': 2})\\ndevice_query_property = SelectField('Query Property Type', choices=(('name', 'Name'), ('ip_address', 'IP address')))\\nmultiprocessing = BooleanField('Multiprocessing', default=False)\\nmax_processes = IntegerField('Maximum number of processes', default=15)\", 'text', 'default', True, 'password', '', False, False, '', 'iteration_value', False, 'exit', '', 'none', '', True, '[(R) Scrapli and Netmiko Multiple Commands and Jinja2] Netmiko Jinja 2 conversion (list)', 'username:', False, {}, 'Netmiko Jinja 2 conversion (list)', False, {}, 1, 'netmiko_commands_service', None, 0, '{%- for vrf in get_var(\"abc\", device=device.name) -%}\\nshow vrf {{ vrf }}\\n{% endfor %}', '', [], '', 'success', '', True, 10.0, False, False, None, 'any', 'text', False, False, 'none', False, '', False, 'mail', 10.0, 100, '', '', 'RP-7Af8jiHQ', 'name', 'admin', 'success', '', '', False, False, 'per_device', 'Default Value', 10, True, False, 1, '', 15.0, '', '', 'rN970EPoY5I', \"results['result']\", False, False, 10, '', 0, '85001988-1b1f-4feb-9dee-12a8e994dad9', '', 'Definition', False, True, False, 0.1, False, False, '', '', False, None, True, 'admin', '', 'ssh jump_server_IP', 'device', '', 'device', 15])","definition":"Definition","reserved":false,"impacting":true,"completion_time":1,"default_uuid":"85001988-1b1f-4feb-9dee-12a8e994dad9","mandatory_parameter":"Default Value","admin_only":false,"credentials":"device","custom_username":"","custom_password":"","start_new_connection":false,"connection_name":"default","close_connection":false,"enable_mode":true,"config_mode":false,"commands":"{%- for vrf in get_var(\"abc\", device=device.name) -%}\nshow vrf {{ vrf }}\n{% endfor %}","jinja2_template":true,"results_as_list":true,"driver":"device","use_textfsm":false,"use_genie":false,"read_timeout":10.0,"conn_timeout":10.0,"auth_timeout":0.0,"banner_timeout":15.0,"global_delay_factor":0.1,"expect_string":"","config_mode_command":"","auto_find_prompt":true,"strip_prompt":true,"strip_command":true,"jump_on_connect":false,"jump_command":"ssh jump_server_IP","jump_username":"","jump_password":"","exit_command":"exit","expect_username_prompt":"username:","expect_password_prompt":"password","expect_prompt":"admin.*$"},{"persistent_id":"LISgw9zf7LE","name":"[(R) Function: get_connection] Open default connection","creator":"admin","soft_deleted":false,"shared":false,"scoped_name":"Open default connection","creation_time":"","last_modified":"2022-11-09 01:23:33.532479","last_modified_by":"admin","last_run":"","version":"","description":"","priority":10,"number_of_retries":0,"time_between_retries":10,"max_number_of_retries":100,"credential_type":"any","disable_result_creation":false,"restrict_to_owners":[],"vendor":"","operating_system":"","dry_run":false,"waiting_time":0,"device_query":"","device_query_property":"name","update_target_pools":false,"update_pools_after_running":false,"report":"","report_format":"text","report_jinja2_template":false,"disabled":false,"disabled_info":"","display_report":false,"email_report":false,"send_notification":false,"send_notification_method":"mail","notification_header":"","display_only_failed_nodes":false,"include_device_results":false,"include_link_in_summary":false,"mail_recipient":"","mail_subject":"","mail_sender":"","mail_bcc":"","reply_to":"","initial_payload":{},"mandatory_parametrization":false,"parameterized_form":"name = StringField('Name', [InputRequired()])\ninitial_payload = DictField()\ntarget_devices = MultipleInstanceField('Devices', model='device')\ntarget_pools = MultipleInstanceField('Pools', model='pool')\ndevice_query = StringField('Device Query', python=True, widget=TextArea(), render_kw={'rows': 2})\ndevice_query_property = SelectField('Query Property Type', choices=(('name', 'Name'), ('ip_address', 'IP address')))\nmultiprocessing = BooleanField('Multiprocessing', default=False)\nmax_processes = IntegerField('Maximum number of processes', default=15)","parameterized_form_template":"","skip":{},"skip_query":"","skip_value":"success","iteration_values":"","iteration_variable_name":"iteration_value","iteration_devices":"","iteration_devices_property":"name","preprocessing":"","postprocessing":"","postprocessing_mode":"success","builder_link":"FQrdWViuC5U","log_level":1,"show_user_logs":true,"maximum_runs":1,"multiprocessing":false,"max_processes":15,"validation_condition":"none","conversion_method":"none","validation_method":"text","validation_section":"results['result']","content_match":"","content_match_regex":false,"dict_match":{},"negative_logic":false,"delete_spaces_before_matching":false,"run_method":"per_device","serialized":"dict_values(['', True, 0.0, 'name', True, 'admin.*$', False, '', False, '', False, None, 1, '', '2022-11-09 01:23:33.532479', False, None, '', {}, False, \"name = StringField('Name', [InputRequired()])\\ninitial_payload = DictField()\\ntarget_devices = MultipleInstanceField('Devices', model='device')\\ntarget_pools = MultipleInstanceField('Pools', model='pool')\\ndevice_query = StringField('Device Query', python=True, widget=TextArea(), render_kw={'rows': 2})\\ndevice_query_property = SelectField('Query Property Type', choices=(('name', 'Name'), ('ip_address', 'IP address')))\\nmultiprocessing = BooleanField('Multiprocessing', default=False)\\nmax_processes = IntegerField('Maximum number of processes', default=15)\", 'text', 'default', True, 'password', '', False, False, '', 'iteration_value', False, 'exit', '', 'none', '', True, '[(R) Function: get_connection] Open default connection', 'username:', False, {}, 'Open default connection', False, {}, 1, 'netmiko_commands_service', None, 0, 'show users', '', [], '', 'success', '', True, 10.0, False, False, None, 'any', 'text', False, False, 'none', False, '', False, 'mail', 10.0, 100, '', '', 'LISgw9zf7LE', 'name', 'admin', 'success', '', '', False, False, 'per_device', 'Default Value', 10, False, False, 1, '', 15.0, '', '', 'FQrdWViuC5U', \"results['result']\", False, False, 10, '', 0, '709f9a8f-efab-46dd-811e-dcdc4cfe8637', '', 'Definition', False, False, False, 0.1, False, False, '', '', False, None, True, 'admin', '', 'ssh jump_server_IP', 'device', '', 'device', 15])","definition":"Definition","reserved":false,"impacting":true,"completion_time":1,"default_uuid":"709f9a8f-efab-46dd-811e-dcdc4cfe8637","mandatory_parameter":"Default Value","admin_only":false,"credentials":"device","custom_username":"","custom_password":"","start_new_connection":false,"connection_name":"default","close_connection":false,"enable_mode":true,"config_mode":false,"commands":"show users","jinja2_template":false,"results_as_list":false,"driver":"device","use_textfsm":false,"use_genie":false,"read_timeout":10.0,"conn_timeout":10.0,"auth_timeout":0.0,"banner_timeout":15.0,"global_delay_factor":0.1,"expect_string":"","config_mode_command":"","auto_find_prompt":true,"strip_prompt":true,"strip_command":true,"jump_on_connect":false,"jump_command":"ssh jump_server_IP","jump_username":"","jump_password":"","exit_command":"exit","expect_username_prompt":"username:","expect_password_prompt":"password","expect_prompt":"admin.*$"},{"persistent_id":"VwUIAoNDvo0","name":"[(R) Function: get_connection] Open special connection","creator":"admin","soft_deleted":false,"shared":false,"scoped_name":"Open special connection","creation_time":"","last_modified":"2022-11-09 01:23:33.543448","last_modified_by":"admin","last_run":"","version":"","description":"","priority":10,"number_of_retries":0,"time_between_retries":10,"max_number_of_retries":100,"credential_type":"any","disable_result_creation":false,"restrict_to_owners":[],"vendor":"","operating_system":"","dry_run":false,"waiting_time":0,"device_query":"","device_query_property":"name","update_target_pools":false,"update_pools_after_running":false,"report":"","report_format":"text","report_jinja2_template":false,"disabled":false,"disabled_info":"","display_report":false,"email_report":false,"send_notification":false,"send_notification_method":"mail","notification_header":"","display_only_failed_nodes":false,"include_device_results":false,"include_link_in_summary":false,"mail_recipient":"","mail_subject":"","mail_sender":"","mail_bcc":"","reply_to":"","initial_payload":{},"mandatory_parametrization":false,"parameterized_form":"name = StringField('Name', [InputRequired()])\ninitial_payload = DictField()\ntarget_devices = MultipleInstanceField('Devices', model='device')\ntarget_pools = MultipleInstanceField('Pools', model='pool')\ndevice_query = StringField('Device Query', python=True, widget=TextArea(), render_kw={'rows': 2})\ndevice_query_property = SelectField('Query Property Type', choices=(('name', 'Name'), ('ip_address', 'IP address')))\nmultiprocessing = BooleanField('Multiprocessing', default=False)\nmax_processes = IntegerField('Maximum number of processes', default=15)","parameterized_form_template":"","skip":{},"skip_query":"","skip_value":"success","iteration_values":"","iteration_variable_name":"iteration_value","iteration_devices":"","iteration_devices_property":"name","preprocessing":"","postprocessing":"","postprocessing_mode":"success","builder_link":"FQrdWViuC5U","log_level":1,"show_user_logs":true,"maximum_runs":1,"multiprocessing":false,"max_processes":15,"validation_condition":"none","conversion_method":"none","validation_method":"text","validation_section":"results['result']","content_match":"","content_match_regex":false,"dict_match":{},"negative_logic":false,"delete_spaces_before_matching":false,"run_method":"per_device","serialized":"dict_values(['', True, 0.0, 'name', True, 'admin.*$', False, '', False, '', False, None, 1, '', '2022-11-09 01:23:33.543448', False, None, '', {}, False, \"name = StringField('Name', [InputRequired()])\\ninitial_payload = DictField()\\ntarget_devices = MultipleInstanceField('Devices', model='device')\\ntarget_pools = MultipleInstanceField('Pools', model='pool')\\ndevice_query = StringField('Device Query', python=True, widget=TextArea(), render_kw={'rows': 2})\\ndevice_query_property = SelectField('Query Property Type', choices=(('name', 'Name'), ('ip_address', 'IP address')))\\nmultiprocessing = BooleanField('Multiprocessing', default=False)\\nmax_processes = IntegerField('Maximum number of processes', default=15)\", 'text', 'special', True, 'password', '', False, False, '', 'iteration_value', False, 'exit', '', 'none', '', True, '[(R) Function: get_connection] Open special connection', 'username:', False, {}, 'Open special connection', False, {}, 1, 'netmiko_commands_service', None, 0, 'show users', '', [], '', 'success', '', True, 10.0, False, False, None, 'any', 'text', False, False, 'none', False, '', False, 'mail', 10.0, 100, '', '', 'VwUIAoNDvo0', 'name', 'admin', 'success', '', '', False, False, 'per_device', 'Default Value', 10, False, False, 1, '', 15.0, '', '', 'FQrdWViuC5U', \"results['result']\", False, False, 10, '', 0, '709f9a8f-efab-46dd-811e-dcdc4cfe8637', '', 'Definition', False, False, False, 0.1, False, False, '', '', False, None, True, 'admin', '', 'ssh jump_server_IP', 'device', '', 'device', 15])","definition":"Definition","reserved":false,"impacting":true,"completion_time":1,"default_uuid":"709f9a8f-efab-46dd-811e-dcdc4cfe8637","mandatory_parameter":"Default Value","admin_only":false,"credentials":"device","custom_username":"","custom_password":"","start_new_connection":false,"connection_name":"special","close_connection":false,"enable_mode":true,"config_mode":false,"commands":"show users","jinja2_template":false,"results_as_list":false,"driver":"device","use_textfsm":false,"use_genie":false,"read_timeout":10.0,"conn_timeout":10.0,"auth_timeout":0.0,"banner_timeout":15.0,"global_delay_factor":0.1,"expect_string":"","config_mode_command":"","auto_find_prompt":true,"strip_prompt":true,"strip_command":true,"jump_on_connect":false,"jump_command":"ssh jump_server_IP","jump_username":"","jump_password":"","exit_command":"exit","expect_username_prompt":"username:","expect_password_prompt":"password","expect_prompt":"admin.*$"},{"persistent_id":"Fb_G1kV7rtY","name":"[(R) Named Credential Mechanism] Netmiko - show run -","creator":"admin","soft_deleted":false,"shared":false,"scoped_name":"Netmiko - show run -","creation_time":"","last_modified":"2022-11-13 03:02:56.173550","last_modified_by":"admin","last_run":"","version":"","description":"","priority":10,"number_of_retries":0,"time_between_retries":10,"max_number_of_retries":100,"credential_type":"any","disable_result_creation":false,"restrict_to_owners":[],"vendor":"","operating_system":"","dry_run":false,"waiting_time":0,"device_query":"","device_query_property":"name","update_target_pools":false,"update_pools_after_running":false,"report":"","report_format":"text","report_jinja2_template":false,"disabled":false,"disabled_info":"","display_report":false,"email_report":false,"send_notification":false,"send_notification_method":"mail","notification_header":"","display_only_failed_nodes":false,"include_device_results":false,"include_link_in_summary":false,"mail_recipient":"","mail_subject":"","mail_sender":"","mail_bcc":"","reply_to":"","initial_payload":{},"mandatory_parametrization":false,"parameterized_form":"name = StringField('Name', [InputRequired()])\ninitial_payload = DictField()\ntarget_devices = MultipleInstanceField('Devices', model='device')\ntarget_pools = MultipleInstanceField('Pools', model='pool')\ndevice_query = StringField('Device Query', python=True, widget=TextArea(), render_kw={'rows': 2})\ndevice_query_property = SelectField('Query Property Type', choices=(('name', 'Name'), ('ip_address', 'IP address')))\nmultiprocessing = BooleanField('Multiprocessing', default=False)\nmax_processes = IntegerField('Maximum number of processes', default=15)","parameterized_form_template":"","skip":{},"skip_query":"","skip_value":"success","iteration_values":"","iteration_variable_name":"iteration_value","iteration_devices":"","iteration_devices_property":"name","preprocessing":"","postprocessing":"","postprocessing_mode":"success","builder_link":"xVTePa4_G9E","log_level":1,"show_user_logs":true,"maximum_runs":1,"multiprocessing":false,"max_processes":15,"validation_condition":"none","conversion_method":"none","validation_method":"text","validation_section":"results['result']","content_match":"","content_match_regex":false,"dict_match":{},"negative_logic":false,"delete_spaces_before_matching":false,"run_method":"per_device","serialized":"dict_values(['', True, 0.0, 'name', True, 'admin.*$', False, '', False, '', False, None, 1, '', '2022-11-13 03:02:56.173550', False, None, '', {}, False, \"name = StringField('Name', [InputRequired()])\\ninitial_payload = DictField()\\ntarget_devices = MultipleInstanceField('Devices', model='device')\\ntarget_pools = MultipleInstanceField('Pools', model='pool')\\ndevice_query = StringField('Device Query', python=True, widget=TextArea(), render_kw={'rows': 2})\\ndevice_query_property = SelectField('Query Property Type', choices=(('name', 'Name'), ('ip_address', 'IP address')))\\nmultiprocessing = BooleanField('Multiprocessing', default=False)\\nmax_processes = IntegerField('Maximum number of processes', default=15)\", 'text', 'default', True, 'password', '', False, False, '', 'iteration_value', False, 'exit', '', 'none', '', True, '[(R) Named Credential Mechanism] Netmiko - show run -', 'username:', False, {}, 'Netmiko - show run -', False, {}, 1, 'netmiko_commands_service', None, 0, 'show run', '', [], '', 'success', '', True, 10.0, False, False, None, 'any', 'text', False, False, 'none', False, '', False, 'mail', 10.0, 100, '', '', 'Fb_G1kV7rtY', 'name', 'admin', 'success', '', '', False, False, 'per_device', 'Default Value', 10, False, False, 1, '', 15.0, '', '', 'xVTePa4_G9E', \"results['result']\", False, False, 10, '', 0, 'f8c35f73-8f4c-42fb-bfb0-8f0c14087a25', '', 'Definition', False, False, False, 0.1, False, False, '', '', False, None, True, 'admin', '', 'ssh jump_server_IP', 'device', '', 'object', 15])","definition":"Definition","reserved":false,"impacting":true,"completion_time":1,"default_uuid":"f8c35f73-8f4c-42fb-bfb0-8f0c14087a25","mandatory_parameter":"Default Value","admin_only":false,"credentials":"object","custom_username":"","custom_password":"","start_new_connection":false,"connection_name":"default","close_connection":false,"enable_mode":true,"config_mode":false,"commands":"show run","jinja2_template":false,"results_as_list":false,"driver":"device","use_textfsm":false,"use_genie":false,"read_timeout":10.0,"conn_timeout":10.0,"auth_timeout":0.0,"banner_timeout":15.0,"global_delay_factor":0.1,"expect_string":"","config_mode_command":"","auto_find_prompt":true,"strip_prompt":true,"strip_command":true,"jump_on_connect":false,"jump_command":"ssh jump_server_IP","jump_username":"","jump_password":"","exit_command":"exit","expect_username_prompt":"username:","expect_password_prompt":"password","expect_prompt":"admin.*$"},{"persistent_id":"IYfXb0nrRy4","name":"[Dry Run: Netmiko Services] Commands","creator":"admin","soft_deleted":false,"shared":false,"scoped_name":"Commands","creation_time":"","last_modified":"2024-02-06 01:09:34.547233","last_modified_by":"admin","last_run":"","version":"","description":"","priority":10,"number_of_retries":0,"time_between_retries":10,"max_number_of_retries":100,"credential_type":"any","disable_result_creation":false,"restrict_to_owners":[],"vendor":"","operating_system":"","dry_run":true,"waiting_time":0,"device_query":"","device_query_property":"name","update_target_pools":false,"update_pools_after_running":false,"report":"","report_format":"text","report_jinja2_template":false,"disabled":false,"disabled_info":"","display_report":false,"email_report":false,"send_notification":false,"send_notification_method":"mail","notification_header":"","display_only_failed_nodes":false,"include_device_results":false,"include_link_in_summary":false,"mail_recipient":"","mail_subject":"","mail_sender":"","mail_bcc":"","reply_to":"","initial_payload":{},"mandatory_parametrization":false,"parameterized_form":"name = StringField('Name', [InputRequired()])\ninitial_payload = DictField()\ntarget_devices = MultipleInstanceField('Devices', model='device')\ntarget_pools = MultipleInstanceField('Pools', model='pool')\ndevice_query = StringField('Device Query', python=True, widget=TextArea(), render_kw={'rows': 2})\ndevice_query_property = SelectField('Query Property Type', choices=(('name', 'Name'), ('ip_address', 'IP address')))\nmultiprocessing = BooleanField('Multiprocessing', default=False)\nmax_processes = IntegerField('Maximum number of processes', default=15)","parameterized_form_template":"","skip":{},"skip_query":"","skip_value":"success","iteration_values":"","iteration_variable_name":"iteration_value","iteration_devices":"","iteration_devices_property":"name","preprocessing":"","postprocessing":"","postprocessing_mode":"success","builder_link":"PblTtswsUWQ","log_level":1,"show_user_logs":true,"maximum_runs":1,"multiprocessing":false,"max_processes":15,"validation_condition":"none","conversion_method":"none","validation_method":"text","validation_section":"results['result']","content_match":"","content_match_regex":false,"dict_match":{},"negative_logic":false,"delete_spaces_before_matching":false,"run_method":"per_device","serialized":"dict_values(['', True, 0.0, 'name', True, 'admin.*$', False, '', False, '', False, None, 1, '', '2024-02-06 01:09:34.547233', False, None, '', {}, False, \"name = StringField('Name', [InputRequired()])\\ninitial_payload = DictField()\\ntarget_devices = MultipleInstanceField('Devices', model='device')\\ntarget_pools = MultipleInstanceField('Pools', model='pool')\\ndevice_query = StringField('Device Query', python=True, widget=TextArea(), render_kw={'rows': 2})\\ndevice_query_property = SelectField('Query Property Type', choices=(('name', 'Name'), ('ip_address', 'IP address')))\\nmultiprocessing = BooleanField('Multiprocessing', default=False)\\nmax_processes = IntegerField('Maximum number of processes', default=15)\", 'text', 'default', True, 'password', '', False, False, '', 'iteration_value', False, 'exit', '', 'none', '', True, '[Dry Run: Netmiko Services] Commands', 'username:', False, {}, 'Commands', False, {}, 1, 'netmiko_commands_service', None, 0, 'test command {{ user[\"name\"] }}\\ntest trigger {{ trigger }}', '', [], '', 'success', '', True, 10.0, False, False, None, 'any', 'text', False, False, 'none', False, '', False, 'mail', 10.0, 100, '', '', 'IYfXb0nrRy4', 'name', 'admin', 'success', '', '', False, False, 'per_device', 'Default Value', 10, False, False, 1, '', 15.0, '', '', 'PblTtswsUWQ', \"results['result']\", True, False, 10, '', 0, '01bd498f-09c5-4b6c-82cc-27ea88598d78', '', 'Definition', False, False, False, 0.1, False, False, '', '', False, None, True, 'admin', '', 'ssh jump_server_IP', 'device', '', 'device', 15])","definition":"Definition","reserved":false,"impacting":true,"completion_time":1,"default_uuid":"01bd498f-09c5-4b6c-82cc-27ea88598d78","mandatory_parameter":"Default Value","admin_only":false,"credentials":"device","custom_username":"","custom_password":"","start_new_connection":false,"connection_name":"default","close_connection":false,"enable_mode":true,"config_mode":false,"commands":"test command {{ user[\"name\"] }}\ntest trigger {{ trigger }}","jinja2_template":false,"results_as_list":false,"driver":"device","use_textfsm":false,"use_genie":false,"read_timeout":10.0,"conn_timeout":10.0,"auth_timeout":0.0,"banner_timeout":15.0,"global_delay_factor":0.1,"expect_string":"","config_mode_command":"","auto_find_prompt":true,"strip_prompt":true,"strip_command":true,"jump_on_connect":false,"jump_command":"ssh jump_server_IP","jump_username":"","jump_password":"","exit_command":"exit","expect_username_prompt":"username:","expect_password_prompt":"password","expect_prompt":"admin.*$"},{"persistent_id":"hbYgBscr2yI","name":"[(R) Dry Run: Results modified in Postprocessing] Show Configuration","creator":"admin","soft_deleted":false,"shared":false,"scoped_name":"Show Configuration","creation_time":"","last_modified":"2024-02-13 06:53:50.633484","last_modified_by":"admin","last_run":"","version":"","description":"","priority":10,"number_of_retries":0,"time_between_retries":10,"max_number_of_retries":100,"credential_type":"any","disable_result_creation":false,"restrict_to_owners":[],"vendor":"","operating_system":"","dry_run":false,"waiting_time":0,"device_query":"","device_query_property":"name","update_target_pools":false,"update_pools_after_running":false,"report":"","report_format":"text","report_jinja2_template":false,"disabled":false,"disabled_info":"","display_report":false,"email_report":false,"send_notification":false,"send_notification_method":"mail","notification_header":"","display_only_failed_nodes":false,"include_device_results":false,"include_link_in_summary":false,"mail_recipient":"","mail_subject":"","mail_sender":"","mail_bcc":"","reply_to":"","initial_payload":{},"mandatory_parametrization":false,"parameterized_form":"name = StringField('Name', [InputRequired()])\ninitial_payload = DictField()\ntarget_devices = MultipleInstanceField('Devices', model='device')\ntarget_pools = MultipleInstanceField('Pools', model='pool')\ndevice_query = StringField('Device Query', python=True, widget=TextArea(), render_kw={'rows': 2})\ndevice_query_property = SelectField('Query Property Type', choices=(('name', 'Name'), ('ip_address', 'IP address')))\nmultiprocessing = BooleanField('Multiprocessing', default=False)\nmax_processes = IntegerField('Maximum number of processes', default=15)","parameterized_form_template":"","skip":{},"skip_query":"","skip_value":"success","iteration_values":"","iteration_variable_name":"iteration_value","iteration_devices":"","iteration_devices_property":"name","preprocessing":"","postprocessing":"if dry_run:\n  results[\"result\"] = \"! Command: show running-config\\ n! device: localhost (vEOS, EOS-4.23.1F)\\n!\\n! boot system flash:/vEOS-lab.swi\\ n!\\ntransceiver qsfp default-mode 4x10G\\n!\\nspanning-tree mode mstp\\n!\\naaa authorization exec default local\\n!\\nno aaa root\\n!\\nusername admin privilege 15 role network-admin secret sha512 $6$ShuyKzG/D1oOik78$rv5.M/fskKvrpPT9gntdwDlBSA9KUgsXhmjWTJZNobffvOK30/IpWhxVM7GEW6/Qtm1YUe2yvtLDgBLVvAb8R.\\ nusername sammy privilege 15 secret sha512 $6$SNpEccP107A7vx7/$dPsdkT.dmBwwumIgqAjXE4zbAr16xf/mT18FYQtkQlNBm64mOfhBnWhU7uuJzxmagVxPX2NkdQRgNzMzNQbEl.\\ nusername sammy ssh-key ssh-rsa AAAAB3NzaC1yc2EAAAADAQABAAACAQC4FS4+zPbd/49klI0czCDu6gHZRsSN4XOnEz0lfKNc2QE2s3/fH9Pgi1Zl7ByXInMWFfZ+ZWNgVgEhMSijFq7y8cOB6P+3jCeVz/6QLD9UN6jMz2pPI5azs2PQ0pbrSr0AMmHlru9ex1t0xgKiMRE85O3HpJWAkL14j//EXRV1HURwbU2mapkRR47Dl0DR4khuSYUMoYuGD8g8knE6r/NZt+UmNTGpGKegJ6EEXdKQepKUVUwC8hnFHIG0VfD/ubUrdgjrOIa/T+3mZwqyHmOZxytQP/KZzu72SeLOzb3QJKS6VY4Okm2NngJI/W7UbvnNaHnREkeA/27H5keuIUjbRBHBqiepxjK3UTJ0JVxXKuMlkOdTh8SnWdXKm0nZR66sc+lOBhRjz8pMxRKA3PiPoY1N41SYB+duIQUH19JcYVEbOAMyV2no3om6MtRrMzd3/SVNwRfiZIFsesydHNKap0iBczCt1gOEByOUwIvLEeE1hUb8JXSGD7g/1fnaBnpoqo/Q72Suur34NYMy9/6d5qZv+UKcDf2h0YD+PdirrmWcTeCaW13Z4fXY5dUIsKKTM3M+QuX/e6J/ooRX0qpm0GhhT1+yK4SJxyWbxBwoxzhqhWE3b4qWNcoRlMJWnln1gmzvYvCx3bihZaQGRcsce6DJGVhBYP+/VHvl6Q+LBw== email@email.com\\n!\\nvrf instance napalm\\n!\\nvrf instance test\\n!\\ninterface Loopback1\\n   ip address 1.1.1.1/32\\n!\\ninterface Loopback2\\n   ip address 2.2.2.2/32\\n!\\ninterface Loopback3\\n   ip address 3.3.3.3/32\\n!\\ninterface Loopback4\\n!\\ninterface Loopback5\\n!\\ninterface Management1\\n   ip address 192.168.56.51/24\\n!\\nno ip routing\\nno ip routing vrf napalm\\nno ip routing vrf test\\n!\\nmanagement api http-commands\\n   no shutdown\\n!\\nmanagement api netconf\\n   transport ssh def\\n!\\nmanagement telnet\\n   no shutdown\\n!\\nend\"","postprocessing_mode":"success","builder_link":"6eCKSkMmQXg","log_level":1,"show_user_logs":true,"maximum_runs":1,"multiprocessing":false,"max_processes":15,"validation_condition":"none","conversion_method":"none","validation_method":"text","validation_section":"results['result']","content_match":"","content_match_regex":false,"dict_match":{},"negative_logic":false,"delete_spaces_before_matching":false,"run_method":"per_device","serialized":"dict_values(['', True, 0.0, 'name', True, 'admin.*$', False, 'if dry_run:\\n  results[\"result\"] = \"! Command: show running-config\\\\ n! device: localhost (vEOS, EOS-4.23.1F)\\\\n!\\\\n! boot system flash:/vEOS-lab.swi\\\\ n!\\\\ntransceiver qsfp default-mode 4x10G\\\\n!\\\\nspanning-tree mode mstp\\\\n!\\\\naaa authorization exec default local\\\\n!\\\\nno aaa root\\\\n!\\\\nusername admin privilege 15 role network-admin secret sha512 $6$ShuyKzG/D1oOik78$rv5.M/fskKvrpPT9gntdwDlBSA9KUgsXhmjWTJZNobffvOK30/IpWhxVM7GEW6/Qtm1YUe2yvtLDgBLVvAb8R.\\\\ nusername sammy privilege 15 secret sha512 $6$SNpEccP107A7vx7/$dPsdkT.dmBwwumIgqAjXE4zbAr16xf/mT18FYQtkQlNBm64mOfhBnWhU7uuJzxmagVxPX2NkdQRgNzMzNQbEl.\\\\ nusername sammy ssh-key ssh-rsa AAAAB3NzaC1yc2EAAAADAQABAAACAQC4FS4+zPbd/49klI0czCDu6gHZRsSN4XOnEz0lfKNc2QE2s3/fH9Pgi1Zl7ByXInMWFfZ+ZWNgVgEhMSijFq7y8cOB6P+3jCeVz/6QLD9UN6jMz2pPI5azs2PQ0pbrSr0AMmHlru9ex1t0xgKiMRE85O3HpJWAkL14j//EXRV1HURwbU2mapkRR47Dl0DR4khuSYUMoYuGD8g8knE6r/NZt+UmNTGpGKegJ6EEXdKQepKUVUwC8hnFHIG0VfD/ubUrdgjrOIa/T+3mZwqyHmOZxytQP/KZzu72SeLOzb3QJKS6VY4Okm2NngJI/W7UbvnNaHnREkeA/27H5keuIUjbRBHBqiepxjK3UTJ0JVxXKuMlkOdTh8SnWdXKm0nZR66sc+lOBhRjz8pMxRKA3PiPoY1N41SYB+duIQUH19JcYVEbOAMyV2no3om6MtRrMzd3/SVNwRfiZIFsesydHNKap0iBczCt1gOEByOUwIvLEeE1hUb8JXSGD7g/1fnaBnpoqo/Q72Suur34NYMy9/6d5qZv+UKcDf2h0YD+PdirrmWcTeCaW13Z4fXY5dUIsKKTM3M+QuX/e6J/ooRX0qpm0GhhT1+yK4SJxyWbxBwoxzhqhWE3b4qWNcoRlMJWnln1gmzvYvCx3bihZaQGRcsce6DJGVhBYP+/VHvl6Q+LBw== email@email.com\\\\n!\\\\nvrf instance napalm\\\\n!\\\\nvrf instance test\\\\n!\\\\ninterface Loopback1\\\\n   ip address 1.1.1.1/32\\\\n!\\\\ninterface Loopback2\\\\n   ip address 2.2.2.2/32\\\\n!\\\\ninterface Loopback3\\\\n   ip address 3.3.3.3/32\\\\n!\\\\ninterface Loopback4\\\\n!\\\\ninterface Loopback5\\\\n!\\\\ninterface Management1\\\\n   ip address 192.168.56.51/24\\\\n!\\\\nno ip routing\\\\nno ip routing vrf napalm\\\\nno ip routing vrf test\\\\n!\\\\nmanagement api http-commands\\\\n   no shutdown\\\\n!\\\\nmanagement api netconf\\\\n   transport ssh def\\\\n!\\\\nmanagement telnet\\\\n   no shutdown\\\\n!\\\\nend\"', False, '', False, None, 1, '', '2024-02-13 06:53:50.633484', False, None, '', {}, False, \"name = StringField('Name', [InputRequired()])\\ninitial_payload = DictField()\\ntarget_devices = MultipleInstanceField('Devices', model='device')\\ntarget_pools = MultipleInstanceField('Pools', model='pool')\\ndevice_query = StringField('Device Query', python=True, widget=TextArea(), render_kw={'rows': 2})\\ndevice_query_property = SelectField('Query Property Type', choices=(('name', 'Name'), ('ip_address', 'IP address')))\\nmultiprocessing = BooleanField('Multiprocessing', default=False)\\nmax_processes = IntegerField('Maximum number of processes', default=15)\", 'text', 'default', True, 'password', '', False, False, '', 'iteration_value', False, 'exit', '', 'none', '', True, '[(R) Dry Run: Results modified in Postprocessing] Show Configuration', 'username:', False, {}, 'Show Configuration', False, {}, 1, 'netmiko_commands_service', None, 0, 'show run', '', [], '', 'success', '', True, 10.0, False, False, None, 'any', 'text', False, False, 'none', False, '', False, 'mail', 10.0, 100, '', '', 'hbYgBscr2yI', 'name', 'admin', 'success', '', '', False, False, 'per_device', 'Default Value', 10, False, False, 1, '', 15.0, '', '', '6eCKSkMmQXg', \"results['result']\", False, False, 10, '', 0, '6e6584ad-6755-42e6-a84e-ab606574db22', '', 'Definition', False, False, False, 0.1, False, False, '', '', False, None, True, 'admin', '', 'ssh jump_server_IP', 'device', '', 'device', 15])","definition":"Definition","reserved":false,"impacting":true,"completion_time":1,"default_uuid":"6e6584ad-6755-42e6-a84e-ab606574db22","mandatory_parameter":"Default Value","admin_only":false,"credentials":"device","custom_username":"","custom_password":"","start_new_connection":false,"connection_name":"default","close_connection":false,"enable_mode":true,"config_mode":false,"commands":"show run","jinja2_template":false,"results_as_list":false,"driver":"device","use_textfsm":false,"use_genie":false,"read_timeout":10.0,"conn_timeout":10.0,"auth_timeout":0.0,"banner_timeout":15.0,"global_delay_factor":0.1,"expect_string":"","config_mode_command":"","auto_find_prompt":true,"strip_prompt":true,"strip_command":true,"jump_on_connect":false,"jump_command":"ssh jump_server_IP","jump_username":"","jump_password":"","exit_command":"exit","expect_username_prompt":"username:","expect_password_prompt":"password","expect_prompt":"admin.*$"},{"persistent_id":"SkRk5y82GI4","name":"[Dry Run: Parameterized Form Dry Run] Show Run","creator":"admin","soft_deleted":false,"shared":false,"scoped_name":"Show Run","creation_time":"","last_modified":"2024-03-13 01:49:43.496196","last_modified_by":"admin","last_run":"","version":"","description":"","priority":10,"number_of_retries":0,"time_between_retries":10,"max_number_of_retries":100,"credential_type":"any","disable_result_creation":false,"restrict_to_owners":[],"vendor":"","operating_system":"","dry_run":false,"waiting_time":0,"device_query":"","device_query_property":"name","update_target_pools":false,"update_pools_after_running":false,"report":"","report_format":"text","report_jinja2_template":false,"disabled":false,"disabled_info":"","display_report":false,"email_report":false,"send_notification":false,"send_notification_method":"mail","notification_header":"","display_only_failed_nodes":false,"include_device_results":false,"include_link_in_summary":false,"mail_recipient":"","mail_subject":"","mail_sender":"","mail_bcc":"","reply_to":"","initial_payload":{},"mandatory_parametrization":false,"parameterized_form":"name = StringField('Name', [InputRequired()])\ninitial_payload = DictField()\ntarget_devices = MultipleInstanceField('Devices', model='device')\ntarget_pools = MultipleInstanceField('Pools', model='pool')\ndevice_query = StringField('Device Query', python=True, widget=TextArea(), render_kw={'rows': 2})\ndevice_query_property = SelectField('Query Property Type', choices=(('name', 'Name'), ('ip_address', 'IP address')))\nmultiprocessing = BooleanField('Multiprocessing', default=False)\nmax_processes = IntegerField('Maximum number of processes', default=15)","parameterized_form_template":"","skip":{},"skip_query":"","skip_value":"success","iteration_values":"","iteration_variable_name":"iteration_value","iteration_devices":"","iteration_devices_property":"name","preprocessing":"","postprocessing":"","postprocessing_mode":"success","builder_link":"1VBGT6ATtvA","log_level":1,"show_user_logs":true,"maximum_runs":1,"multiprocessing":false,"max_processes":15,"validation_condition":"none","conversion_method":"none","validation_method":"text","validation_section":"results['result']","content_match":"","content_match_regex":false,"dict_match":{},"negative_logic":false,"delete_spaces_before_matching":false,"run_method":"per_device","serialized":"dict_values(['', True, 0.0, 'name', True, 'admin.*$', False, '', False, '', False, None, 1, '', '2024-03-13 01:49:43.496196', False, None, '', {}, False, \"name = StringField('Name', [InputRequired()])\\ninitial_payload = DictField()\\ntarget_devices = MultipleInstanceField('Devices', model='device')\\ntarget_pools = MultipleInstanceField('Pools', model='pool')\\ndevice_query = StringField('Device Query', python=True, widget=TextArea(), render_kw={'rows': 2})\\ndevice_query_property = SelectField('Query Property Type', choices=(('name', 'Name'), ('ip_address', 'IP address')))\\nmultiprocessing = BooleanField('Multiprocessing', default=False)\\nmax_processes = IntegerField('Maximum number of processes', default=15)\", 'text', 'default', True, 'password', '', False, False, '', 'iteration_value', False, 'exit', '', 'none', '', True, '[Dry Run: Parameterized Form Dry Run] Show Run', 'username:', False, {}, 'Show Run', False, {}, 1, 'netmiko_commands_service', None, 0, 'show run', '', [], '', 'success', '', True, 10.0, False, False, None, 'any', 'text', False, False, 'none', False, '', False, 'mail', 10.0, 100, '', '', 'SkRk5y82GI4', 'name', 'admin', 'success', '', '', False, False, 'per_device', 'Default Value', 10, False, False, 1, '', 15.0, '', '', '1VBGT6ATtvA', \"results['result']\", False, False, 10, '', 0, '04779053-29b9-4126-bc9c-ec814168e802', '', 'Definition', False, False, False, 0.1, False, False, '', '', False, None, True, 'admin', '', 'ssh jump_server_IP', 'device', '', 'device', 15])","definition":"Definition","reserved":false,"impacting":true,"completion_time":1,"default_uuid":"04779053-29b9-4126-bc9c-ec814168e802","mandatory_parameter":"Default Value","admin_only":false,"credentials":"device","custom_username":"","custom_password":"","start_new_connection":false,"connection_name":"default","close_connection":false,"enable_mode":true,"config_mode":false,"commands":"show run","jinja2_template":false,"results_as_list":false,"driver":"device","use_textfsm":false,"use_genie":false,"read_timeout":10.0,"conn_timeout":10.0,"auth_timeout":0.0,"banner_timeout":15.0,"global_delay_factor":0.1,"expect_string":"","config_mode_command":"","auto_find_prompt":true,"strip_prompt":true,"strip_command":true,"jump_on_connect":false,"jump_command":"ssh jump_server_IP","jump_username":"","jump_password":"","exit_command":"exit","expect_username_prompt":"username:","expect_password_prompt":"password","expect_prompt":"admin.*$"},{"persistent_id":"r6NemFRFHKU","name":"[(R) Netmiko Configuration with Jinja2 template] Check VRF not configured","creator":"admin","soft_deleted":false,"shared":false,"scoped_name":"Check VRF not configured","creation_time":"","last_modified":"2024-12-26 15:36:54.324706","last_modified_by":"admin","last_run":"","version":"","description":"","priority":10,"number_of_retries":0,"time_between_retries":10,"max_number_of_retries":100,"credential_type":"any","disable_result_creation":false,"restrict_to_owners":[],"vendor":"","operating_system":"EOS","dry_run":false,"waiting_time":0,"device_query":"","device_query_property":"name","update_target_pools":false,"update_pools_after_running":false,"report":"","report_format":"text","report_jinja2_template":false,"disabled":false,"disabled_info":"","display_report":false,"email_report":false,"send_notification":false,"send_notification_method":"mail","notification_header":"","display_only_failed_nodes":false,"include_device_results":false,"include_link_in_summary":false,"mail_recipient":"","mail_subject":"","mail_sender":"","mail_bcc":"","reply_to":"","initial_payload":{},"mandatory_parametrization":false,"parameterized_form":"name = StringField('Name', [InputRequired()])\r\ninitial_payload = DictField()\r\ntarget_devices = MultipleInstanceField('Devices', model='device')\r\ntarget_pools = MultipleInstanceField('Pools', model='pool')\r\ndevice_query = StringField('Device Query', python=True, widget=TextArea(), render_kw={'rows': 2})\r\ndevice_query_property = SelectField('Query Property Type', choices=(('name', 'Name'), ('ip_address', 'IP address')))\r\nmultiprocessing = BooleanField('Multiprocessing', default=False)\r\nmax_processes = IntegerField('Maximum number of processes', default=15)","parameterized_form_template":"","skip":{},"skip_query":"","skip_value":"success","iteration_values":"","iteration_variable_name":"iteration_value","iteration_devices":"","iteration_devices_property":"name","preprocessing":"","postprocessing":"results[\"success\"] = all(f\"vrf-jinja-{x}\" not in results[\"result\"] for x in range(1, 5))","postprocessing_mode":"success","builder_link":"Lx6t8GEo458","log_level":1,"show_user_logs":true,"maximum_runs":1,"multiprocessing":false,"max_processes":15,"validation_condition":"none","conversion_method":"none","validation_method":"text","validation_section":"results['result']","content_match":"","content_match_regex":false,"dict_match":{},"negative_logic":false,"delete_spaces_before_matching":false,"run_method":"per_device","serialized":"dict_values(['', True, 0.0, 'name', True, 'admin.*$', False, 'results[\"success\"] = all(f\"vrf-jinja-{x}\" not in results[\"result\"] for x in range(1, 5))', False, '', False, None, 1, '', '2024-12-26 15:36:54.324706', False, None, '', {}, False, \"name = StringField('Name', [InputRequired()])\\r\\ninitial_payload = DictField()\\r\\ntarget_devices = MultipleInstanceField('Devices', model='device')\\r\\ntarget_pools = MultipleInstanceField('Pools', model='pool')\\r\\ndevice_query = StringField('Device Query', python=True, widget=TextArea(), render_kw={'rows': 2})\\r\\ndevice_query_property = SelectField('Query Property Type', choices=(('name', 'Name'), ('ip_address', 'IP address')))\\r\\nmultiprocessing = BooleanField('Multiprocessing', default=False)\\r\\nmax_processes = IntegerField('Maximum number of processes', default=15)\", 'text', 'default', True, 'password', '', False, False, '', 'iteration_value', False, 'exit', '', 'none', '', True, '[(R) Netmiko Configuration with Jinja2 template] Check VRF not configured', 'username:', False, {}, 'Check VRF not configured', False, {}, 1, 'netmiko_commands_service', None, 0, 'show vrf', '', [], '', 'success', '', True, 10.0, False, False, None, 'any', 'text', False, False, 'none', False, '', False, 'mail', 10.0, 100, '', '', 'r6NemFRFHKU', 'name', 'admin', 'success', '', '', False, False, 'per_device', 'Default Value', 10, False, False, 1, '', 15.0, '', '', 'Lx6t8GEo458', \"results['result']\", False, False, 10, 'EOS', 0, 'd2b42abe-0275-432e-a7b4-c87b1d11dea9', '', 'Definition', False, False, False, 0.1, False, False, '', '', False, None, True, 'admin', '', 'ssh jump_server_IP', 'device', '', 'device', 15])","definition":"Definition","reserved":false,"impacting":true,"completion_time":1,"default_uuid":"d2b42abe-0275-432e-a7b4-c87b1d11dea9","mandatory_parameter":"Default Value","admin_only":false,"credentials":"device","custom_username":"","custom_password":"","start_new_connection":false,"connection_name":"default","close_connection":false,"enable_mode":true,"config_mode":false,"commands":"show vrf","jinja2_template":false,"results_as_list":false,"driver":"device","use_textfsm":false,"use_genie":false,"read_timeout":10.0,"conn_timeout":10.0,"auth_timeout":0.0,"banner_timeout":15.0,"global_delay_factor":0.1,"expect_string":"","config_mode_command":"","auto_find_prompt":true,"strip_prompt":true,"strip_command":true,"jump_on_connect":false,"jump_command":"ssh jump_server_IP","jump_username":"","jump_password":"","exit_command":"exit","expect_username_prompt":"username:","expect_password_prompt":"password","expect_prompt":"admin.*$"},{"persistent_id":"SN3Pfobsx_Y","name":"[(R) Netmiko Configuration with Jinja2 template] Check VRF configured","creator":"admin","soft_deleted":false,"shared":false,"scoped_name":"Check VRF configured","creation_time":"","last_modified":"2024-12-26 15:50:14.583618","last_modified_by":"admin","last_run":"","version":"","description":"","priority":10,"number_of_retries":0,"time_between_retries":10,"max_number_of_retries":100,"credential_type":"any","disable_result_creation":false,"restrict_to_owners":[],"vendor":"","operating_system":"EOS","dry_run":false,"waiting_time":0,"device_query":"","device_query_property":"name","update_target_pools":false,"update_pools_after_running":false,"report":"","report_format":"text","report_jinja2_template":false,"disabled":false,"disabled_info":"","display_report":false,"email_report":false,"send_notification":false,"send_notification_method":"mail","notification_header":"","display_only_failed_nodes":false,"include_device_results":false,"include_link_in_summary":false,"mail_recipient":"","mail_subject":"","mail_sender":"","mail_bcc":"","reply_to":"","initial_payload":{},"mandatory_parametrization":false,"parameterized_form":"name = StringField('Name', [InputRequired()])\r\ninitial_payload = DictField()\r\ntarget_devices = MultipleInstanceField('Devices', model='device')\r\ntarget_pools = MultipleInstanceField('Pools', model='pool')\r\ndevice_query = StringField('Device Query', python=True, widget=TextArea(), render_kw={'rows': 2})\r\ndevice_query_property = SelectField('Query Property Type', choices=(('name', 'Name'), ('ip_address', 'IP address')))\r\nmultiprocessing = BooleanField('Multiprocessing', default=False)\r\nmax_processes = IntegerField('Maximum number of processes', default=15)","parameterized_form_template":"","skip":{},"skip_query":"","skip_value":"success","iteration_values":"","iteration_variable_name":"iteration_value","iteration_devices":"","iteration_devices_property":"name","preprocessing":"","postprocessing":"results[\"success\"] = all(f\"vrf-jinja-{x}\" in results[\"result\"] for x in range(1, 5))","postprocessing_mode":"success","builder_link":"Lx6t8GEo458","log_level":1,"show_user_logs":true,"maximum_runs":1,"multiprocessing":false,"max_processes":15,"validation_condition":"none","conversion_method":"none","validation_method":"text","validation_section":"results['result']","content_match":"","content_match_regex":false,"dict_match":{},"negative_logic":false,"delete_spaces_before_matching":false,"run_method":"per_device","serialized":"dict_values(['', True, 0.0, 'name', True, 'admin.*$', False, 'results[\"success\"] = all(f\"vrf-jinja-{x}\" in results[\"result\"] for x in range(1, 5))', False, '', False, None, 1, '', '2024-12-26 15:50:14.583618', False, None, '', {}, False, \"name = StringField('Name', [InputRequired()])\\r\\ninitial_payload = DictField()\\r\\ntarget_devices = MultipleInstanceField('Devices', model='device')\\r\\ntarget_pools = MultipleInstanceField('Pools', model='pool')\\r\\ndevice_query = StringField('Device Query', python=True, widget=TextArea(), render_kw={'rows': 2})\\r\\ndevice_query_property = SelectField('Query Property Type', choices=(('name', 'Name'), ('ip_address', 'IP address')))\\r\\nmultiprocessing = BooleanField('Multiprocessing', default=False)\\r\\nmax_processes = IntegerField('Maximum number of processes', default=15)\", 'text', 'default', True, 'password', '', False, False, '', 'iteration_value', False, 'exit', '', 'none', '', True, '[(R) Netmiko Configuration with Jinja2 template] Check VRF configured', 'username:', False, {}, 'Check VRF configured', False, {}, 1, 'netmiko_commands_service', None, 0, 'show vrf', '', [], '', 'success', '', True, 10.0, False, False, None, 'any', 'text', False, False, 'none', False, '', False, 'mail', 10.0, 100, '', '', 'SN3Pfobsx_Y', 'name', 'admin', 'success', '', '', False, False, 'per_device', 'Default Value', 10, False, False, 1, '', 15.0, '', '', 'Lx6t8GEo458', \"results['result']\", False, False, 10, 'EOS', 0, '0e1936f5-44f7-48b6-bb94-8dbdaf277b5f', '', 'Definition', False, False, False, 0.1, False, False, '', '', False, None, True, 'admin', '', 'ssh jump_server_IP', 'device', '', 'device', 15])","definition":"Definition","reserved":false,"impacting":true,"completion_time":1,"default_uuid":"0e1936f5-44f7-48b6-bb94-8dbdaf277b5f","mandatory_parameter":"Default Value","admin_only":false,"credentials":"device","custom_username":"","custom_password":"","start_new_connection":false,"connection_name":"default","close_connection":false,"enable_mode":true,"config_mode":false,"commands":"show vrf","jinja2_template":false,"results_as_list":false,"driver":"device","use_textfsm":false,"use_genie":false,"read_timeout":10.0,"conn_timeout":10.0,"auth_timeout":0.0,"banner_timeout":15.0,"global_delay_factor":0.1,"expect_string":"","config_mode_command":"","auto_find_prompt":true,"strip_prompt":true,"strip_command":true,"jump_on_connect":false,"jump_command":"ssh jump_server_IP","jump_username":"","jump_password":"","exit_command":"exit","expect_username_prompt":"username:","expect_password_prompt":"password","expect_prompt":"admin.*$"},{"persistent_id":"-OkeEhqllzU","name":"[(R) Netmiko Configuration with Jinja2 template] Check VRF deleted","creator":"admin","soft_deleted":false,"shared":false,"scoped_name":"Check VRF deleted","creation_time":"","last_modified":"2024-12-26 15:57:21.103891","last_modified_by":"admin","last_run":"","version":"","description":"","priority":10,"number_of_retries":0,"time_between_retries":10,"max_number_of_retries":100,"credential_type":"any","disable_result_creation":false,"restrict_to_owners":[],"vendor":"","operating_system":"EOS","dry_run":false,"waiting_time":0,"device_query":"","device_query_property":"name","update_target_pools":false,"update_pools_after_running":false,"report":"","report_format":"text","report_jinja2_template":false,"disabled":false,"disabled_info":"","display_report":false,"email_report":false,"send_notification":false,"send_notification_method":"mail","notification_header":"","display_only_failed_nodes":false,"include_device_results":false,"include_link_in_summary":false,"mail_recipient":"","mail_subject":"","mail_sender":"","mail_bcc":"","reply_to":"","initial_payload":{},"mandatory_parametrization":false,"parameterized_form":"name = StringField('Name', [InputRequired()])\r\ninitial_payload = DictField()\r\ntarget_devices = MultipleInstanceField('Devices', model='device')\r\ntarget_pools = MultipleInstanceField('Pools', model='pool')\r\ndevice_query = StringField('Device Query', python=True, widget=TextArea(), render_kw={'rows': 2})\r\ndevice_query_property = SelectField('Query Property Type', choices=(('name', 'Name'), ('ip_address', 'IP address')))\r\nmultiprocessing = BooleanField('Multiprocessing', default=False)\r\nmax_processes = IntegerField('Maximum number of processes', default=15)","parameterized_form_template":"","skip":{},"skip_query":"","skip_value":"success","iteration_values":"","iteration_variable_name":"iteration_value","iteration_devices":"","iteration_devices_property":"name","preprocessing":"","postprocessing":"results[\"success\"] = all(f\"vrf-jinja-{x}\" not in results[\"result\"] for x in range(1, 5))","postprocessing_mode":"success","builder_link":"Lx6t8GEo458","log_level":1,"show_user_logs":true,"maximum_runs":1,"multiprocessing":false,"max_processes":15,"validation_condition":"none","conversion_method":"none","validation_method":"text","validation_section":"results['result']","content_match":"","content_match_regex":false,"dict_match":{},"negative_logic":false,"delete_spaces_before_matching":false,"run_method":"per_device","serialized":"dict_values(['', True, 0.0, 'name', True, 'admin.*$', False, 'results[\"success\"] = all(f\"vrf-jinja-{x}\" not in results[\"result\"] for x in range(1, 5))', False, '', False, None, 1, '', '2024-12-26 15:57:21.103891', False, None, '', {}, False, \"name = StringField('Name', [InputRequired()])\\r\\ninitial_payload = DictField()\\r\\ntarget_devices = MultipleInstanceField('Devices', model='device')\\r\\ntarget_pools = MultipleInstanceField('Pools', model='pool')\\r\\ndevice_query = StringField('Device Query', python=True, widget=TextArea(), render_kw={'rows': 2})\\r\\ndevice_query_property = SelectField('Query Property Type', choices=(('name', 'Name'), ('ip_address', 'IP address')))\\r\\nmultiprocessing = BooleanField('Multiprocessing', default=False)\\r\\nmax_processes = IntegerField('Maximum number of processes', default=15)\", 'text', 'default', True, 'password', '', False, False, '', 'iteration_value', False, 'exit', '', 'none', '', True, '[(R) Netmiko Configuration with Jinja2 template] Check VRF deleted', 'username:', False, {}, 'Check VRF deleted', False, {}, 1, 'netmiko_commands_service', None, 0, 'show vrf', '', [], '', 'success', '', True, 10.0, False, False, None, 'any', 'text', False, False, 'none', False, '', False, 'mail', 10.0, 100, '', '', '-OkeEhqllzU', 'name', 'admin', 'success', '', '', False, False, 'per_device', 'Default Value', 10, False, False, 1, '', 15.0, '', '', 'Lx6t8GEo458', \"results['result']\", False, False, 10, 'EOS', 0, 'fb7a3973-bd7e-46bb-afd5-ddab2b0dd11b', '', 'Definition', False, False, False, 0.1, False, False, '', '', False, None, True, 'admin', '', 'ssh jump_server_IP', 'device', '', 'device', 15])","definition":"Definition","reserved":false,"impacting":true,"completion_time":1,"default_uuid":"fb7a3973-bd7e-46bb-afd5-ddab2b0dd11b","mandatory_parameter":"Default Value","admin_only":false,"credentials":"device","custom_username":"","custom_password":"","start_new_connection":false,"connection_name":"default","close_connection":false,"enable_mode":true,"config_mode":false,"commands":"show vrf","jinja2_template":false,"results_as_list":false,"driver":"device","use_textfsm":false,"use_genie":false,"read_timeout":10.0,"conn_timeout":10.0,"auth_timeout":0.0,"banner_timeout":15.0,"global_delay_factor":0.1,"expect_string":"","config_mode_command":"","auto_find_prompt":true,"strip_prompt":true,"strip_command":true,"jump_on_connect":false,"jump_command":"ssh jump_server_IP","jump_username":"","jump_password":"","exit_command":"exit","expect_username_prompt":"username:","expect_password_prompt":"password","expect_prompt":"admin.*$"}]