[
  {
    "admin_only": false,
    "builder_link": "",
    "completion_time": 1,
    "content_match": "",
    "content_match_regex": false,
    "conversion_method": "none",
    "creation_time": "",
    "creator": "admin",
    "credential_type": "any",
    "default_uuid": "b1bebdc2-77c3-48f6-9fb6-c175360c5d32",
    "definition": "Definition",
    "delete_spaces_before_matching": false,
    "description": "Start point of a workflow",
    "device_query": "",
    "device_query_property": "ip_address",
    "dict_match": {},
    "disable_result_creation": false,
    "disabled": false,
    "disabled_info": "",
    "display_only_failed_nodes": true,
    "display_report": false,
    "dry_run": false,
    "email_report": false,
    "high_performance": false,
    "impacting": true,
    "include_device_results": true,
    "include_link_in_summary": true,
    "initial_payload": {},
    "iteration_devices": "",
    "iteration_devices_property": "ip_address",
    "iteration_values": "",
    "iteration_variable_name": "iteration_value",
    "last_modified": "2022-11-09 01:23:32.095885",
    "last_modified_by": "admin",
    "last_run": "",
    "log_level": 1,
    "mail_bcc": "",
    "mail_recipient": "",
    "mail_sender": "",
    "mail_subject": "",
    "mandatory_parameter": "Default Value",
    "mandatory_parametrization": false,
    "max_number_of_retries": 100,
    "max_processes": 5,
    "maximum_runs": 1,
    "multiprocessing": false,
    "name": "[Shared] Start",
    "negative_logic": false,
    "notification_header": "",
    "number_of_retries": 0,
    "operating_system": "",
    "parameterized_form": "name = StringField('Name', [InputRequired()])\ninitial_payload = DictField()\ntarget_devices = MultipleInstanceField('Devices', model='device')\ntarget_pools = MultipleInstanceField('Pools', model='pool')\ndevice_query = StringField('Device Query', python=True, widget=TextArea(), render_kw={'rows': 2})\ndevice_query_property = SelectField('Query Property Type', choices=(('name', 'Name'), ('ip_address', 'IP address')))\nmultiprocessing = BooleanField('Multiprocessing', default=False)\nmax_processes = IntegerField('Maximum number of processes', default=15)",
    "parameterized_form_template": "",
    "persistent_id": "J9O7aylnrb4",
    "postprocessing": "",
    "postprocessing_mode": "always",
    "preprocessing": "",
    "priority": 11,
    "reply_to": "",
    "report": "",
    "report_format": "text",
    "report_jinja2_template": false,
    "reserved": false,
    "restrict_to_owners": [],
    "run_method": "per_device",
    "scoped_name": "Start",
    "send_notification": false,
    "send_notification_method": "mail",
    "serialized": "dict_values(['', 'ip_address', False, '', False, '', True, None, 1, '', '2022-11-09 01:23:32.095885', None, 'Start point of a workflow', {}, True, \"name = StringField('Name', [InputRequired()])\\ninitial_payload = DictField()\\ntarget_devices = MultipleInstanceField('Devices', model='device')\\ntarget_pools = MultipleInstanceField('Pools', model='pool')\\ndevice_query = StringField('Device Query', python=True, widget=TextArea(), render_kw={'rows': 2})\\ndevice_query_property = SelectField('Query Property Type', choices=(('name', 'Name'), ('ip_address', 'IP address')))\\nmultiprocessing = BooleanField('Multiprocessing', default=False)\\nmax_processes = IntegerField('Maximum number of processes', default=15)\", 'text', '', False, '', 'iteration_value', False, '', 'none', '[Shared] Start', True, {}, 'Start', {'(R) Gateway Mechanism (SSH Proxy with Scrapli)': False, 'Dry Run: Top-level Workflow Dry Run': False, 'HTML Reports with Normal Templates': False, '[Dry Run: Subservice and Subworkflow level Dry Run] Dry Run: Top-level Workflow Dry Run': False, '[Dry Run: Subservice and Subworkflow level Dry Run] Non-DR Subworkflow': False, '[Large Workflow with Large Subworkflows] Large Subworkflow': False}, 1, 'swiss_army_knife_service', 0, '', [], '', 'always', True, False, False, None, 'any', 'text', 'none', '', False, 'mail', 100, '', '', 'J9O7aylnrb4', 'ip_address', 'admin', 'success', '', '', True, False, 'per_device', 'Default Value', 10, False, 1, '', '', '', \"results['result']\", False, False, 11, '', 0, 'b1bebdc2-77c3-48f6-9fb6-c175360c5d32', '', 'Definition', False, False, False, False, '', False, None, True, 'admin', '', '', 5])",
    "shared": true,
    "show_user_logs": true,
    "skip": {
      "(R) Gateway Mechanism (SSH Proxy with Scrapli)": false,
      "Dry Run: Top-level Workflow Dry Run": false,
      "HTML Reports with Normal Templates": false,
      "Workflow with large Iteration Query": false,
      "[Dry Run: Subservice and Subworkflow level Dry Run] Dry Run: Top-level Workflow Dry Run": false,
      "[Dry Run: Subservice and Subworkflow level Dry Run] Non-DR Subworkflow": false,
      "[Large Workflow with Large Subworkflows] Large Subworkflow": false
    },
    "skip_query": "",
    "skip_value": "success",
    "soft_deleted": false,
    "time_between_retries": 10,
    "update_target_pools": false,
    "validation_condition": "none",
    "validation_method": "text",
    "validation_section": "results['result']",
    "vendor": "",
    "version": "",
    "waiting_time": 0
  },
  {
    "admin_only": false,
    "builder_link": "",
    "completion_time": 1,
    "content_match": "",
    "content_match_regex": false,
    "conversion_method": "none",
    "creation_time": "",
    "creator": "admin",
    "credential_type": "any",
    "default_uuid": "5ead95a2-fc8b-4821-b503-d64def93d98d",
    "definition": "Definition",
    "delete_spaces_before_matching": false,
    "description": "End point of a workflow",
    "device_query": "",
    "device_query_property": "ip_address",
    "dict_match": {},
    "disable_result_creation": false,
    "disabled": false,
    "disabled_info": "",
    "display_only_failed_nodes": true,
    "display_report": false,
    "dry_run": false,
    "email_report": false,
    "high_performance": false,
    "impacting": true,
    "include_device_results": true,
    "include_link_in_summary": true,
    "initial_payload": {},
    "iteration_devices": "",
    "iteration_devices_property": "ip_address",
    "iteration_values": "",
    "iteration_variable_name": "iteration_value",
    "last_modified": "2022-11-09 01:23:32.207828",
    "last_modified_by": "admin",
    "last_run": "",
    "log_level": 1,
    "mail_bcc": "",
    "mail_recipient": "",
    "mail_sender": "",
    "mail_subject": "",
    "mandatory_parameter": "Default Value",
    "mandatory_parametrization": false,
    "max_number_of_retries": 100,
    "max_processes": 5,
    "maximum_runs": 1,
    "multiprocessing": false,
    "name": "[Shared] End",
    "negative_logic": false,
    "notification_header": "",
    "number_of_retries": 0,
    "operating_system": "",
    "parameterized_form": "name = StringField('Name', [InputRequired()])\ninitial_payload = DictField()\ntarget_devices = MultipleInstanceField('Devices', model='device')\ntarget_pools = MultipleInstanceField('Pools', model='pool')\ndevice_query = StringField('Device Query', python=True, widget=TextArea(), render_kw={'rows': 2})\ndevice_query_property = SelectField('Query Property Type', choices=(('name', 'Name'), ('ip_address', 'IP address')))\nmultiprocessing = BooleanField('Multiprocessing', default=False)\nmax_processes = IntegerField('Maximum number of processes', default=15)",
    "parameterized_form_template": "",
    "persistent_id": "dpc154p2k-U",
    "postprocessing": "",
    "postprocessing_mode": "always",
    "preprocessing": "",
    "priority": 11,
    "reply_to": "",
    "report": "",
    "report_format": "text",
    "report_jinja2_template": false,
    "reserved": false,
    "restrict_to_owners": [],
    "run_method": "per_device",
    "scoped_name": "End",
    "send_notification": false,
    "send_notification_method": "mail",
    "serialized": "dict_values(['', 'ip_address', False, '', False, '', True, None, 1, '', '2022-11-09 01:23:32.207828', None, 'End point of a workflow', {}, True, \"name = StringField('Name', [InputRequired()])\\ninitial_payload = DictField()\\ntarget_devices = MultipleInstanceField('Devices', model='device')\\ntarget_pools = MultipleInstanceField('Pools', model='pool')\\ndevice_query = StringField('Device Query', python=True, widget=TextArea(), render_kw={'rows': 2})\\ndevice_query_property = SelectField('Query Property Type', choices=(('name', 'Name'), ('ip_address', 'IP address')))\\nmultiprocessing = BooleanField('Multiprocessing', default=False)\\nmax_processes = IntegerField('Maximum number of processes', default=15)\", 'text', '', False, '', 'iteration_value', False, '', 'none', '[Shared] End', True, {}, 'End', {'(R) Gateway Mechanism (SSH Proxy with Scrapli)': False, 'Dry Run: Top-level Workflow Dry Run': False, 'HTML Reports with Normal Templates': False, '[Dry Run: Subservice and Subworkflow level Dry Run] Dry Run: Top-level Workflow Dry Run': False, '[Dry Run: Subservice and Subworkflow level Dry Run] Non-DR Subworkflow': False, '[Large Workflow with Large Subworkflows] Large Subworkflow': False}, 1, 'swiss_army_knife_service', 0, '', [], '', 'always', True, False, False, None, 'any', 'text', 'none', '', False, 'mail', 100, '', '', 'dpc154p2k-U', 'ip_address', 'admin', 'success', '', '', True, False, 'per_device', 'Default Value', 10, False, 1, '', '', '', \"results['result']\", False, False, 11, '', 0, '5ead95a2-fc8b-4821-b503-d64def93d98d', '', 'Definition', False, False, False, False, '', False, None, True, 'admin', '', '', 5])",
    "shared": true,
    "show_user_logs": true,
    "skip": {
      "(R) Gateway Mechanism (SSH Proxy with Scrapli)": false,
      "Dry Run: Top-level Workflow Dry Run": false,
      "HTML Reports with Normal Templates": false,
      "Workflow with large Iteration Query": false,
      "[Dry Run: Subservice and Subworkflow level Dry Run] Dry Run: Top-level Workflow Dry Run": false,
      "[Dry Run: Subservice and Subworkflow level Dry Run] Non-DR Subworkflow": false,
      "[Large Workflow with Large Subworkflows] Large Subworkflow": false
    },
    "skip_query": "",
    "skip_value": "success",
    "soft_deleted": false,
    "time_between_retries": 10,
    "update_target_pools": false,
    "validation_condition": "none",
    "validation_method": "text",
    "validation_section": "results['result']",
    "vendor": "",
    "version": "",
    "waiting_time": 0
  },
  {
    "admin_only": false,
    "builder_link": "",
    "completion_time": 1,
    "content_match": "",
    "content_match_regex": false,
    "conversion_method": "none",
    "creation_time": "",
    "creator": "admin",
    "credential_type": "any",
    "default_uuid": "74eee826-e9e4-499e-9742-9ec6bf2818bb",
    "definition": "Definition",
    "delete_spaces_before_matching": false,
    "description": "Monitor eNMS cluster",
    "device_query": "",
    "device_query_property": "ip_address",
    "dict_match": {},
    "disable_result_creation": false,
    "disabled": false,
    "disabled_info": "",
    "display_only_failed_nodes": true,
    "display_report": false,
    "dry_run": false,
    "email_report": false,
    "high_performance": false,
    "impacting": true,
    "include_device_results": true,
    "include_link_in_summary": true,
    "initial_payload": {},
    "iteration_devices": "",
    "iteration_devices_property": "ip_address",
    "iteration_values": "",
    "iteration_variable_name": "iteration_value",
    "last_modified": "2022-11-09 01:23:32.230334",
    "last_modified_by": "admin",
    "last_run": "",
    "log_level": 1,
    "mail_bcc": "",
    "mail_recipient": "",
    "mail_sender": "",
    "mail_subject": "",
    "mandatory_parameter": "Default Value",
    "mandatory_parametrization": false,
    "max_number_of_retries": 100,
    "max_processes": 5,
    "maximum_runs": 1,
    "multiprocessing": false,
    "name": "cluster_monitoring",
    "negative_logic": false,
    "notification_header": "",
    "number_of_retries": 0,
    "operating_system": "",
    "parameterized_form": "name = StringField('Name', [InputRequired()])\ninitial_payload = DictField()\ntarget_devices = MultipleInstanceField('Devices', model='device')\ntarget_pools = MultipleInstanceField('Pools', model='pool')\ndevice_query = StringField('Device Query', python=True, widget=TextArea(), render_kw={'rows': 2})\ndevice_query_property = SelectField('Query Property Type', choices=(('name', 'Name'), ('ip_address', 'IP address')))\nmultiprocessing = BooleanField('Multiprocessing', default=False)\nmax_processes = IntegerField('Maximum number of processes', default=15)",
    "parameterized_form_template": "",
    "persistent_id": "16zQDMf5IOQ",
    "postprocessing": "",
    "postprocessing_mode": "always",
    "preprocessing": "",
    "priority": 11,
    "reply_to": "",
    "report": "",
    "report_format": "text",
    "report_jinja2_template": false,
    "reserved": false,
    "restrict_to_owners": [],
    "run_method": "per_device",
    "scoped_name": "cluster_monitoring",
    "send_notification": false,
    "send_notification_method": "mail",
    "serialized": "dict_values(['', 'ip_address', False, '', False, '', True, None, 1, '', '2022-11-09 01:23:32.230334', None, 'Monitor eNMS cluster', {}, True, \"name = StringField('Name', [InputRequired()])\\ninitial_payload = DictField()\\ntarget_devices = MultipleInstanceField('Devices', model='device')\\ntarget_pools = MultipleInstanceField('Pools', model='pool')\\ndevice_query = StringField('Device Query', python=True, widget=TextArea(), render_kw={'rows': 2})\\ndevice_query_property = SelectField('Query Property Type', choices=(('name', 'Name'), ('ip_address', 'IP address')))\\nmultiprocessing = BooleanField('Multiprocessing', default=False)\\nmax_processes = IntegerField('Maximum number of processes', default=15)\", 'text', '', False, '', 'iteration_value', False, '', 'none', 'cluster_monitoring', False, {}, 'cluster_monitoring', {}, 1, 'swiss_army_knife_service', 0, '', [], '', 'always', True, False, False, None, 'any', 'text', 'none', '', False, 'mail', 100, '', '', '16zQDMf5IOQ', 'ip_address', 'admin', 'success', '', '', True, False, 'per_device', 'Default Value', 10, False, 1, '', '', '', \"results['result']\", False, False, 11, '', 0, '74eee826-e9e4-499e-9742-9ec6bf2818bb', '', 'Definition', False, False, False, False, '', False, None, True, 'admin', '', '', 5])",
    "shared": false,
    "show_user_logs": true,
    "skip": {},
    "skip_query": "",
    "skip_value": "success",
    "soft_deleted": false,
    "time_between_retries": 10,
    "update_target_pools": false,
    "validation_condition": "none",
    "validation_method": "text",
    "validation_section": "results['result']",
    "vendor": "",
    "version": "",
    "waiting_time": 0
  },
  {
    "admin_only": false,
    "builder_link": "",
    "completion_time": 1,
    "content_match": "",
    "content_match_regex": false,
    "conversion_method": "none",
    "creation_time": "",
    "creator": "admin",
    "credential_type": "any",
    "default_uuid": "66191423-8279-4a6c-8d1a-15e38dbe635e",
    "definition": "Definition",
    "delete_spaces_before_matching": false,
    "description": "",
    "device_query": "",
    "device_query_property": "name",
    "dict_match": {},
    "disable_result_creation": false,
    "disabled": false,
    "disabled_info": "",
    "display_only_failed_nodes": false,
    "display_report": false,
    "dry_run": false,
    "email_report": false,
    "high_performance": false,
    "impacting": true,
    "include_device_results": false,
    "include_link_in_summary": false,
    "initial_payload": {},
    "iteration_devices": "",
    "iteration_devices_property": "name",
    "iteration_values": "",
    "iteration_variable_name": "iteration_value",
    "last_modified": "2022-11-09 01:23:32.512277",
    "last_modified_by": "admin",
    "last_run": "",
    "log_level": 1,
    "mail_bcc": "",
    "mail_recipient": "",
    "mail_sender": "",
    "mail_subject": "",
    "mandatory_parameter": "Default Value",
    "mandatory_parametrization": false,
    "max_number_of_retries": 100,
    "max_processes": 15,
    "maximum_runs": 1,
    "multiprocessing": false,
    "name": "[Shared] Placeholder",
    "negative_logic": false,
    "notification_header": "",
    "number_of_retries": 0,
    "operating_system": "",
    "parameterized_form": "name = StringField('Name', [InputRequired()])\ninitial_payload = DictField()\ntarget_devices = MultipleInstanceField('Devices', model='device')\ntarget_pools = MultipleInstanceField('Pools', model='pool')\ndevice_query = StringField('Device Query', python=True, widget=TextArea(), render_kw={'rows': 2})\ndevice_query_property = SelectField('Query Property Type', choices=(('name', 'Name'), ('ip_address', 'IP address')))\nmultiprocessing = BooleanField('Multiprocessing', default=False)\nmax_processes = IntegerField('Maximum number of processes', default=15)",
    "parameterized_form_template": "",
    "persistent_id": "JOyWYAldbUQ",
    "postprocessing": "",
    "postprocessing_mode": "always",
    "preprocessing": "",
    "priority": 11,
    "reply_to": "",
    "report": "",
    "report_format": "text",
    "report_jinja2_template": false,
    "reserved": false,
    "restrict_to_owners": [],
    "run_method": "per_device",
    "scoped_name": "Placeholder",
    "send_notification": false,
    "send_notification_method": "mail",
    "serialized": "dict_values(['', 'name', False, '', False, '', False, None, 1, '', '2022-11-09 01:23:32.512277', None, '', {}, False, \"name = StringField('Name', [InputRequired()])\\ninitial_payload = DictField()\\ntarget_devices = MultipleInstanceField('Devices', model='device')\\ntarget_pools = MultipleInstanceField('Pools', model='pool')\\ndevice_query = StringField('Device Query', python=True, widget=TextArea(), render_kw={'rows': 2})\\ndevice_query_property = SelectField('Query Property Type', choices=(('name', 'Name'), ('ip_address', 'IP address')))\\nmultiprocessing = BooleanField('Multiprocessing', default=False)\\nmax_processes = IntegerField('Maximum number of processes', default=15)\", 'text', '', False, '', 'iteration_value', False, '', 'none', '[Shared] Placeholder', True, {}, 'Placeholder', {}, 1, 'swiss_army_knife_service', 0, '', [], '', 'always', True, False, False, None, 'any', 'text', 'none', '', False, 'mail', 100, '', '', 'JOyWYAldbUQ', 'name', 'admin', 'success', '', '', False, False, 'per_device', 'Default Value', 10, False, 1, '', '', '', \"results['result']\", False, False, 11, '', 0, '66191423-8279-4a6c-8d1a-15e38dbe635e', '', 'Definition', False, False, False, False, '', False, None, True, 'admin', '', '', 15])",
    "shared": true,
    "show_user_logs": true,
    "skip": {},
    "skip_query": "",
    "skip_value": "success",
    "soft_deleted": false,
    "time_between_retries": 10,
    "update_target_pools": false,
    "validation_condition": "none",
    "validation_method": "text",
    "validation_section": "results['result']",
    "vendor": "",
    "version": "",
    "waiting_time": 0
  }
]